name,phone,email,birthdate,birthdate2,address,postalZip,region,country,list,text,numberrange,currency1,currency2,alphanumeric
Sacha Glover,1-955-734-5775,erat@icloud.org,11/24/1979 8:13,11/24/1979,"P.O. Box 402, 5043 Erat Avenue",3659,North-East Region,"Korea, South",9,metus facilisis lorem tristique aliquet. Phasellus fermentum convallis ligula. Donec,1090.5,$249.38 ,249.38,COL61HXK6KK
Cailin Saunders,1-786-557-8513,quam@aol.org,8/9/1996 9:17,8/9/1996,609-1444 Dolor Rd.,483295,South Jeolla,Singapore,7,Maecenas ornare egestas ligula. Nullam feugiat placerat velit. Quisque varius.,920,$321.48 ,321.48,WGH42CRV0PH
Tallulah Chase,(614) 771-6538,at.libero.morbi@outlook.com,3/23/2000 9:12,3/23/2000,"P.O. Box 228, 8104 Et Road",438866,West Region,"Korea, South",13,velit. Pellentesque ultricies dignissim lacus. Aliquam rutrum lorem ac risus.,3221.25,$440.92 ,440.92,FCU42MUY7NU
Plato Ryan,1-825-616-5434,mi.enim@outlook.ca,1/17/1977 8:21,1/17/1977,3271 Nunc Ave,1570,Eastern Visayas,Singapore,5,blandit congue. In scelerisque scelerisque dui. Suspendisse ac metus vitae,2550.75,$439.27 ,439.27,HDH04KXI6EV
Ivory Chavez,(934) 377-8697,ultrices.a@hotmail.net,12/28/2015 9:51,12/28/2015,Ap #304-7694 Adipiscing Ave,5051,North Region,Singapore,5,iaculis odio. Nam interdum enim non nisi. Aenean eget metus.,0,$471.27 ,471.27,XLV98EYG7ZM
Logan Lawrence,(463) 738-0578,at.arcu@protonmail.com,8/2/1976 9:12,8/2/1976,267-1941 Blandit Av.,861237,Eastern Visayas,Philippines,3,"lorem ut aliquam iaculis, lacus pede sagittis augue, eu tempor",1438.5,$201.95 ,201.95,LXG81RDY1RD
Thane Langley,1-686-877-2473,cras.lorem@icloud.couk,3/4/1981 8:27,3/4/1981,5912 Gravida Rd.,965757,Northern Mindanao,Singapore,9,sagittis placerat. Cras dictum ultricies ligula. Nullam enim. Sed nulla,2433,$392.36 ,392.36,GIW99CQB3QS
Kareem Waters,1-256-471-8116,aliquam@icloud.edu,8/26/1994 8:10,8/26/1994,"P.O. Box 401, 5498 Augue Street",2922,North Region,"Korea, South",19,consectetuer adipiscing elit. Curabitur sed tortor. Integer aliquam adipiscing lacus.,0,$77.24 ,77.24,LYG31JOL4XW
Elliott Hawkins,(713) 275-7321,lobortis@yahoo.edu,9/1/2021 9:54,9/1/2021,Ap #323-128 Dolor. St.,2741,North Chungcheong,Philippines,1,"orci, adipiscing non, luctus sit amet, faucibus ut, nulla. Cras",188.25,$343.32 ,343.32,ONI56MTG7LR
Lee Carter,(130) 554-1381,et.eros.proin@outlook.com,1/16/2001 9:42,1/16/2001,330-1099 Eget Av.,2169,National Capital Region,Philippines,3,"venenatis vel, faucibus id, libero. Donec consectetuer mauris id sapien.",230.83,$323.89 ,323.89,POV74DSA9IN
Violet Rivera,(685) 731-1938,cursus.integer@aol.ca,12/15/2009 9:09,12/15/2009,457-8446 Luctus Ave,6787,East Region,Singapore,15,semper tellus id nunc interdum feugiat. Sed nec metus facilisis,616,$241.26 ,241.26,YPW01OXP4VY
Mufutau Wells,1-859-285-4199,ridiculus.mus.aenean@outlook.org,4/1/1985 8:57,4/1/1985,"P.O. Box 626, 3894 Orci. Avenue",14282,West Region,Singapore,3,"nec, diam. Duis mi enim, condimentum eget, volutpat ornare, facilisis",313.25,$214.18 ,214.18,UBX56ZPY7MQ
Castor Carson,1-439-975-1324,interdum@google.com,11/20/2016 8:14,11/20/2016,Ap #744-9418 Curae Av.,674,North Gyeongsang,Singapore,13,"elit. Aliquam auctor, velit eget laoreet posuere, enim nisl elementum",437.67,$318.52 ,318.52,TNG54BUU3RR
Katelyn Taylor,(492) 425-6364,parturient.montes@outlook.net,11/8/2008 9:18,11/8/2008,Ap #255-5772 Tincidunt Ave,14215,Caraga,Philippines,7,quis diam luctus lobortis. Class aptent taciti sociosqu ad litora,2041.5,$473.32 ,473.32,CCG41TCN3KY
Dante Moran,(897) 422-9704,consequat.purus@google.net,6/3/1979 8:07,6/3/1979,Ap #455-9189 Hendrerit Street,348956,North Gyeongsang,"Korea, South",1,sit amet ultricies sem magna nec quam. Curabitur vel lectus.,329.67,$397.07 ,397.07,YQL18NWJ4YV
Garrison Sosa,(975) 463-6310,nam.consequat@google.net,4/19/1994 8:58,4/19/1994,"453-7912 Tempor, Avenue",2342,Central Region,Singapore,9,"Proin nisl sem, consequat nec, mollis vitae, posuere at, velit.",232.83,$115.67 ,115.67,WXT35TWG3ID
Ciara Riddle,1-881-411-3669,convallis.erat.eget@aol.edu,12/5/1993 9:36,12/5/1993,113-5156 Arcu. Rd.,11648,Western Visayas,"Korea, South",9,"ut cursus luctus, ipsum leo elementum sem, vitae aliquam eros",523.83,$55.02 ,55.02,RMT82RWJ7FV
Zorita Rodgers,1-885-112-8238,sed@yahoo.edu,5/13/2012 8:40,5/13/2012,312-8700 Metus St.,2317,South Gyeongsang,Singapore,15,Phasellus dapibus quam quis diam. Pellentesque habitant morbi tristique senectus,2934.17,$388.45 ,388.45,KIE66MVJ3OS
Destiny Fulton,1-238-508-7215,nisi@google.org,7/16/1986 8:37,7/16/1986,"P.O. Box 792, 9701 Leo. St.",11955,South Chungcheong,Philippines,13,"Mauris molestie pharetra nibh. Aliquam ornare, libero at auctor ullamcorper,",778,$320.07 ,320.07,JVM14KKT6HN
Nasim Mcgowan,1-230-441-8419,nunc.in.at@google.com,7/11/2010 9:35,7/11/2010,336-3103 Libero Avenue,14182,Zamboanga Peninsula,Singapore,13,"ut aliquam iaculis, lacus pede sagittis augue, eu tempor erat",754.5,$249.03 ,249.03,PHC53UJF4VI
Donna Mcneil,1-599-358-2152,quisque@google.couk,8/9/2021 8:46,8/9/2021,Ap #439-7328 Cursus Street,1618,Cordillera Administrative Region,"Korea, South",19,Aliquam nisl. Nulla eu neque pellentesque massa lobortis ultrices. Vivamus,23.33,$349.91 ,349.91,ANU67BBE1JE
Emmanuel Burks,(316) 882-2194,et.magnis@google.ca,11/19/2016 9:22,11/19/2016,342-9512 Semper Street,16427,North Chungcheong,"Korea, South",15,in sodales elit erat vitae risus. Duis a mi fringilla,223,$493.62 ,493.62,RFL24TAC2RS
Mercedes Thomas,(362) 822-1903,dolor.elit@yahoo.net,12/1/1972 8:56,12/1/1972,Ap #466-6435 Suspendisse Street,712596,Northern Mindanao,Singapore,17,Aenean gravida nunc sed pede. Cum sociis natoque penatibus et,,$476.49 ,476.49,YYO62WIT2SJ
Petra Howard,1-745-349-1274,suspendisse.sagittis@icloud.org,3/29/1996 8:22,3/29/1996,492-3769 Tellus. Road,11102,North Region,Philippines,3,Nam consequat dolor vitae dolor. Donec fringilla. Donec feugiat metus,1635,$64.07 ,64.07,WIT85MPM5CT
Laurel Bray,1-278-543-5171,aenean.euismod@hotmail.edu,8/2/1982 9:34,8/2/1982,3445 Auctor Avenue,3874,North Chungcheong,Philippines,1,varius. Nam porttitor scelerisque neque. Nullam nisl. Maecenas malesuada fringilla,1167,$147.38 ,147.38,VFD21DTH5CS
Inga Bryant,1-672-798-2673,vel@hotmail.org,8/11/1980 9:32,8/11/1980,Ap #784-6105 Nullam St.,482265,East Region,"Korea, South",7,quis urna. Nunc quis arcu vel quam dignissim pharetra. Nam,344.42,$498.87 ,498.87,NQI64FWI2MM
Patrick Boyle,(322) 352-7721,parturient@yahoo.ca,9/14/1996 9:12,9/14/1996,"P.O. Box 648, 932 Sagittis Ave",3255,North Region,Singapore,15,nascetur ridiculus mus. Proin vel arcu eu odio tristique pharetra.,688.33,$398.37 ,398.37,FHD64JRG4BO
TaShya Maynard,1-114-830-2036,erat.semper.rutrum@protonmail.couk,5/20/2023 9:36,5/20/2023,"P.O. Box 872, 4238 Lacus Street",713363,Northern Mindanao,Philippines,3,Nulla semper tellus id nunc interdum feugiat. Sed nec metus,3501.75,$249.86 ,249.86,WVU52NRD2IF
Malachi Whitehead,(756) 335-2821,fermentum@hotmail.net,9/12/2022 9:44,9/12/2022,Ap #191-2339 Et Avenue,5548,Ilocos Region,Singapore,7,eros. Nam consequat dolor vitae dolor. Donec fringilla. Donec feugiat,553.75,$37.57 ,37.57,WIU38GVK4MM
Hop Parker,(662) 123-0873,nascetur.ridiculus@icloud.com,5/26/1984 9:08,5/26/1984,"2709 Nec, St.",13875,South Jeolla,"Korea, South",9,"libero. Integer in magna. Phasellus dolor elit, pellentesque a, facilisis",1227.5,$129.91 ,129.91,VXY11QCW6KR
Laith Vaughan,(613) 703-1934,at.velit@google.com,12/27/1977 9:46,12/27/1977,"P.O. Box 865, 2384 Justo. St.",949236,Central Visayas,Singapore,3,tortor. Nunc commodo auctor velit. Aliquam nisl. Nulla eu neque,1715.25,$375.23 ,375.23,IEP97PDW9UU
Len Wilkinson,(231) 368-4727,et@outlook.couk,4/15/1995 9:01,4/15/1995,690-6157 Arcu St.,6231,Bangsamoro,Singapore,11,"mi tempor lorem, eget mollis lectus pede et risus. Quisque",49.5,$373.98 ,373.98,SYB89DOY3ES
Ursula Swanson,(295) 376-8641,dictum.eu@icloud.net,6/17/2013 9:13,6/17/2013,765-6080 Eu Road,1648,Cagayan Valley,"Korea, South",15,"odio. Etiam ligula tortor, dictum eu, placerat eget, venenatis a,",,$283.63 ,283.63,RQR54OTF5YQ
Fiona Madden,1-733-751-5352,etiam@yahoo.net,2/6/1991 8:43,2/6/1991,Ap #277-2319 Dolor Rd.,21141,South Jeolla,Singapore,3,et ultrices posuere cubilia Curae Donec tincidunt. Donec vitae erat,2171.17,$386.54 ,386.54,XHQ42MNF1VU
Byron Tillman,(701) 353-5769,dictum.sapien@google.org,12/23/2003 9:29,12/23/2003,"P.O. Box 835, 3027 Aliquam Road",4465,Ilocos Region,Singapore,15,justo sit amet nulla. Donec non justo. Proin non massa,1782.5,$120.39 ,120.39,UQS16OFK4OX
Montana Owen,(813) 777-7175,litora.torquent@icloud.org,6/9/1990 8:26,6/9/1990,"2133 Et, Road",5373,South Chungcheong,Philippines,17,"Donec nibh enim, gravida sit amet, dapibus id, blandit at,",669.33,$160.63 ,160.63,CVC38LOP1FJ
Meredith Winters,1-765-477-3151,duis.mi.enim@protonmail.ca,2/4/2009 8:10,2/4/2009,808 Quam Av.,22301,North Region,"Korea, South",15,volutpat. Nulla facilisis. Suspendisse commodo tincidunt nibh. Phasellus nulla. Integer,327.5,$20.82 ,20.82,IHW94DTF4NL
Charissa Medina,1-941-419-3379,et.netus@outlook.net,10/7/2018 8:27,10/7/2018,Ap #325-2868 Amet Rd.,2115,West Region,"Korea, South",11,"pellentesque massa lobortis ultrices. Vivamus rhoncus. Donec est. Nunc ullamcorper,",1617,$189.86 ,189.86,JQV34HUX0AS
Lester Ewing,1-358-463-4658,nunc@hotmail.edu,7/9/1989 8:58,7/9/1989,"611-4315 Vulputate, Av.",7166,East Region,Singapore,9,turpis. Nulla aliquet. Proin velit. Sed malesuada augue ut lacus.,398,$362.07 ,362.07,NLX20XYL6TB
Lois Christensen,1-754-645-6678,sem.elit@icloud.couk,2/9/1988 9:27,2/9/1988,Ap #203-225 Lectus. Av.,848424,North Region,Singapore,17,ornare egestas ligula. Nullam feugiat placerat velit. Quisque varius. Nam,1531.33,$100.84 ,100.84,PVU45IOB4VS
Kato Tran,(275) 757-5772,mi@hotmail.couk,12/3/1988 8:39,12/3/1988,134-1552 In St.,649742,Gyeonggi,"Korea, South",19,"at auctor ullamcorper, nisl arcu iaculis enim, sit amet ornare",393.75,$198.10 ,198.1,FHY56LQF7UI
Bert Garrett,1-566-204-9719,quisque.imperdiet.erat@outlook.com,10/9/1989 9:37,10/9/1989,Ap #447-3872 Enim. Rd.,10022,Western Visayas,Philippines,13,"sapien, cursus in, hendrerit consectetuer, cursus et, magna. Praesent interdum",1146.33,$114.81 ,114.81,CQU41AIW2JF
Merritt Gallagher,(393) 691-8390,nam@google.org,6/15/1998 9:03,6/15/1998,Ap #336-5004 Interdum. St.,758565,Zamboanga Peninsula,"Korea, South",3,"elementum, lorem ut aliquam iaculis, lacus pede sagittis augue, eu",1744,$198.40 ,198.4,NWR52JDH7IK
Fatima Fry,(690) 534-1389,egestas.a.dui@protonmail.edu,7/21/2011 8:31,7/21/2011,Ap #571-6210 Erat Rd.,6877,North Chungcheong,Philippines,5,"ac metus vitae velit egestas lacinia. Sed congue, elit sed",1443.75,$118.08 ,118.08,RTI22QMU3AY
Otto Keller,1-287-319-5775,eget.massa@outlook.com,5/24/1985 9:49,5/24/1985,Ap #945-4517 Lacinia Ave,396487,East Region,Singapore,7,"rutrum non, hendrerit id, ante. Nunc mauris sapien, cursus in,",155.83,$201.33 ,201.33,XOR60WUJ0HG
Shannon Hardin,(465) 542-3223,proin.vel@protonmail.com,8/14/1988 9:57,8/14/1988,Ap #988-2863 Bibendum. St.,13378,Central Luzon,Philippines,9,"Aliquam auctor, velit eget laoreet posuere, enim nisl elementum purus,",1384.25,$22.11 ,22.11,TVR23MQZ8HH
Kibo Singleton,1-451-196-4269,dapibus.gravida@protonmail.couk,4/22/2019 9:50,4/22/2019,"P.O. Box 711, 457 Mus. Road",26848,Gyeonggi,Singapore,1,"Aliquam tincidunt, nunc ac mattis ornare, lectus ante dictum mi,",178.25,$57.27 ,57.27,UET25GGP1QR
Mariam Mccarty,1-353-332-2994,tempor.augue@icloud.couk,6/5/2020 9:11,6/5/2020,Ap #966-7069 Neque. Street,264814,West Region,Singapore,1,sem eget massa. Suspendisse eleifend. Cras sed leo. Cras vehicula,363.83,$405.27 ,405.27,VSF54WGG7UV
Kathleen Slater,1-976-216-5660,lorem@icloud.com,12/15/2011 8:55,12/15/2011,"P.O. Box 401, 5182 Lectus St.",3545,Bangsamoro,"Korea, South",13,cubilia Curae Phasellus ornare. Fusce mollis. Duis sit amet diam,1309.58,$285.23 ,285.23,KXV63LHH9GI
Katelyn Gallegos,1-427-724-9135,ipsum.porta@icloud.couk,7/7/1988 8:23,7/7/1988,633-4080 Venenatis Street,20256,North Region,"Korea, South",3,"erat, eget tincidunt dui augue eu tellus. Phasellus elit pede,",1534.33,$159.12 ,159.12,QHZ94USO3KQ
Vincent Velez,(703) 557-9618,malesuada.fames@protonmail.edu,6/1/2005 8:12,6/1/2005,Ap #566-5701 Massa St.,16243,Central Region,"Korea, South",5,"cursus in, hendrerit consectetuer, cursus et, magna. Praesent interdum ligula",1020.83,$298.89 ,298.89,QSL84LPV8YY
Wade Rosario,(338) 277-2617,vehicula.risus.nulla@outlook.couk,2/24/2016 8:18,2/24/2016,Ap #199-4248 Semper St.,568886,Caraga,Philippines,11,"mauris ipsum porta elit, a feugiat tellus lorem eu metus.",,$368.57 ,368.57,CUH34XXR4UH
Adele Levine,1-713-417-4160,tristique@aol.couk,8/13/2021 8:18,8/13/2021,7202 Tempor St.,525386,Cordillera Administrative Region,Philippines,9,"Sed congue, elit sed consequat auctor, nunc nulla vulputate dui,",,$196.08 ,196.08,EPC97TMX6VV
Olympia Rowland,1-791-615-6338,scelerisque@protonmail.net,12/18/1997 8:44,12/18/1997,"3489 In, Road",1748,North-East Region,Singapore,7,"tellus, imperdiet non, vestibulum nec, euismod in, dolor. Fusce feugiat.",888.5,$480.23 ,480.23,FEL96KPS3FL
Darius Holcomb,1-767-877-5668,tellus@hotmail.couk,9/29/1982 8:54,9/29/1982,Ap #772-1002 Neque Road,17894,East Region,Singapore,17,"dictum placerat, augue. Sed molestie. Sed id risus quis diam",826.83,$289.54 ,289.54,XRR97WMJ6ZH
Knox Serrano,(803) 363-8965,felis.ullamcorper@aol.edu,7/10/1988 9:02,7/10/1988,6549 Morbi Street,125267,Central Region,"Korea, South",17,enim commodo hendrerit. Donec porttitor tellus non magna. Nam ligula,87.5,$316.37 ,316.37,EGP18NBJ9TK
Cassidy Dillon,(759) 336-0934,turpis.nec.mauris@aol.com,6/28/1999 8:50,6/28/1999,258-4356 Elit Av.,17117,East Region,Singapore,13,"auctor odio a purus. Duis elementum, dui quis accumsan convallis,",127.33,$427.51 ,427.51,HST13NWJ3RH
Yetta Marquez,1-811-318-7832,congue.in@google.org,9/4/2003 9:54,9/4/2003,931-8509 Nunc Rd.,3792,South Chungcheong,Singapore,9,"et magnis dis parturient montes, nascetur ridiculus mus. Aenean eget",0,$369.67 ,369.67,MTU53QIU0YJ
Octavia Benson,(144) 193-1483,luctus@aol.com,7/21/1986 8:00,7/21/1986,376-2842 Fermentum Rd.,15379,North Gyeongsang,Philippines,3,urna. Nunc quis arcu vel quam dignissim pharetra. Nam ac,1656.67,$458.28 ,458.28,HWS50HOV1SN
Abigail Hill,(918) 679-4706,ut.dolor@yahoo.edu,2/18/2002 9:00,2/18/2002,Ap #335-4765 Dis Avenue,7921,North Jeolla,"Korea, South",19,"vel turpis. Aliquam adipiscing lobortis risus. In mi pede, nonummy",940.83,$465.54 ,465.54,RLQ67JSY3YF
McKenzie Cook,(530) 563-7513,ut.odio@outlook.couk,12/27/2011 8:15,12/27/2011,"P.O. Box 313, 5020 Blandit Avenue",672764,North-East Region,"Korea, South",19,"ultricies ligula. Nullam enim. Sed nulla ante, iaculis nec, eleifend",0,$238.80 ,238.8,DQT34AUN1SM
Graiden Cooke,(548) 712-5623,quis.massa@protonmail.com,12/11/2010 8:36,12/11/2010,8593 Sollicitudin St.,554837,Gangwon,Singapore,7,"fringilla mi lacinia mattis. Integer eu lacus. Quisque imperdiet, erat",2336.25,$73.17 ,73.17,ALY42AXN2OP
Nola Michael,(486) 615-4830,sociis.natoque@outlook.edu,5/25/2016 9:33,5/25/2016,Ap #348-3754 Nulla Street,6881,East Region,"Korea, South",13,"hendrerit consectetuer, cursus et, magna. Praesent interdum ligula eu enim.",0,$428.56 ,428.56,UTR01MQZ5HL
Coby Phillips,(256) 136-6130,id.ante.dictum@aol.com,6/8/1972 8:32,6/8/1972,265-1274 Mauris Av.,9338,Central Region,Singapore,1,iaculis odio. Nam interdum enim non nisi. Aenean eget metus.,349.75,$187.27 ,187.27,UFT35BHL2MP
Shaeleigh West,(475) 708-7176,tincidunt.congue.turpis@protonmail.com,3/15/1973 9:02,3/15/1973,"P.O. Box 609, 6582 Blandit Rd.",9214,North Jeolla,Singapore,7,"Fusce diam nunc, ullamcorper eu, euismod ac, fermentum vel, mauris.",2189.25,$285.25 ,285.25,TJX51ZEK2FZ
Hasad Huffman,(581) 480-5263,id.ante@aol.net,12/29/1999 8:20,12/29/1999,1190 Felis Rd.,8171,Central Region,"Korea, South",11,eu sem. Pellentesque ut ipsum ac mi eleifend egestas. Sed,,$421.53 ,421.53,DCP27PLH6TP
Avram Tyler,1-751-895-2071,morbi.metus.vivamus@yahoo.couk,4/17/2020 8:16,4/17/2020,Ap #889-3513 Magna. Rd.,924492,North Chungcheong,Singapore,19,"justo faucibus lectus, a sollicitudin orci sem eget massa. Suspendisse",212,$182.34 ,182.34,ALH54BSV1MR
Hannah Aguilar,1-264-183-7083,volutpat.nunc@hotmail.ca,3/26/2017 9:42,3/26/2017,Ap #698-8905 Ac Rd.,10878,Central Region,Philippines,5,tristique aliquet. Phasellus fermentum convallis ligula. Donec luctus aliquet odio.,1867.5,$403.97 ,403.97,MYW23BRJ5QU
Celeste Lee,1-473-865-5058,purus.accumsan@icloud.ca,8/3/1999 8:41,8/3/1999,Ap #318-3959 Aenean St.,11804,Davao Region,"Korea, South",19,sit amet massa. Quisque porttitor eros nec tellus. Nunc lectus,2415.75,$289.21 ,289.21,LYU56JJD3OF
Ishmael Lang,1-603-398-7502,tortor.nibh@aol.net,4/13/1970 9:15,4/13/1970,Ap #823-7649 Neque Rd.,21686,East Region,Singapore,15,"metus eu erat semper rutrum. Fusce dolor quam, elementum at,",1394,$202.83 ,202.83,GAK18WVQ2QR
Stella Willis,1-698-395-3528,porttitor@google.edu,5/31/1972 8:05,5/31/1972,119-8766 Nullam Avenue,4118,North Jeolla,Singapore,11,"aliquam eu, accumsan sed, facilisis vitae, orci. Phasellus dapibus quam",133.67,$305.41 ,305.41,UUV77ORT9OH
Oscar Gay,(456) 372-5637,ante@outlook.edu,4/25/2005 9:49,4/25/2005,Ap #947-5808 Cum Road,653262,Central Region,"Korea, South",19,"lobortis ultrices. Vivamus rhoncus. Donec est. Nunc ullamcorper, velit in",1638.33,$490.20 ,490.2,EDG24XBL1QK
Zachery Woodward,1-483-385-1644,morbi.sit.amet@outlook.org,4/17/2004 8:29,4/17/2004,"P.O. Box 237, 3798 A Rd.",2365,West Region,"Korea, South",3,"lorem, luctus ut, pellentesque eget, dictum placerat, augue. Sed molestie.",1079.67,$329.15 ,329.15,AMI16MUM3QY
Dante Sharpe,(510) 686-5121,et.lacinia.vitae@protonmail.com,12/19/1998 9:32,12/19/1998,258-7060 At Ave,471614,Cordillera Administrative Region,Philippines,3,Aliquam nisl. Nulla eu neque pellentesque massa lobortis ultrices. Vivamus,1487.5,$495.21 ,495.21,TPD83ISP8JD
Cameron Weiss,1-484-507-7464,nunc.sed.pede@yahoo.net,9/23/2006 9:56,9/23/2006,869-3427 Praesent Rd.,1953,North Chungcheong,Singapore,7,in lobortis tellus justo sit amet nulla. Donec non justo.,905.83,$277.43 ,277.43,IRR91CQJ8HR
Igor Howe,1-470-624-5170,sed.libero@yahoo.couk,4/26/1996 8:16,4/26/1996,Ap #878-5738 Sit Ave,176645,Gangwon,"Korea, South",5,ultricies sem magna nec quam. Curabitur vel lectus. Cum sociis,33.25,$489.76 ,489.76,EWR86XMR4KH
Fritz Strickland,1-678-507-0068,ligula.aenean@icloud.edu,5/15/1974 8:44,5/15/1974,"P.O. Box 536, 7395 Morbi Road",842561,South Gyeongsang,Philippines,11,"est. Nunc ullamcorper, velit in aliquet lobortis, nisi nibh lacinia",901.5,$57.11 ,57.11,CUY01DHI5LO
Breanna Cameron,(755) 574-1242,cras.lorem.lorem@protonmail.couk,9/7/1996 8:53,9/7/1996,570-9072 Quisque Rd.,543536,North-East Region,Philippines,9,"est mauris, rhoncus id, mollis nec, cursus a, enim. Suspendisse",395.33,$80.86 ,80.86,QPB38WMC5GB
Wanda Hogan,(395) 401-8891,vel.convallis.in@aol.couk,7/21/2017 9:48,7/21/2017,"P.O. Box 608, 3823 Aenean Road",3017,West Region,Singapore,13,feugiat. Sed nec metus facilisis lorem tristique aliquet. Phasellus fermentum,3146.25,$459.55 ,459.55,PYC12CFX3ZA
Debra Donaldson,(529) 672-6365,arcu.aliquam@outlook.ca,11/20/1977 9:41,11/20/1977,376-550 Ac Ave,751838,South Chungcheong,"Korea, South",17,erat eget ipsum. Suspendisse sagittis. Nullam vitae diam. Proin dolor.,682.75,$431.24 ,431.24,MTM17BOX8SV
Fritz Lambert,1-149-408-6355,nibh.dolor@icloud.couk,4/22/2013 8:47,4/22/2013,6456 Luctus. Ave,9227,Calabarzon,Philippines,19,facilisi. Sed neque. Sed eget lacus. Mauris non dui nec,2322.67,$133.09 ,133.09,KBX28JCH9HU
Rebecca Maynard,1-291-817-1761,velit.aliquam.nisl@google.couk,5/18/1977 8:57,5/18/1977,"P.O. Box 841, 619 Eget Road",5457,East Region,Philippines,17,malesuada malesuada. Integer id magna et ipsum cursus vestibulum. Mauris,270.58,$222.56 ,222.56,QWD73LFL8AP
Lacey Long,1-487-818-3216,etiam.imperdiet.dictum@aol.org,11/12/1975 8:32,11/12/1975,"P.O. Box 746, 250 Ultrices Ave",12473,North Chungcheong,"Korea, South",3,"ut, pharetra sed, hendrerit a, arcu. Sed et libero. Proin",0,$420.68 ,420.68,XLN56VNI5OO
Richard Ballard,(667) 221-6862,ipsum.ac@protonmail.com,7/17/1998 9:18,7/17/1998,"2312 Et, Av.",6357,North Region,Philippines,1,in felis. Nulla tempor augue ac ipsum. Phasellus vitae mauris,1215.75,$337.54 ,337.54,GZN38HRY1CP
Craig Wiley,(766) 771-3828,fringilla.ornare.placerat@yahoo.ca,2/13/1975 9:43,2/13/1975,Ap #189-9604 Integer Ave,14177,Bangsamoro,Philippines,5,Phasellus in felis. Nulla tempor augue ac ipsum. Phasellus vitae,270.42,$13.69 ,13.69,FLP36ZHM3XB
Hedley Owen,1-785-601-6764,dolor.dapibus@hotmail.couk,2/23/2009 9:27,2/23/2009,Ap #310-8968 Morbi Av.,6940,Southwestern Tagalog Region,Philippines,3,tincidunt pede ac urna. Ut tincidunt vehicula risus. Nulla eget,203.67,$456.78 ,456.78,XKJ77TDW0GL
Rachel Morrison,1-723-578-5752,phasellus.vitae.mauris@aol.edu,3/3/2016 9:13,3/3/2016,812-8548 Convallis Av.,676836,North-East Region,Singapore,7,"blandit viverra. Donec tempus, lorem fringilla ornare placerat, orci lacus",102.67,$239.04 ,239.04,VTD09QSG8IW
Martena Thomas,(633) 263-3137,nec.ligula@hotmail.ca,1/6/2022 8:57,1/6/2022,"3751 Elit, Street",8047,Calabarzon,Philippines,15,"at lacus. Quisque purus sapien, gravida non, sollicitudin a, malesuada",,$72.77 ,72.77,QXM88PIS6FV
Jordan Carson,(917) 318-6150,amet.ante.vivamus@hotmail.ca,7/5/2023 8:19,7/5/2023,340-5615 Suspendisse Avenue,9224,Gyeonggi,Philippines,19,ac arcu. Nunc mauris. Morbi non sapien molestie orci tincidunt,3399.75,$436.34 ,436.34,LJY18KGD8LY
Hedley Cook,1-580-684-1368,eros.turpis@yahoo.ca,11/15/1979 8:47,11/15/1979,Ap #571-3115 Vivamus Street,754,East Region,"Korea, South",9,Sed nec metus facilisis lorem tristique aliquet. Phasellus fermentum convallis,653,$43.38 ,43.38,QOK65ADN6CY
Stephen Bender,(615) 618-1455,blandit.viverra@aol.ca,1/3/1991 9:16,1/3/1991,666-6075 Cras Rd.,11774,Central Region,"Korea, South",7,"felis orci, adipiscing non, luctus sit amet, faucibus ut, nulla.",1275.75,$85.24 ,85.24,ZHL60MDP0CH
Uriel Combs,1-696-536-3074,magna.nec.quam@protonmail.com,2/24/2016 9:38,2/24/2016,Ap #845-5632 Lacinia. Rd.,3975,Northern Mindanao,Philippines,11,"ac mattis velit justo nec ante. Maecenas mi felis, adipiscing",0,$415.72 ,415.72,ESS25IWG3IH
Kerry Woodward,(366) 216-2379,ipsum@aol.org,4/1/2020 8:48,4/1/2020,Ap #612-2151 Et Ave,427514,North-East Region,Singapore,19,"vitae sodales nisi magna sed dui. Fusce aliquam, enim nec",2458,$66.20 ,66.2,WPD68QWG6UX
Ila Franco,1-342-619-2927,molestie.tellus@hotmail.com,8/26/1980 8:42,8/26/1980,Ap #231-761 Est Avenue,7810,South Chungcheong,Singapore,19,"amet, risus. Donec nibh enim, gravida sit amet, dapibus id,",617.17,$190.40 ,190.4,JFY20DNP6QR
Reese Brady,1-284-520-2548,varius.et@aol.net,9/16/2015 8:52,9/16/2015,4095 Sapien Avenue,448765,Jeju,Singapore,13,Nulla interdum. Curabitur dictum. Phasellus in felis. Nulla tempor augue,845,$52.24 ,52.24,GMO31PSC5RN
Heather Gould,1-612-522-8425,vivamus.molestie.dapibus@google.net,9/4/2020 8:38,9/4/2020,410-9996 Non Rd.,655936,Caraga,Singapore,13,nunc. Quisque ornare tortor at risus. Nunc ac sem ut,0,$17.56 ,17.56,SCZ96XLN2IG
Hanna Fuller,(410) 108-5367,lorem.vitae.odio@hotmail.ca,2/8/1983 9:32,2/8/1983,4757 Aenean Rd.,366824,North Jeolla,Philippines,5,est arcu ac orci. Ut semper pretium neque. Morbi quis,175,$232.23 ,232.23,EZV95IPW7TZ
Hakeem Velasquez,1-125-895-1856,bibendum.sed.est@google.org,3/6/1982 8:54,3/6/1982,Ap #725-1079 Morbi Road,14722,Cordillera Administrative Region,Singapore,7,"Aliquam nec enim. Nunc ut erat. Sed nunc est, mollis",748.33,$233.97 ,233.97,ENI93XFR4YQ
Cedric Franco,1-655-859-1661,sed.molestie@protonmail.com,11/3/1983 8:15,11/3/1983,380-4431 Convallis Av.,384665,North Region,"Korea, South",5,arcu. Vestibulum ante ipsum primis in faucibus orci luctus et,21.67,$442.82 ,442.82,TZC65GRG5WV
Josephine Blackwell,(578) 736-4665,ipsum.suspendisse.non@hotmail.org,10/5/2017 8:17,10/5/2017,"P.O. Box 694, 4459 Magnis Rd.",3353,North Jeolla,"Korea, South",13,"est mauris, rhoncus id, mollis nec, cursus a, enim. Suspendisse",1018,$5.05 ,5.05,BPU64HVC4GW
Marshall Russo,(223) 741-8356,sollicitudin@hotmail.ca,6/21/1970 9:52,6/21/1970,259-7131 Gravida Street,1012,Soccsksargen,Singapore,1,massa rutrum magna. Cras convallis convallis dolor. Quisque tincidunt pede,276.67,$404.77 ,404.77,PUX47TEX6TI
Kimberley Meyers,1-236-333-6534,quisque.varius.nam@hotmail.org,11/11/2005 9:27,11/11/2005,Ap #934-6772 Lorem Road,15972,Central Luzon,Singapore,13,"ullamcorper, nisl arcu iaculis enim, sit amet ornare lectus justo",117.5,$482.81 ,482.81,MHO91PMQ3LP
Aristotle Booker,(933) 769-7108,tellus.non@google.com,3/31/1981 8:51,3/31/1981,Ap #132-5586 Dictum Rd.,8319,North Gyeongsang,Singapore,1,"eget, dictum placerat, augue. Sed molestie. Sed id risus quis",386.17,$360.79 ,360.79,GPU47FIS5KR
Larissa Rivers,(511) 716-4337,ut.sem.nulla@icloud.com,10/28/1979 8:05,10/28/1979,"2796 Orci, Rd.",476782,Davao Region,Philippines,3,Donec sollicitudin adipiscing ligula. Aenean gravida nunc sed pede. Cum,1852.67,$117.19 ,117.19,LGS16TDM7EM
Lillian Curry,(710) 726-7451,in.faucibus@hotmail.net,4/22/1995 8:21,4/22/1995,972-2685 Pellentesque Street,797582,Eastern Visayas,Singapore,1,Duis dignissim tempor arcu. Vestibulum ut eros non enim commodo,93,$180.51 ,180.51,VTH05XXF8RB
Sawyer Lynn,(460) 616-1898,nunc.nulla.vulputate@outlook.edu,6/1/1972 9:15,6/1/1972,"531-9471 Eu, Avenue",2117,North-East Region,Singapore,17,"aliquet, metus urna convallis erat, eget tincidunt dui augue eu",1086.75,$329.84 ,329.84,TOZ15RLM7UM
Knox Vang,1-387-255-6197,elementum.dui.quis@aol.com,10/24/2016 8:46,10/24/2016,Ap #832-7761 Donec Rd.,17245,West Region,Philippines,7,"Phasellus elit pede, malesuada vel, venenatis vel, faucibus id, libero.",34.67,$299.43 ,299.43,FDC04XNO3ID
Lois Lawson,1-764-968-6340,auctor@outlook.com,11/29/1971 9:43,11/29/1971,"Ap #662-9060 Odio, Ave",553745,Central Region,Singapore,3,"ut dolor dapibus gravida. Aliquam tincidunt, nunc ac mattis ornare,",,$325.23 ,325.23,SVR20JQE6QS
