name,phone,email,birthdate,address,postalZip,region,country,list,text,numberrange,currency,alphanumeric
Gretchen Rojas,(237) 313-6388,odio@hotmail.com,12/5/1991 05:51:48,Ap #665-5424 Pretium Rd.,177526,East Region,"Korea, South",15,"ac metus vitae velit egestas lacinia. Sed congue, elit sed",768,$496.08 ,VQF71GIW7DD
Odessa Butler,(317) 271-8865,euismod.enim.etiam@yahoo.com,06/12/2008 01:15:32,465-1373 Dui Street,18038,Gangwon,Singapore,9,"Fusce mi lorem, vehicula et, rutrum eu, ultrices sit amet,",2142,$37.04 ,VLQ11NTE5IF
Bo Ochoa,(328) 354-2488,nibh.donec.est@outlook.ca,07/18/1975 04:01:21,195-6505 Nunc Av.,14753,South Gyeongsang,Philippines,3,id nunc interdum feugiat. Sed nec metus facilisis lorem tristique,515,$192.24 ,MUP24LIF1XD
Yuli Campos,1-177-766-7184,ut.mi.duis@hotmail.org,10/4/2018 05:11:34,7118 Massa Road,845554,East Region,Singapore,17,convallis dolor. Quisque tincidunt pede ac urna. Ut tincidunt vehicula,2085,$278.85 ,UVH38IRU2FM
Merrill Hull,1-576-668-1228,elit.sed@hotmail.org,01/13/1977 03:00:39,6023 Egestas. Rd.,10252,South Gyeongsang,Philippines,13,"nec, euismod in, dolor. Fusce feugiat. Lorem ipsum dolor sit",4262,$184.27 ,OIX74KYM1VT
Olympia Hogan,(284) 577-2340,aenean.eget.metus@icloud.net,10/21/1993 02:20:51,Ap #913-4156 Nam St.,6526,East Region,Singapore,3,"Morbi neque tellus, imperdiet non, vestibulum nec, euismod in, dolor.",1032,$327.82 ,YVO37MDU0SC
Larissa Foreman,1-613-921-3198,blandit@hotmail.edu,10/29/1992 05:30:21,"1080 Eget, Avenue",873953,North-East Region,Singapore,11,"enim. Nunc ut erat. Sed nunc est, mollis non, cursus",2563,$453.37 ,OHX55FSJ8TK
Mollie Bauer,(777) 902-9719,praesent.eu.dui@hotmail.org,11/10/1997 02:01:11,Ap #552-1301 Suspendisse Rd.,2451,Southwestern Tagalog Region,"Korea, South",19,"sem semper erat, in consectetuer ipsum nunc id enim. Curabitur",539,$487.00 ,PKF81GSQ3KV
Ava Day,1-200-644-2003,faucibus.orci@google.edu,07/31/1979 05:48:15,521-8324 Quis Avenue,15464,West Region,"Korea, South",9,Suspendisse tristique neque venenatis lacus. Etiam bibendum fermentum metus. Aenean,974,$127.37 ,CMR57VWB3MF
Armand Jarvis,1-788-501-3639,dictum.augue@outlook.edu,12/8/1992 02:58:49,"616-9921 Mauris, Rd.",858,Central Region,Philippines,17,"sed sem egestas blandit. Nam nulla magna, malesuada vel, convallis",3501,$358.73 ,EJS30RRX2QU
Grace Marsh,(716) 514-6233,suspendisse@google.com,09/13/1982 00:43:03,1623 Luctus Street,6534,North Jeolla,"Korea, South",19,"tempor, est ac mattis semper, dui lectus rutrum urna, nec",4341,$213.55 ,HLC59RNX8HZ
Boris Lynn,(868) 706-4379,ipsum.cursus.vestibulum@aol.com,02/16/2010 01:22:35,"P.O. Box 579, 7123 Nec Ave",678544,East Region,Singapore,7,sagittis. Duis gravida. Praesent eu nulla at sem molestie sodales.,3057,$26.68 ,IRD86CCL1EU
Blossom Price,(630) 881-4752,nulla.in@outlook.net,02/15/1995 04:59:57,Ap #650-2019 Vitae Rd.,185482,Southwestern Tagalog Region,Philippines,19,"vulputate, risus a ultricies adipiscing, enim mi tempor lorem, eget",3283,$228.34 ,IGS40WPF3FG
Nehru Bates,1-173-726-9857,cursus@icloud.couk,11/14/2009 23:25:10,8276 Augue Road,4458,East Region,Singapore,7,"eu, accumsan sed, facilisis vitae, orci. Phasellus dapibus quam quis",807,$13.71 ,WGM93QEI8CX
Graham Marshall,(478) 436-2577,ante@outlook.ca,06/21/2001 23:47:35,"P.O. Box 952, 5327 Facilisis Rd.",27939,North-East Region,"Korea, South",17,"aliquet diam. Sed diam lorem, auctor quis, tristique ac, eleifend",3988,$212.52 ,ASA23GLU7NU
Hoyt Jordan,(836) 737-8619,risus@outlook.org,06/1/1995 23:41:43,819-2940 In Road,228838,South Jeolla,Philippines,9,"laoreet ipsum. Curabitur consequat, lectus sit amet luctus vulputate, nisi",3130,$95.62 ,XTW68ENA9KG
Orson Butler,1-361-916-8768,lobortis.tellus@yahoo.edu,05/26/1985 23:42:34,105-3673 Sed Rd.,29640,Gyeonggi,Philippines,13,"consectetuer adipiscing elit. Etiam laoreet, libero et tristique pellentesque, tellus",3728,$149.91 ,WEG53TGC5OI
Simon Gibbs,(275) 234-2823,integer@hotmail.ca,12/8/1974 01:02:13,813-8565 Scelerisque Ave,13658,Bangsamoro,Singapore,3,nunc sed libero. Proin sed turpis nec mauris blandit mattis.,3492,$247.18 ,FFP82TSL4TH
Ivor Garrison,1-219-674-7424,feugiat@yahoo.org,10/31/1997 03:36:01,6971 Vestibulum Street,863584,East Region,Philippines,13,"vehicula aliquet libero. Integer in magna. Phasellus dolor elit, pellentesque",3769,$19.29 ,VGS27NGV3LJ
Walker Rush,(802) 513-5436,ornare.in.faucibus@hotmail.edu,10/9/2020 05:44:39,"Ap #391-5287 Est, Rd.",8207,Davao Region,Philippines,3,"ipsum leo elementum sem, vitae aliquam eros turpis non enim.",3963,$287.85 ,YXU56QXA8ET
Luke Alvarez,1-863-510-3515,risus@icloud.com,12/2/1997 04:57:08,"Ap #784-6728 Cursus, Street",14358,East Region,Singapore,13,diam. Pellentesque habitant morbi tristique senectus et netus et malesuada,3725,$211.76 ,WLM27LKH1OO
Jaime Michael,(886) 146-4469,sed@protonmail.com,01/30/2004 03:33:21,303-1250 Bibendum Av.,6893,West Region,Singapore,7,"bibendum. Donec felis orci, adipiscing non, luctus sit amet, faucibus",109,$167.23 ,EWR81YUC1CX
Samson Giles,1-415-500-6937,pellentesque.ultricies@hotmail.couk,05/24/2008 03:36:05,"P.O. Box 589, 3655 Ligula St.",523734,North Chungcheong,"Korea, South",17,eu tempor erat neque non quam. Pellentesque habitant morbi tristique,4619,$449.08 ,SFP39WPW7MG
Vera Durham,1-581-705-3720,semper.et@hotmail.net,04/22/2015 04:47:02,4075 Erat St.,3387,West Region,"Korea, South",9,ipsum cursus vestibulum. Mauris magna. Duis dignissim tempor arcu. Vestibulum,2757,$462.20 ,EUQ44UQZ9JT
Dane Gould,1-143-378-3854,est.ac@yahoo.couk,08/9/1985 00:33:25,Ap #731-799 Habitant Ave,151396,Caraga,Singapore,1,"velit egestas lacinia. Sed congue, elit sed consequat auctor, nunc",1311,$243.03 ,VKS74PIO5GO
Cole Conner,(342) 455-7761,auctor@hotmail.edu,11/9/1971 01:51:08,650-5868 Proin Road,283338,Gyeonggi,Philippines,17,"metus. In lorem. Donec elementum, lorem ut aliquam iaculis, lacus",855,$289.63 ,LBS48WNN7QR
Yardley Nelson,1-419-603-1605,et.commodo@outlook.com,12/28/1978 00:05:20,569-2184 Mi St.,941385,North Chungcheong,"Korea, South",3,purus. Nullam scelerisque neque sed sem egestas blandit. Nam nulla,1461,$468.74 ,ZOZ85TXR2WG
Chancellor West,1-199-897-8044,maecenas.malesuada@icloud.com,03/18/1991 02:29:04,"Ap #493-3534 Vitae, St.",2856,National Capital Region,Philippines,13,"Nunc sollicitudin commodo ipsum. Suspendisse non leo. Vivamus nibh dolor,",3561,$269.60 ,VWW18PJA8MY
Lacey Lara,(557) 262-8234,venenatis@aol.com,04/21/2004 23:51:27,"2709 Eget, St.",232352,Central Region,"Korea, South",9,"pede. Suspendisse dui. Fusce diam nunc, ullamcorper eu, euismod ac,",2491,$56.30 ,CMY66XTH8YO
Quail Cote,(876) 475-1892,sodales.elit@google.com,01/16/2004 01:17:32,297-2312 Lorem Av.,633517,Bicol Region,Singapore,1,Vestibulum ut eros non enim commodo hendrerit. Donec porttitor tellus,3780,$60.12 ,MVI15JGC1JJ
Haley Lynch,1-433-547-2432,donec@aol.couk,07/18/2013 03:39:07,Ap #704-4895 Ante Street,787285,South Jeolla,Singapore,19,nec metus facilisis lorem tristique aliquet. Phasellus fermentum convallis ligula.,1265,$235.92 ,PSW63RLY3KC
Nerea Gates,(365) 232-3077,sed.et.libero@aol.couk,12/17/2006 05:34:39,730-1413 Rhoncus Avenue,13786,Bangsamoro,"Korea, South",17,cursus. Integer mollis. Integer tincidunt aliquam arcu. Aliquam ultrices iaculis,1122,$257.35 ,SHX21IIP0MI
Isadora Roberson,1-662-151-6976,duis.cursus@aol.couk,05/21/2008 05:40:53,758-9602 Interdum Rd.,623483,South Gyeongsang,Philippines,1,vitae mauris sit amet lorem semper auctor. Mauris vel turpis.,903,$329.23 ,QQV25EIN2LE
Vance Church,1-581-437-3224,ac.urna@hotmail.com,06/19/1991 00:56:00,"Ap #926-673 Imperdiet, Street",553633,Bangsamoro,"Korea, South",9,"Phasellus dolor elit, pellentesque a, facilisis non, bibendum sed, est.",4178,$4.91 ,QGT66HVG4MX
Vielka Morin,(753) 633-2560,ornare.sagittis@icloud.org,04/28/1970 01:14:22,Ap #758-2179 Lacinia Rd.,8778,Gangwon,Philippines,13,molestie. Sed id risus quis diam luctus lobortis. Class aptent,1862,$479.32 ,MBC82QLC7LC
Berk Olson,1-234-568-7824,quis@outlook.edu,08/10/2011 05:35:17,"P.O. Box 626, 4529 Et, Rd.",8504,Central Region,Singapore,15,"dapibus rutrum, justo. Praesent luctus. Curabitur egestas nunc sed libero.",2702,$236.53 ,CFR13WKK6JV
Anjolie Allison,1-484-665-2303,nostra.per.inceptos@icloud.ca,10/16/1991 03:13:40,563-5380 Sed St.,2934,West Region,Singapore,17,metus. Aliquam erat volutpat. Nulla facilisis. Suspendisse commodo tincidunt nibh.,3669,$117.54 ,CQO52PTY1DI
Brielle Foreman,1-812-315-1263,ultrices.posuere.cubilia@google.couk,08/14/1994 22:59:44,Ap #635-9630 Donec Avenue,4498,North Gyeongsang,"Korea, South",1,non lorem vitae odio sagittis semper. Nam tempor diam dictum,3007,$162.59 ,PVR43YEJ5OR
Pearl Grimes,1-417-712-2461,donec@hotmail.org,02/25/1999 02:20:07,"P.O. Box 827, 3799 Nisi. Ave",4604,Gangwon,Singapore,11,"faucibus leo, in lobortis tellus justo sit amet nulla. Donec",1288,$439.99 ,GDW59CII2CC
Giselle Cline,(767) 173-6586,dolor.tempus@aol.ca,09/10/2013 04:23:06,Ap #131-8370 Ultrices. Road,831524,North Chungcheong,Singapore,19,"orci tincidunt adipiscing. Mauris molestie pharetra nibh. Aliquam ornare, libero",1388,$246.29 ,UJT27HEL2RA
Claire Santiago,(728) 246-7126,et.euismod.et@hotmail.com,03/9/2010 23:36:10,Ap #956-5055 Et Rd.,19046,West Region,Singapore,3,"nibh. Aliquam ornare, libero at auctor ullamcorper, nisl arcu iaculis",1932,$288.28 ,JDG71MLC1HS
Kelsey Baker,(563) 345-6245,mi.duis@yahoo.org,11/21/2015 04:40:23,175 Felis Ave,8181,Cordillera Administrative Region,"Korea, South",15,"metus. In lorem. Donec elementum, lorem ut aliquam iaculis, lacus",3448,$443.44 ,RWR03NGY4IF
Melissa Sharpe,1-861-765-2618,tincidunt@yahoo.net,12/11/2014 05:33:15,360-5102 Est Av.,667857,North-East Region,Philippines,9,elit. Nulla facilisi. Sed neque. Sed eget lacus. Mauris non,255,$94.72 ,CFY49AOP2QN
Carter Hood,(564) 273-1385,aliquam.nec@hotmail.org,07/14/2011 00:39:17,"P.O. Box 885, 7336 Ipsum Avenue",15148,North Region,Singapore,3,"vulputate eu, odio. Phasellus at augue id ante dictum cursus.",4070,$66.23 ,IRD22UOH8XJ
Jesse Hull,(210) 472-9892,quam@google.ca,04/23/1977 23:48:25,Ap #986-4157 Eleifend Road,976244,Cordillera Administrative Region,Singapore,17,"convallis ligula. Donec luctus aliquet odio. Etiam ligula tortor, dictum",777,$110.46 ,VTZ88NPI3DT
Raymond Alexander,1-228-644-8382,vel.vulputate@hotmail.net,11/25/1979 05:25:02,838-4365 Eros. St.,1525,North Jeolla,Philippines,5,"purus ac tellus. Suspendisse sed dolor. Fusce mi lorem, vehicula",3850,$287.25 ,UZF91CWK7PR
Florence Goodwin,(273) 626-9757,neque@hotmail.ca,11/21/1983 03:56:09,6573 Velit. Road,224,East Region,"Korea, South",9,"et tristique pellentesque, tellus sem mollis dui, in sodales elit",2744,$373.60 ,LZU82FZE4MK
Nell Harvey,(552) 744-3822,egestas@aol.net,12/21/2007 03:04:23,835-3757 Sit St.,8987,South Gyeongsang,Singapore,15,"nec, imperdiet nec, leo. Morbi neque tellus, imperdiet non, vestibulum",2910,$159.10 ,WHD96WWT2YM
Kirk Rollins,(543) 418-1325,est.nunc@icloud.edu,05/14/2002 04:22:18,684-7085 Eu St.,5338,Soccsksargen,Philippines,13,"elementum, lorem ut aliquam iaculis, lacus pede sagittis augue, eu",4485,$346.38 ,GOM70WSL3CL
Rogan Dejesus,1-272-582-8768,ut@icloud.net,12/19/1971 00:40:04,Ap #350-3179 Rutrum Road,6555,North Gyeongsang,Singapore,5,sagittis lobortis mauris. Suspendisse aliquet molestie tellus. Aenean egestas hendrerit,3436,$123.11 ,XZF21KQT1CW
Branden Bowers,(305) 560-8318,quam.curabitur@hotmail.edu,04/26/2015 04:50:39,879-2145 Arcu. Avenue,1717,North Chungcheong,"Korea, South",17,"parturient montes, nascetur ridiculus mus. Aenean eget magna. Suspendisse tristique",742,$342.19 ,TAD82NPZ3TE
Kaseem Jacobs,(226) 122-5343,proin.non@protonmail.org,01/4/1976 05:55:27,Ap #867-7192 Fusce Av.,762162,Gyeonggi,"Korea, South",9,in faucibus orci luctus et ultrices posuere cubilia Curae Phasellus,2365,$481.78 ,ZQP24SRU7LJ
Hiroko Ray,(366) 850-5145,et.arcu@google.org,02/29/1988 02:40:04,965-7340 Lectus Ave,16400,Western Visayas,"Korea, South",13,tempor augue ac ipsum. Phasellus vitae mauris sit amet lorem,4054,$273.15 ,LOM06HXM5VC
Kadeem Mcpherson,1-768-638-3584,posuere.cubilia@icloud.com,03/6/2000 01:45:06,"Ap #465-7986 Non, Av.",4556,North-East Region,Singapore,5,Morbi non sapien molestie orci tincidunt adipiscing. Mauris molestie pharetra,90,$182.92 ,FUC50RJA4CC
Ulla Hines,(563) 306-4632,ac.mattis@google.net,01/1/2022 02:22:30,244-6186 Lorem Rd.,814931,Central Luzon,Philippines,13,"Maecenas mi felis, adipiscing fringilla, porttitor vulputate, posuere vulputate, lacus.",3972,$310.47 ,HBV75MLY0EI
Darrel Curry,1-953-806-3648,vitae.diam.proin@outlook.com,09/18/1993 02:31:46,"Ap #476-7563 Nec, Rd.",745838,West Region,"Korea, South",7,"Donec elementum, lorem ut aliquam iaculis, lacus pede sagittis augue,",698,$448.55 ,QPN06JTA5VG
Pamela Talley,(645) 514-8174,eu.placerat@yahoo.couk,12/14/1981 04:20:07,Ap #909-6265 Odio. Rd.,3228,Jeju,Philippines,1,pede blandit congue. In scelerisque scelerisque dui. Suspendisse ac metus,4696,$383.64 ,GFF42NEH6JF
Blossom Velazquez,(559) 846-5035,tincidunt.orci.quis@google.ca,10/14/1986 01:52:20,110-968 Duis Rd.,821537,North Chungcheong,"Korea, South",3,Nunc quis arcu vel quam dignissim pharetra. Nam ac nulla.,2029,$448.87 ,GKI04VJA6JV
Macy Decker,(319) 840-5508,vel.quam@aol.com,04/21/2005 04:41:28,3062 Rhoncus Av.,254221,South Gyeongsang,Philippines,5,"dictum mi, ac mattis velit justo nec ante. Maecenas mi",4360,$398.07 ,SBY63KST8AW
Kameko Gallegos,(636) 553-6043,dolor.elit@aol.com,09/1/2020 04:51:54,423-5169 Eget Road,13518,Central Region,Philippines,17,"feugiat tellus lorem eu metus. In lorem. Donec elementum, lorem",954,$180.12 ,GIN77FJW6SO
Lyle Mendoza,1-604-273-6382,eros.nam@yahoo.couk,11/28/2019 02:45:27,Ap #521-9885 Cum Ave,684,South Gyeongsang,"Korea, South",3,"justo. Proin non massa non ante bibendum ullamcorper. Duis cursus,",1265,$422.72 ,BYN11HUG6HN
Joelle Joyner,1-452-515-6821,cursus.et@aol.couk,03/10/1972 23:09:21,105-1482 Lobortis Ave,28746,Bangsamoro,Singapore,7,ipsum non arcu. Vivamus sit amet risus. Donec egestas. Aliquam,540,$97.71 ,VYQ62TNQ6WW
Jael Stuart,1-351-658-3191,elementum.dui@google.ca,09/16/2014 04:31:52,"5347 Aliquam, Road",5844,North Chungcheong,"Korea, South",13,"diam nunc, ullamcorper eu, euismod ac, fermentum vel, mauris. Integer",4451,$121.37 ,VQQ24QJD6FJ
Bell Eaton,1-371-355-2456,donec.tempus@yahoo.ca,08/13/1970 03:38:27,Ap #653-5555 Magna Av.,5105,North-East Region,Philippines,9,"Duis at lacus. Quisque purus sapien, gravida non, sollicitudin a,",1944,$409.63 ,VEU40XQT5IF
Hilel Lowe,(527) 384-1971,sit.amet@hotmail.net,07/17/1978 02:26:50,620-1693 Fames Rd.,5645,Central Luzon,"Korea, South",15,"tempor, est ac mattis semper, dui lectus rutrum urna, nec",1782,$97.87 ,RBD95GYX1VY
Owen Chase,(882) 630-7844,cursus@google.org,12/25/2004 00:13:48,"Ap #773-1681 Eleifend, Av.",666154,South Gyeongsang,Singapore,1,"commodo hendrerit. Donec porttitor tellus non magna. Nam ligula elit,",3439,$418.09 ,OKI31MGV2SK
Sebastian Lawrence,1-722-832-3380,risus.nunc.ac@outlook.org,02/28/2013 04:46:38,"Ap #799-8431 Pede, Av.",1815,Central Visayas,Singapore,7,"tincidunt, neque vitae semper egestas, urna justo faucibus lectus, a",2314,$134.77 ,YWM47SEC9BY
Tyrone Reynolds,1-486-318-8228,elementum.lorem@icloud.couk,10/28/2007 23:05:17,8823 Felis Ave,438141,North Region,Philippines,7,arcu. Aliquam ultrices iaculis odio. Nam interdum enim non nisi.,4617,$380.63 ,WJS41WQE7AZ
Demetria Solis,1-142-677-8656,praesent.eu@aol.edu,09/17/2020 02:07:43,Ap #524-1227 A Rd.,587864,Central Luzon,"Korea, South",17,"Aliquam nec enim. Nunc ut erat. Sed nunc est, mollis",2916,$396.89 ,QZN35YYN5EF
Jonas Morales,(787) 360-0374,leo.vivamus@outlook.org,06/26/2017 00:08:44,"P.O. Box 529, 3859 Magna Av.",11570,Cagayan Valley,Philippines,3,primis in faucibus orci luctus et ultrices posuere cubilia Curae,1468,$323.37 ,HKW39XGH6BT
Hilel Barron,(572) 645-4825,curae.donec@aol.couk,01/8/1998 05:52:28,Ap #640-4628 A St.,4702,Cagayan Valley,Singapore,1,eu tellus eu augue porttitor interdum. Sed auctor odio a,2298,$363.53 ,UWX94NMI5ND
Fay Vinson,(568) 975-1211,velit@outlook.couk,02/27/2013 01:18:09,Ap #432-8698 Luctus. Rd.,2250,Southwestern Tagalog Region,"Korea, South",13,"mauris, rhoncus id, mollis nec, cursus a, enim. Suspendisse aliquet,",3785,$287.22 ,FJF38NFT4BM
Katelyn Hodges,(855) 974-1582,augue.ac@icloud.com,04/1/1984 03:36:54,Ap #716-3177 Felis Street,9762,Eastern Visayas,"Korea, South",3,Vestibulum ut eros non enim commodo hendrerit. Donec porttitor tellus,532,$280.62 ,BQR56JDK1YQ
Regina Mullins,(618) 812-3663,donec@hotmail.com,05/25/1998 04:42:17,869-7292 Dolor Avenue,10343,South Chungcheong,Philippines,5,"pellentesque massa lobortis ultrices. Vivamus rhoncus. Donec est. Nunc ullamcorper,",3747,$408.63 ,TPE74XMI5EL
Stewart Holder,1-183-244-6820,ut.nisi@protonmail.net,07/14/1972 02:22:16,"P.O. Box 141, 4416 Vitae Rd.",9842,South Chungcheong,Philippines,1,"egestas rhoncus. Proin nisl sem, consequat nec, mollis vitae, posuere",3801,$460.14 ,SVP27QGP4OF
Lewis Valenzuela,(865) 441-3782,ligula.tortor.dictum@outlook.couk,04/2/2023 23:14:08,"Ap #574-2742 In, St.",7130,Eastern Visayas,Singapore,1,"eget tincidunt dui augue eu tellus. Phasellus elit pede, malesuada",2247,$201.77 ,WXP41HNQ1JM
Berk West,(829) 334-2338,nibh.quisque@google.org,08/30/1990 01:25:29,Ap #922-5646 Metus St.,28505,Gyeonggi,Philippines,11,eleifend. Cras sed leo. Cras vehicula aliquet libero. Integer in,1469,$356.55 ,PEW11CYN9XI
Warren Wilkerson,(785) 795-0878,est@yahoo.couk,03/27/1976 23:00:08,"P.O. Box 733, 6181 Mauris. Rd.",8718,Calabarzon,Singapore,5,justo eu arcu. Morbi sit amet massa. Quisque porttitor eros,3429,$258.86 ,NHD92IFT3ON
Basil Daniel,(520) 480-2244,in.lobortis.tellus@yahoo.ca,07/23/2016 23:24:51,363-7502 Sit St.,2864,Central Region,Singapore,3,"Cras lorem lorem, luctus ut, pellentesque eget, dictum placerat, augue.",4463,$44.74 ,QDL94RIE3YN
Amal Sampson,1-346-703-0378,fringilla.mi.lacinia@icloud.edu,09/17/2011 04:49:12,Ap #581-8525 Elit Street,392657,Bangsamoro,"Korea, South",19,"ut aliquam iaculis, lacus pede sagittis augue, eu tempor erat",4440,$478.69 ,NVO46MYT4LY
Branden Baird,(532) 875-3826,phasellus@google.com,08/2/1984 05:48:58,Ap #708-6101 Erat. Ave,348426,Southwestern Tagalog Region,"Korea, South",5,Vivamus non lorem vitae odio sagittis semper. Nam tempor diam,526,$239.37 ,SIU93ISU8UU
Kristen Pacheco,(918) 512-6578,neque.nullam.ut@hotmail.org,09/14/1989 02:18:27,3556 In Ave,1157,South Gyeongsang,Singapore,3,"Donec porttitor tellus non magna. Nam ligula elit, pretium et,",3854,$271.74 ,DRZ23SOW2LR
Gil Gillespie,1-901-664-7565,molestie.tortor@outlook.com,07/14/2007 05:29:36,Ap #109-9667 Risus. Road,1206,North-East Region,Singapore,3,sagittis. Nullam vitae diam. Proin dolor. Nulla semper tellus id,1715,$258.76 ,EWA38IGF9QN
Moana Davis,(884) 833-1411,urna.suscipit.nonummy@outlook.net,10/15/1978 00:55:56,165-842 Laoreet Street,168838,East Region,Singapore,19,eu enim. Etiam imperdiet dictum magna. Ut tincidunt orci quis,3085,$284.41 ,WGE42LSO2AS
Riley Roman,1-252-735-4524,nunc@hotmail.org,05/6/2000 02:26:29,"P.O. Box 451, 4182 Vestibulum, Street",12359,Jeju,Philippines,5,"lacus, varius et, euismod et, commodo at, libero. Morbi accumsan",1535,$224.74 ,RDY35TSL9MV
Bianca Randall,1-311-551-2944,mi.lacinia@icloud.edu,05/28/1970 01:55:06,"P.O. Box 808, 4234 In, Road",3649,Central Region,Singapore,9,fringilla est. Mauris eu turpis. Nulla aliquet. Proin velit. Sed,4042,$8.14 ,LYY20SDJ6NP
Colby Mayer,1-793-434-5834,ac.metus.vitae@google.com,07/25/2008 00:58:54,"P.O. Box 449, 6743 Nonummy Av.",19030,National Capital Region,"Korea, South",17,interdum. Nunc sollicitudin commodo ipsum. Suspendisse non leo. Vivamus nibh,2415,$155.06 ,KOD23OPJ4EO
Lucius Britt,1-767-507-8826,vestibulum@outlook.couk,01/31/1978 05:52:30,964-134 Lacus Rd.,888457,South Jeolla,Singapore,19,"et arcu imperdiet ullamcorper. Duis at lacus. Quisque purus sapien,",1300,$114.05 ,HHY12ECO9SS
Alea Castillo,1-167-322-6252,lorem.auctor@hotmail.ca,01/24/2010 01:46:57,"P.O. Box 793, 5259 Mi Rd.",1924,Caraga,"Korea, South",1,ridiculus mus. Proin vel nisl. Quisque fringilla euismod enim. Etiam,1543,$160.16 ,VUL30JPB5NT
Heather Blankenship,1-706-572-4686,ante.dictum@hotmail.com,01/29/1994 23:06:48,Ap #716-4641 Lobortis Road,432957,Central Region,Philippines,1,"dui. Cum sociis natoque penatibus et magnis dis parturient montes,",4675,$89.92 ,OUN74FNN4XL
Alexa Forbes,(971) 716-4285,sociis.natoque.penatibus@hotmail.com,10/24/1974 00:05:56,Ap #102-8062 Magna. Rd.,16976,Southwestern Tagalog Region,"Korea, South",7,"sed dui. Fusce aliquam, enim nec tempus scelerisque, lorem ipsum",1845,$489.54 ,SBQ25CIG7KF
Joel David,1-153-610-6362,ante.vivamus@protonmail.org,01/22/1998 23:10:31,619-3655 Dui Rd.,11317,Davao Region,Philippines,1,"dolor quam, elementum at, egestas a, scelerisque sed, sapien. Nunc",822,$443.40 ,LYG94SXE4JZ
Aretha Burke,(813) 712-0161,nunc.sollicitudin@outlook.couk,05/10/1991 00:50:43,250-4019 Sagittis. Ave,28208,North Gyeongsang,"Korea, South",1,"bibendum sed, est. Nunc laoreet lectus quis massa. Mauris vestibulum,",2597,$0.97 ,XME20ECJ2ZC
Jenna Flores,1-840-623-4079,mollis.lectus.pede@icloud.couk,12/17/2016 23:17:38,839-6962 Nec Road,11154,Bicol Region,Singapore,5,Curabitur vel lectus. Cum sociis natoque penatibus et magnis dis,4546,$182.64 ,OKT61DZY8MP
Willow Sims,1-832-121-0931,sed.sapien.nunc@google.couk,02/14/1975 02:54:33,"P.O. Box 340, 7639 Dui. Av.",858,South Chungcheong,Philippines,5,feugiat. Sed nec metus facilisis lorem tristique aliquet. Phasellus fermentum,3273,$247.16 ,QDX02QAV4MR
Lillian Weeks,(572) 834-7626,phasellus.at@google.net,06/28/2015 01:13:51,6457 Nec Rd.,539455,Davao Region,Philippines,3,"ornare, lectus ante dictum mi, ac mattis velit justo nec",4080,$454.42 ,BSD15NJR6CH
Dale Vargas,(575) 827-8852,donec.dignissim.magna@protonmail.couk,05/17/2006 02:13:05,Ap #657-8308 Neque. Av.,228,Central Region,Philippines,3,"aliquet vel, vulputate eu, odio. Phasellus at augue id ante",3278,$336.38 ,JHP88NMY4RI
Keane York,(823) 223-4549,duis.cursus@yahoo.couk,12/15/1998 23:30:42,"Ap #417-4228 Aliquet, Rd.",8713,Zamboanga Peninsula,"Korea, South",13,risus. Donec egestas. Duis ac arcu. Nunc mauris. Morbi non,3014,$274.73 ,MPO56TPY5ME
Rudyard Slater,1-517-740-4136,montes@hotmail.couk,12/29/1990 03:26:54,5614 Commodo Rd.,726587,Bangsamoro,Philippines,15,magna. Duis dignissim tempor arcu. Vestibulum ut eros non enim,4896,$415.83 ,WIH51VMG8YL
Rhoda Randolph,1-568-215-1348,ut@yahoo.org,02/17/1990 23:32:36,9556 Lectus. Road,2854,North Chungcheong,Philippines,3,"convallis in, cursus et, eros. Proin ultrices. Duis volutpat nunc",4405,$253.91 ,SWG02HKR0BA
Barry Rollins,1-218-259-7074,in@protonmail.ca,06/3/1973 05:39:00,Ap #961-9231 Risus. Av.,225579,North Region,Philippines,5,tristique senectus et netus et malesuada fames ac turpis egestas.,903,$55.31 ,EBV68JRV1LL
Lacey Gamble,1-746-287-9253,non.nisi@aol.ca,11/25/2017 02:33:45,562 Lectus. Rd.,776283,National Capital Region,"Korea, South",11,odio. Nam interdum enim non nisi. Aenean eget metus. In,1680,$404.59 ,CXS93TXC2FF
Indigo Hammond,1-515-643-2535,ut.semper@protonmail.net,04/19/1988 05:39:10,Ap #604-5855 Donec St.,26439,Zamboanga Peninsula,"Korea, South",17,"in, cursus et, eros. Proin ultrices. Duis volutpat nunc sit",1199,$274.37 ,FOK73AID2CH
Ayanna Simmons,1-852-439-4863,orci@icloud.edu,04/24/2004 01:06:49,7926 Id Avenue,22514,West Region,Singapore,1,"Duis risus odio, auctor vitae, aliquet nec, imperdiet nec, leo.",4212,$276.80 ,LNL94MXN4DA
Coby Petersen,(875) 338-3691,cras.eu@hotmail.couk,01/25/2001 00:49:50,Ap #744-2346 Luctus. Road,787736,East Region,Singapore,11,facilisi. Sed neque. Sed eget lacus. Mauris non dui nec,413,$2.24 ,VTB82FTY0XQ
Paul Jackson,(653) 838-7895,mollis@protonmail.ca,06/20/1998 23:01:03,8351 Ante Ave,743556,North Jeolla,Philippines,17,neque. Sed eget lacus. Mauris non dui nec urna suscipit,546,$439.55 ,AWF24SVS6CP
Mannix Carrillo,(237) 837-3305,sed.orci@hotmail.net,04/21/1989 00:22:15,Ap #479-118 Dui Road,25038,Southwestern Tagalog Region,"Korea, South",9,arcu vel quam dignissim pharetra. Nam ac nulla. In tincidunt,2197,$92.91 ,NNR64UIK7XH
Ingrid Horne,1-988-268-5128,quis@hotmail.org,09/7/1991 23:30:37,2517 Nisi. Street,7633,Bicol Region,Philippines,15,urna et arcu imperdiet ullamcorper. Duis at lacus. Quisque purus,1450,$465.30 ,OCC80CWP8BI
Selma Stone,1-672-105-5384,semper.cursus@aol.ca,09/28/2012 05:21:01,6351 Natoque St.,14215,North Jeolla,"Korea, South",1,suscipit nonummy. Fusce fermentum fermentum arcu. Vestibulum ante ipsum primis,788,$320.75 ,XIW84MXY5WC
Leilani Schultz,(524) 873-5482,proin.ultrices.duis@yahoo.net,08/16/1979 23:54:08,405-9078 Convallis Av.,5860,North-East Region,"Korea, South",1,egestas ligula. Nullam feugiat placerat velit. Quisque varius. Nam porttitor,2338,$62.08 ,NNP38MFJ8DO
Amanda Copeland,(692) 909-7655,ligula.nullam.feugiat@google.net,07/30/2010 05:09:06,Ap #140-3121 Arcu St.,226153,Central Visayas,Philippines,13,"magna sed dui. Fusce aliquam, enim nec tempus scelerisque, lorem",2556,$469.12 ,SUR91CNJ8XN
Carol Leblanc,1-368-823-8516,gravida@yahoo.edu,02/24/1982 05:04:55,351-3881 Magna Av.,244546,North-East Region,"Korea, South",13,"lorem. Donec elementum, lorem ut aliquam iaculis, lacus pede sagittis",1632,$410.54 ,IHN85NJJ6JB
Aretha Pace,1-767-381-2853,aliquam.nisl@outlook.org,11/2/1994 04:34:24,"872-7323 Non, Street",733851,North Region,"Korea, South",3,"dolor dapibus gravida. Aliquam tincidunt, nunc ac mattis ornare, lectus",2102,$286.60 ,ENE26NRF3YY
Octavius Houston,(890) 765-2310,metus.vivamus@hotmail.net,05/21/1999 00:27:20,"279-8484 Non, Rd.",525,National Capital Region,"Korea, South",11,eu enim. Etiam imperdiet dictum magna. Ut tincidunt orci quis,38,$125.70 ,DXE73OSP2KU
Willow Morris,1-422-483-4362,montes.nascetur@outlook.edu,02/21/1990 03:56:18,Ap #393-5901 Donec Rd.,5489,Gyeonggi,Singapore,7,"facilisis non, bibendum sed, est. Nunc laoreet lectus quis massa.",4545,$444.29 ,BLF16EVG6NY
