name,phone,email,birthdate,birthdate2,address,postalZip,region,country,list,text,numberrange,currency1,currency2,alphanumeric
Jillian Mckee,1-881-868-2533,aliquam.nisl@google.com,12/22/2014 9:25,12/22/2014,8320 Sed Rd.,11246,North Jeolla,Singapore,3,commodo auctor velit. Aliquam nisl. Nulla eu neque pellentesque massa,35.5,$370.73 ,370.73,RQN29HDF0XP
Hayden Melton,(616) 950-1071,laoreet@aol.com,5/27/1991 9:01,5/27/1991,Ap #102-193 Aliquam Av.,2773,North Region,"Korea, South",11,sit amet ornare lectus justo eu arcu. Morbi sit amet,932.08,$285.94 ,285.94,HPF15CFS4TJ
Ivory O'Neill,1-448-186-2882,cras@protonmail.edu,4/15/1983 8:44,4/15/1983,Ap #243-3783 Aliquam Street,6555,West Region,Singapore,7,tincidunt tempus risus. Donec egestas. Duis ac arcu. Nunc mauris.,797.25,$93.26 ,93.26,IYG12OHL8XZ
Ferris Wade,(737) 607-3637,egestas.nunc@hotmail.net,8/20/2004 8:11,8/20/2004,Ap #657-3434 Mus. Street,837,Gangwon,"Korea, South",7,posuere cubilia Curae Donec tincidunt. Donec vitae erat vel pede,1351.67,$458.33 ,458.33,VGC51EQU2EI
Zelenia Gould,(408) 517-9798,aliquam@google.ca,4/16/2006 8:19,4/16/2006,"P.O. Box 323, 8227 Etiam St.",385275,South Jeolla,"Korea, South",5,Cras pellentesque. Sed dictum. Proin eget odio. Aliquam vulputate ullamcorper,1440,$389.82 ,389.82,OHS17CSO6TJ
Seth Mays,(724) 140-3952,aliquet.molestie@google.com,3/21/2016 8:37,3/21/2016,2931 Mi Street,748956,North-East Region,Philippines,19,justo. Praesent luctus. Curabitur egestas nunc sed libero. Proin sed,1168.33,$275.27 ,275.27,XGK70TJE2LH
Seth Ingram,(389) 839-7701,eleifend.nec@aol.edu,2/15/1985 8:50,2/15/1985,Ap #283-5007 Et Street,,North-East Region,Singapore,9,"ac metus vitae velit egestas lacinia. Sed congue, elit sed",1419,$70.64 ,70.64,CFZ54THW1GN
Bruce Solis,(423) 362-5966,tellus.aenean.egestas@outlook.edu,5/15/2015 8:36,5/15/2015,890-2795 Non Avenue,721869,Central Region,Singapore,5,"tempor bibendum. Donec felis orci, adipiscing non, luctus sit amet,",0,$471.25 ,471.25,PKJ15AEP3UV
Emi Carney,1-769-252-5760,curabitur.dictum@yahoo.couk,1/20/2004 9:19,1/20/2004,Ap #215-2835 Mollis Avenue,7922,Bangsamoro,Philippines,17,"vestibulum, neque sed dictum eleifend, nunc risus varius orci, in",193.83,$136.41 ,136.41,BOF19KXI5RT
Hilary Stewart,1-801-557-3346,eu.enim@protonmail.edu,3/17/1995 9:10,3/17/1995,940-2381 Non Street,2557,West Region,"Korea, South",19,"adipiscing non, luctus sit amet, faucibus ut, nulla. Cras eu",639.92,$337.28 ,337.28,IJV61CNL1NI
Jada Andrews,1-957-529-2266,fringilla.donec@yahoo.edu,9/6/2021 9:35,9/6/2021,Ap #384-544 Quisque Street,482561,Central Region,Philippines,1,"purus. Maecenas libero est, congue a, aliquet vel, vulputate eu,",583.17,$210.82 ,210.82,HIG93NHX2CO
Zena Morgan,1-551-285-2768,vel@hotmail.ca,6/1/2013 9:05,6/1/2013,Ap #892-2224 Ut Avenue,932563,Central Region,Philippines,1,et ultrices posuere cubilia Curae Donec tincidunt. Donec vitae erat,325.5,$241.30 ,241.3,CHS42CNA7PV
Sage Wallace,1-505-486-2124,congue.elit@hotmail.com,8/1/2022 8:58,8/1/2022,2439 Diam Rd.,,Western Visayas,Philippines,11,"lobortis augue scelerisque mollis. Phasellus libero mauris, aliquam eu, accumsan",2685,$454.44 ,454.44,GDG36MWP8BI
Chase Lee,(483) 971-8939,luctus.et.ultrices@icloud.edu,11/28/1978 9:17,11/28/1978,"Ap #849-1471 Ultrices, St.",17562,National Capital Region,"Korea, South",19,ut quam vel sapien imperdiet ornare. In faucibus. Morbi vehicula.,1223,$275.73 ,275.73,QOY84MNN8WW
Octavia Spears,1-827-292-7146,ornare.facilisis@yahoo.couk,2/24/2000 9:19,2/24/2000,"329-7739 Risus, Avenue",6760,South Jeolla,"Korea, South",11,Vivamus sit amet risus. Donec egestas. Aliquam nec enim. Nunc,153,$104.24 ,104.24,TBP47TXW2XO
William Ramsey,1-323-655-1524,dui.augue.eu@icloud.ca,3/2/1995 9:37,3/2/1995,5367 Quam. Av.,18438,Central Region,"Korea, South",17,"suscipit, est ac facilisis facilisis, magna tellus faucibus leo, in",1338.67,$100.56 ,100.56,IMJ66GFT9IP
Orli Greene,1-184-337-7964,sapien.molestie@outlook.net,6/29/1981 9:10,6/29/1981,"P.O. Box 784, 4666 Eget Rd.",961578,West Region,"Korea, South",3,"dolor sit amet, consectetuer adipiscing elit. Etiam laoreet, libero et",750.67,$422.89 ,422.89,XRH88VVK0WU
Avram Acosta,1-177-811-2050,mus@protonmail.com,11/30/1972 8:53,11/30/1972,"P.O. Box 873, 141 Sem, Rd.",15492,Bicol Region,Singapore,1,"eleifend non, dapibus rutrum, justo. Praesent luctus. Curabitur egestas nunc",1464,$34.10 ,34.1,QUO12CWG1QM
Tana Lambert,1-833-212-3721,non.lorem.vitae@yahoo.ca,6/13/1992 8:44,6/13/1992,Ap #391-650 Integer Street,826284,North Region,Philippines,9,"pede et risus. Quisque libero lacus, varius et, euismod et,",106,$306.79 ,306.79,COH23LPJ3OX
Sharon Bennett,(673) 562-8245,magna.et@yahoo.net,2/29/1992 8:18,2/29/1992,"P.O. Box 458, 3231 Tempus, Ave",,Caraga,Philippines,13,"enim consequat purus. Maecenas libero est, congue a, aliquet vel,",817.25,$49.29 ,49.29,PPN51SKF2OK
Tyler Harvey,1-715-880-3240,viverra.maecenas.iaculis@protonmail.couk,4/23/2015 9:50,4/23/2015,"224-2599 Imperdiet, Road",7833,Jeju,Singapore,1,dui nec urna suscipit nonummy. Fusce fermentum fermentum arcu. Vestibulum,79.75,$482.46 ,482.46,KIH13KUN5BD
Cole Finley,1-483-851-1158,vitae@google.edu,3/13/2016 9:54,3/13/2016,"Ap #542-9384 Tortor, Ave",6831,Central Region,Philippines,19,"purus. Duis elementum, dui quis accumsan convallis, ante lectus convallis",3468.75,$119.11 ,119.11,EFV48VFF9TW
Haley Ruiz,(706) 268-3213,orci.ut@aol.net,10/23/2016 8:29,10/23/2016,"Ap #651-7950 Amet, Av.",767645,Jeju,"Korea, South",11,"diam at pretium aliquet, metus urna convallis erat, eget tincidunt",2243.5,$115.18 ,115.18,BVM30UIN3DU
Quintessa Wong,1-369-881-0039,sed.nunc@yahoo.org,5/30/1986 8:40,5/30/1986,386-7698 Ac Road,486264,Gyeonggi,"Korea, South",19,malesuada fringilla est. Mauris eu turpis. Nulla aliquet. Proin velit.,,$315.75 ,315.75,GVR13VQM7OO
Dylan Holland,1-802-508-8881,faucibus.morbi@protonmail.ca,12/19/2018 8:50,12/19/2018,654-5977 Integer Rd.,14644,North-East Region,Singapore,9,vulputate mauris sagittis placerat. Cras dictum ultricies ligula. Nullam enim.,0,$441.55 ,441.55,XLY22FFN0NE
Violet Higgins,(624) 639-2343,tincidunt.pede@google.com,10/31/2004 9:49,10/31/2004,9183 Dis St.,516,Jeju,Singapore,15,arcu. Morbi sit amet massa. Quisque porttitor eros nec tellus.,2039.17,$284.51 ,284.51,UIH54CUP2RS
Lucian Mcintosh,1-657-398-7831,aliquam.iaculis@yahoo.edu,8/29/2005 8:57,8/29/2005,Ap #921-1868 Lacinia Street,935147,North Region,"Korea, South",5,vitae dolor. Donec fringilla. Donec feugiat metus sit amet ante.,309.75,$210.23 ,210.23,HLA10WKT3UU
Kiona Duffy,1-225-788-6356,suspendisse.ac.metus@protonmail.couk,10/4/1982 8:33,10/4/1982,794-6493 Erat. Rd.,2438,Bicol Region,Singapore,9,"erat, in consectetuer ipsum nunc id enim. Curabitur massa. Vestibulum",775.5,$142.47 ,142.47,JVL66RPR4PV
Colton Davidson,(358) 432-5571,ornare@protonmail.edu,5/13/2007 8:23,5/13/2007,"Ap #235-6667 Ac, Road",426853,Cagayan Valley,Philippines,7,"sollicitudin commodo ipsum. Suspendisse non leo. Vivamus nibh dolor, nonummy",1301.25,$220.32 ,220.32,FVT83FJC2CR
Doris Chen,1-162-949-4212,dui.suspendisse@google.edu,5/24/1985 9:34,5/24/1985,"Ap #183-2689 Nunc, Ave",2310,East Region,Singapore,13,Sed neque. Sed eget lacus. Mauris non dui nec urna,3306.75,$13.91 ,13.91,QDI66JUU3II
Chester Wall,1-217-529-6303,sagittis.lobortis@google.com,3/7/2001 9:40,3/7/2001,Ap #931-7164 Sem Street,18885,North Region,Singapore,7,"nisi. Cum sociis natoque penatibus et magnis dis parturient montes,",2551.33,$55.09 ,55.09,ZOH98NEK8HB
Dana Cohen,1-128-364-2706,neque@yahoo.org,7/19/1982 9:34,7/19/1982,888-1853 Ligula. Ave,13068,North Jeolla,"Korea, South",5,"lectus, a sollicitudin orci sem eget massa. Suspendisse eleifend. Cras",1327.33,$442.68 ,442.68,JFD65SKG2UO
Sharon Flores,1-376-217-3266,nulla@hotmail.org,2/20/2006 9:37,2/20/2006,714-7492 Proin Rd.,16540,Northern Mindanao,"Korea, South",5,"et, rutrum eu, ultrices sit amet, risus. Donec nibh enim,",1995.83,$445.42 ,445.42,TIC25HDP2MY
Germaine Wilkerson,(465) 854-3581,arcu@icloud.ca,7/4/2011 8:34,7/4/2011,"P.O. Box 520, 3992 Faucibus Road",585753,Central Region,Singapore,9,"Ut tincidunt orci quis lectus. Nullam suscipit, est ac facilisis",1871.33,$258.81 ,258.81,CDK74YEN7XF
Colin Levine,(302) 413-8766,aenean.eget@yahoo.org,2/12/1982 8:19,2/12/1982,Ap #298-836 Egestas Street,29128,Cagayan Valley,Philippines,9,magna. Sed eu eros. Nam consequat dolor vitae dolor. Donec,0,$447.47 ,447.47,HEZ77QEU4MW
Trevor Nash,(998) 555-8031,vehicula.et@aol.ca,2/16/1973 8:01,2/16/1973,"860-8085 Eget, Ave",275241,South Jeolla,Philippines,5,velit. Aliquam nisl. Nulla eu neque pellentesque massa lobortis ultrices.,148.33,$113.87 ,113.87,MNU13HSW7HF
Jordan Camacho,1-145-541-5690,at@yahoo.com,3/13/1989 8:13,3/13/1989,Ap #237-4061 Eu Ave,815982,Western Visayas,"Korea, South",5,"Fusce mi lorem, vehicula et, rutrum eu, ultrices sit amet,",1662,$250.36 ,250.36,JKY13KQE3VM
Yasir Berry,(914) 286-5846,cursus.in@google.edu,10/21/2000 9:38,10/21/2000,2328 Neque. Rd.,642814,North Jeolla,"Korea, South",11,egestas ligula. Nullam feugiat placerat velit. Quisque varius. Nam porttitor,384.75,$311.62 ,311.62,SJX68RPL0PY
Boris Stewart,(499) 346-2447,non.magna@yahoo.com,11/27/2002 8:40,11/27/2002,271-7589 Nec Street,1818,Central Region,Singapore,19,odio sagittis semper. Nam tempor diam dictum sapien. Aenean massa.,2897.25,$45.16 ,45.16,OPW47WOQ3KG
Colby Chandler,(714) 561-5184,in@protonmail.edu,9/16/2008 8:35,9/16/2008,850-932 At Rd.,2482,Jeju,"Korea, South",7,"In mi pede, nonummy ut, molestie in, tempus eu, ligula.",512.17,$68.96 ,68.96,ZNV29YKO8OC
Celeste Aguilar,(408) 468-3858,suspendisse.sed.dolor@icloud.net,11/6/2018 8:53,11/6/2018,236-785 Eleifend Rd.,18376,Gyeonggi,Philippines,9,"ultrices, mauris ipsum porta elit, a feugiat tellus lorem eu",1012.08,$119.31 ,119.31,IQO71NMJ2TJ
Katelyn English,(504) 397-8770,pede.ultrices.a@icloud.couk,12/23/1996 9:53,12/23/1996,Ap #547-1143 Non Street,869956,North-East Region,Philippines,17,sagittis. Duis gravida. Praesent eu nulla at sem molestie sodales.,306.83,$442.19 ,442.19,CYN44DZB1CG
Tallulah Blackburn,(102) 575-9675,ultricies.ligula.nullam@yahoo.ca,8/21/1988 9:30,8/21/1988,Ap #205-6594 Ultricies Street,8741,Cordillera Administrative Region,"Korea, South",7,nec mauris blandit mattis. Cras eget nisi dictum augue malesuada,2302.42,$401.42 ,401.42,OKI22FLF5LI
Phoebe Nielsen,1-561-727-6421,in.consectetuer@aol.org,4/17/1974 9:37,4/17/1974,Ap #478-3077 Pharetra Rd.,286178,Eastern Visayas,"Korea, South",9,vel arcu. Curabitur ut odio vel est tempor bibendum. Donec,518.5,$51.73 ,51.73,MXQ94KTY1QV
Imogene Fowler,(924) 733-9928,in.scelerisque@aol.edu,4/26/2004 9:11,4/26/2004,4796 Amet Street,126145,Western Visayas,Philippines,11,"litora torquent per conubia nostra, per inceptos hymenaeos. Mauris ut",192,$408.69 ,408.69,TMW20ROJ4WF
Justine Skinner,1-526-361-5777,ante.iaculis@protonmail.edu,4/24/2010 8:40,4/24/2010,"Ap #235-4224 Odio, St.",7075,Cagayan Valley,Philippines,1,"nec, diam. Duis mi enim, condimentum eget, volutpat ornare, facilisis",472.5,$145.35 ,145.35,VOR04CLM6WI
Alec Solomon,(774) 330-8683,a@google.net,11/29/1995 9:07,11/29/1995,Ap #984-211 Mi Avenue,5170,South Chungcheong,Philippines,15,in molestie tortor nibh sit amet orci. Ut sagittis lobortis,2766.75,$241.75 ,241.75,TGE13UHV3FY
Abraham Durham,1-199-424-8579,dignissim.maecenas.ornare@google.edu,10/3/1998 8:21,10/3/1998,172-1792 Orci Ave,12582,Gangwon,Philippines,15,"mi eleifend egestas. Sed pharetra, felis eget varius ultrices, mauris",499,$76.03 ,76.03,GVP95EBR7CO
Lani Sosa,(854) 111-4332,neque.sed.sem@google.ca,3/19/2011 9:58,3/19/2011,8510 Ligula. Street,13459,North Jeolla,Singapore,19,ac orci. Ut semper pretium neque. Morbi quis urna. Nunc,334,$94.33 ,94.33,RZE05CAR8JE
Martena Conley,(124) 313-2626,ac.libero.nec@outlook.org,5/13/2009 9:48,5/13/2009,Ap #983-8783 Aliquam Av.,227221,East Region,Philippines,7,Integer urna. Vivamus molestie dapibus ligula. Aliquam erat volutpat. Nulla,1338,$14.27 ,14.27,SXE68WNS3SK
Finn Mercado,(557) 638-1480,etiam.imperdiet@yahoo.org,5/18/1994 9:50,5/18/1994,273-6122 Iaculis Av.,2459,South Gyeongsang,Singapore,11,"ante blandit viverra. Donec tempus, lorem fringilla ornare placerat, orci",220.25,$287.23 ,287.23,RFJ24SUQ8TZ
Xena Bates,1-152-518-9892,sagittis.felis.donec@protonmail.com,10/26/1974 8:28,10/26/1974,Ap #577-2997 Mauris Road,11259,South Jeolla,"Korea, South",15,luctus lobortis. Class aptent taciti sociosqu ad litora torquent per,1299.67,$325.81 ,325.81,UGO46IVI6SJ
Hasad Morton,1-446-990-1271,id.ante@outlook.com,9/26/1985 9:03,9/26/1985,Ap #793-2036 Tellus St.,28723,Caraga,Singapore,7,"et risus. Quisque libero lacus, varius et, euismod et, commodo",0,$70.62 ,70.62,MDI91KVI8CF
Jennifer Larsen,1-262-645-1544,ac.eleifend@icloud.net,4/9/1989 8:20,4/9/1989,1961 Purus St.,27612,Gyeonggi,"Korea, South",13,velit. Quisque varius. Nam porttitor scelerisque neque. Nullam nisl. Maecenas,793.5,$201.86 ,201.86,JQB77FVU8RH
Scarlett Delgado,(710) 925-0540,sit.amet@yahoo.net,3/29/2001 9:46,3/29/2001,"592-6125 In, Ave",277577,Jeju,Philippines,15,"orci tincidunt adipiscing. Mauris molestie pharetra nibh. Aliquam ornare, libero",1628.25,$361.93 ,361.93,HVR35NOV1FK
Tobias Henson,(179) 861-0310,fusce@hotmail.net,8/27/1993 8:06,8/27/1993,446-508 Ipsum Rd.,1072,North Gyeongsang,"Korea, South",17,"dis parturient montes, nascetur ridiculus mus. Proin vel arcu eu",385.75,$460.05 ,460.05,GCO19MQX8MB
Deborah Weber,1-117-812-8428,leo.vivamus.nibh@icloud.com,11/18/2001 8:32,11/18/2001,366-8409 Dignissim Rd.,16954,North-East Region,"Korea, South",13,"non, dapibus rutrum, justo. Praesent luctus. Curabitur egestas nunc sed",1274.5,$274.73 ,274.73,ADT53IGV3MV
Marcia Miles,(283) 258-9477,nonummy.ac@icloud.net,12/3/2002 9:51,12/3/2002,941-5813 Pellentesque Av.,2518,South Chungcheong,Philippines,3,Aliquam rutrum lorem ac risus. Morbi metus. Vivamus euismod urna.,3588.75,$469.43 ,469.43,OXD14VPK5JR
Sierra Cleveland,(165) 623-7773,eget.ipsum@yahoo.couk,8/5/1986 8:16,8/5/1986,329-350 Arcu. Av.,365735,Zamboanga Peninsula,"Korea, South",19,"tellus. Suspendisse sed dolor. Fusce mi lorem, vehicula et, rutrum",903.33,$114.12 ,114.12,DJV48EZN5TI
Brittany Mack,1-872-204-4671,augue@yahoo.couk,11/30/1970 9:36,11/30/1970,Ap #625-4555 Vestibulum Rd.,12966,North Region,Singapore,3,"justo nec ante. Maecenas mi felis, adipiscing fringilla, porttitor vulputate,",1551.75,$361.93 ,361.93,UWZ97TDT6ZD
Alexandra Riddle,1-367-187-3723,vel.mauris.integer@google.ca,2/3/2000 8:03,2/3/2000,"P.O. Box 312, 6182 Et Road",373349,West Region,"Korea, South",7,"odio. Etiam ligula tortor, dictum eu, placerat eget, venenatis a,",121.58,$439.29 ,439.29,ICU64SCI1TC
Orlando Hunter,(254) 993-1542,purus.maecenas.libero@icloud.org,4/22/2000 9:01,4/22/2000,Ap #771-1909 Rutrum Rd.,149249,East Region,Philippines,17,"scelerisque, lorem ipsum sodales purus, in molestie tortor nibh sit",1139.58,$229.86 ,229.86,YOS67ZRM5WQ
Odette Douglas,(651) 338-2616,nunc.laoreet.lectus@aol.ca,3/25/1982 9:24,3/25/1982,739-1532 Diam. Rd.,4823,West Region,Philippines,1,"eleifend nec, malesuada ut, sem. Nulla interdum. Curabitur dictum. Phasellus",276.25,$249.02 ,249.02,YCO57DFB1YE
Aurora Fleming,(823) 415-1767,nunc@yahoo.org,9/26/2008 8:12,9/26/2008,Ap #662-3676 Accumsan Avenue,398568,Davao Region,Singapore,17,"est. Nunc ullamcorper, velit in aliquet lobortis, nisi nibh lacinia",285.25,$44.09 ,44.09,VBJ41SWB3AE
Marshall Garner,1-238-513-7548,blandit.nam@google.net,8/18/2003 8:25,8/18/2003,Ap #993-7088 Curabitur Road,4757,Southwestern Tagalog Region,Singapore,1,Mauris non dui nec urna suscipit nonummy. Fusce fermentum fermentum,2319.33,$439.30 ,439.3,YGX62OIN3EY
Beau Avila,(622) 857-4988,convallis.est@hotmail.org,6/18/1982 9:14,6/18/1982,"Ap #307-1585 Risus, Av.",8725,Ilocos Region,Philippines,15,imperdiet ornare. In faucibus. Morbi vehicula. Pellentesque tincidunt tempus risus.,1672.5,$482.56 ,482.56,DJK62BXD7LP
Judah Bean,(155) 426-8835,gravida.sit@protonmail.org,1/29/2021 9:09,1/29/2021,777-5384 Lobortis. Avenue,227875,Gangwon,Philippines,11,"porta elit, a feugiat tellus lorem eu metus. In lorem.",797.67,$235.12 ,235.12,GJN05ELY3YD
Halla Morris,1-263-603-0261,non.vestibulum.nec@hotmail.com,3/25/1990 8:36,3/25/1990,204-4193 Magna Rd.,4717,Gyeonggi,"Korea, South",11,"montes, nascetur ridiculus mus. Proin vel arcu eu odio tristique",,$261.60 ,261.6,PBU03KKZ3RO
Indira Levy,1-173-863-1867,mauris.integer.sem@aol.couk,6/24/1996 8:26,6/24/1996,Ap #273-5702 Interdum. St.,7515,Central Region,Philippines,9,enim diam vel arcu. Curabitur ut odio vel est tempor,602.67,$46.29 ,46.29,ZOV15HLN1WU
Ali Patrick,1-346-253-2438,nec@yahoo.net,8/26/1974 9:10,8/26/1974,Ap #763-6398 Aliquam St.,732137,North Chungcheong,Singapore,15,rutrum magna. Cras convallis convallis dolor. Quisque tincidunt pede ac,353.17,$328.47 ,328.47,NOX82XVT5RG
Candace Maxwell,1-393-621-8613,justo.proin.non@protonmail.com,12/27/1998 9:20,12/27/1998,2340 Tincidunt Street,26018,East Region,Philippines,5,"ultricies ligula. Nullam enim. Sed nulla ante, iaculis nec, eleifend",652,$179.96 ,179.96,HJI84UEU3WP
Dawn Hutchinson,1-203-293-9063,suscipit@icloud.net,8/12/2013 8:13,8/12/2013,"Ap #237-4693 At, St.",7122,National Capital Region,Singapore,11,"Duis risus odio, auctor vitae, aliquet nec, imperdiet nec, leo.",90,$73.24 ,73.24,VIC18HIG7JC
Kerry Simpson,(715) 225-4580,lacus.pede.sagittis@yahoo.couk,4/13/2008 9:01,4/13/2008,"Ap #722-6521 Est, St.",1756,Ilocos Region,Singapore,1,feugiat metus sit amet ante. Vivamus non lorem vitae odio,54.17,$494.91 ,494.91,BOQ24VVY4VV
Pascale Cohen,(716) 660-7692,mauris@google.com,12/17/2014 9:48,12/17/2014,740-2476 Fringilla Rd.,5289,North Jeolla,"Korea, South",13,"Nunc ut erat. Sed nunc est, mollis non, cursus non,",465.83,$435.81 ,435.81,RWY41VMT8QO
Quin Green,1-541-378-6814,donec.porttitor@outlook.ca,2/12/1991 8:05,2/12/1991,828-995 Mattis. Street,3696,Eastern Visayas,Philippines,3,"eget mollis lectus pede et risus. Quisque libero lacus, varius",1251.5,$9.16 ,9.16,HAA81TPU7XD
Hiram Shelton,1-365-788-2827,nullam@outlook.com,7/1/1976 9:43,7/1/1976,Ap #982-425 Sagittis Av.,876272,Gyeonggi,"Korea, South",13,nisi. Aenean eget metus. In nec orci. Donec nibh. Quisque,0,$281.00 ,281,CYE64AKK5IR
Beck Bridges,(975) 474-5358,odio.semper@outlook.edu,1/18/2015 9:34,1/18/2015,"Ap #127-5207 Elementum, Street",417627,West Region,Singapore,5,"est. Nunc laoreet lectus quis massa. Mauris vestibulum, neque sed",2502,$290.43 ,290.43,ETZ67CHR9BW
Carly Davenport,(346) 328-6567,felis.orci@icloud.org,3/19/2022 9:42,3/19/2022,845-1225 Ligula Ave,3226,North-East Region,"Korea, South",11,Quisque fringilla euismod enim. Etiam gravida molestie arcu. Sed eu,1189.67,$39.70 ,39.7,KDI32EJI3GQ
Ramona Long,(665) 991-8719,quisque.purus.sapien@google.com,3/18/2001 8:34,3/18/2001,Ap #768-6763 Nec Av.,22144,North Region,Philippines,17,"placerat, orci lacus vestibulum lorem, sit amet ultricies sem magna",470,$427.04 ,427.04,ZEY60KWU4YB
Charles Green,(624) 281-0964,nunc@protonmail.org,7/5/1984 9:47,7/5/1984,346-8063 Volutpat. Road,5895,North Region,Philippines,3,"ipsum ac mi eleifend egestas. Sed pharetra, felis eget varius",121.5,$292.24 ,292.24,HZU36NBG7CB
Kathleen Gilbert,1-386-477-0386,dui.nec.urna@aol.org,6/17/1997 8:18,6/17/1997,Ap #817-7052 Mi Rd.,825933,North Jeolla,"Korea, South",5,per inceptos hymenaeos. Mauris ut quam vel sapien imperdiet ornare.,3.75,$252.30 ,252.3,JHV10CPL1UK
Benedict Welch,(397) 912-4823,gravida@icloud.net,9/5/1986 8:06,9/5/1986,340-9929 Metus. St.,6726,Jeju,Singapore,3,ridiculus mus. Proin vel nisl. Quisque fringilla euismod enim. Etiam,1085,$266.37 ,266.37,ZYQ11VQQ6NS
Jared Bird,1-748-144-6461,nulla.facilisi@outlook.edu,4/20/2005 9:02,4/20/2005,8159 Magna. Rd.,5482,East Region,"Korea, South",3,Curae Donec tincidunt. Donec vitae erat vel pede blandit congue.,878.5,$0.84 ,0.84,XQX16CLP2BR
William Floyd,1-683-361-2319,quis.diam@icloud.couk,9/17/1988 8:42,9/17/1988,Ap #711-4717 Fusce Av.,855676,Gyeonggi,Singapore,15,Mauris magna. Duis dignissim tempor arcu. Vestibulum ut eros non,31.17,$396.43 ,396.43,MBH34DWU2JO
Uma Pacheco,1-864-386-7018,quis.diam@icloud.ca,11/27/1976 9:29,11/27/1976,367 Quam Road,8315,North-East Region,Singapore,13,"lorem. Donec elementum, lorem ut aliquam iaculis, lacus pede sagittis",845.25,$407.37 ,407.37,FTF87MDT2XX
Jamal Dean,(883) 193-6323,lectus@aol.com,6/14/1976 9:41,6/14/1976,4447 Sagittis St.,3944,North-East Region,Philippines,9,"semper et, lacinia vitae, sodales at, velit. Pellentesque ultricies dignissim",569.67,$194.22 ,194.22,IGE53XJB8DO
Rina Mcpherson,(728) 581-7493,sodales@yahoo.ca,7/9/1990 9:39,7/9/1990,Ap #318-146 Tristique Av.,4122,East Region,Philippines,7,"Vivamus rhoncus. Donec est. Nunc ullamcorper, velit in aliquet lobortis,",320,$58.19 ,58.19,LEG46BPN8IQ
Derek Weber,(542) 750-5631,massa.integer@icloud.edu,10/16/1994 9:12,10/16/1994,760-2333 Magna. Street,11621,Caraga,Philippines,3,semper auctor. Mauris vel turpis. Aliquam adipiscing lobortis risus. In,0,$207.14 ,207.14,EPH75KYF5DM
Buckminster Gilbert,(696) 111-4772,in.faucibus.morbi@hotmail.edu,3/27/2000 8:09,3/27/2000,Ap #542-7331 Egestas Rd.,18175,South Gyeongsang,Singapore,11,"in aliquet lobortis, nisi nibh lacinia orci, consectetuer euismod est",1597.08,$306.90 ,306.9,LGJ36HBN7OC
Mia Fitzgerald,(347) 424-8133,dictum@outlook.net,12/7/2009 9:23,12/7/2009,Ap #237-5072 Rutrum Rd.,1064,North Jeolla,Singapore,1,Sed eu eros. Nam consequat dolor vitae dolor. Donec fringilla.,156.67,$161.55 ,161.55,OKI74OUN5GC
Colorado Gray,(841) 454-3470,sem.mollis@aol.net,7/15/2001 8:07,7/15/2001,Ap #902-186 Quis Av.,4688,Cagayan Valley,"Korea, South",13,a felis ullamcorper viverra. Maecenas iaculis aliquet diam. Sed diam,2115.17,$194.13 ,194.13,QSB68AGL8BN
Olympia Miller,1-293-870-5686,sed.dictum@aol.edu,2/27/2018 8:20,2/27/2018,Ap #876-4487 Vulputate Road,6513,Central Visayas,Singapore,13,"risus, at fringilla purus mauris a nunc. In at pede.",1595.83,$17.57 ,17.57,MOY64XLQ2YU
Uma Church,1-826-705-0556,hendrerit@hotmail.couk,3/9/1990 9:53,3/9/1990,589-8808 Morbi St.,3426,Central Luzon,Philippines,11,"a, facilisis non, bibendum sed, est. Nunc laoreet lectus quis",301.25,$221.14 ,221.14,TQI18QWF8OX
Ulric Hurst,(499) 293-8024,non.nisi@google.edu,3/3/2007 9:46,3/3/2007,603-9519 Duis St.,7642,North Region,Philippines,19,"lorem, vehicula et, rutrum eu, ultrices sit amet, risus. Donec",2200.67,$220.21 ,220.21,MIE45QYX1WM
Leigh Jones,(452) 462-3741,magna.duis.dignissim@aol.ca,4/14/1981 8:16,4/14/1981,263-2861 Euismod Ave,15730,North-East Region,"Korea, South",5,faucibus. Morbi vehicula. Pellentesque tincidunt tempus risus. Donec egestas. Duis,1967.58,$474.38 ,474.38,HQH77HFE1HV
Holly Porter,(560) 177-7812,vitae.semper@aol.ca,8/14/2005 9:50,8/14/2005,"P.O. Box 520, 7908 Morbi Road",3087,South Chungcheong,"Korea, South",7,"blandit viverra. Donec tempus, lorem fringilla ornare placerat, orci lacus",719.5,$345.50 ,345.5,OTL96JQW7OM
Karly Cooley,(761) 505-4550,est.nunc@icloud.org,9/14/2010 8:28,9/14/2010,Ap #790-7619 Sem Avenue,2132,East Region,Singapore,19,"amet, risus. Donec nibh enim, gravida sit amet, dapibus id,",412.5,$435.86 ,435.86,RCU98GTL8IT
Sharon Klein,1-243-232-1968,enim@icloud.ca,11/25/2009 9:23,11/25/2009,171-3910 Elit. Av.,5395,North Jeolla,"Korea, South",17,"Duis risus odio, auctor vitae, aliquet nec, imperdiet nec, leo.",,$44.55 ,44.55,QDA64DTS4PN
Isabelle Conner,1-340-214-8264,tempus.risus@protonmail.edu,11/5/2017 9:25,11/5/2017,"8479 Sem, Rd.",4946,South Chungcheong,Philippines,13,enim. Etiam gravida molestie arcu. Sed eu nibh vulputate mauris,2323.42,$442.35 ,442.35,HCP20SIF1IJ
Shaine Parsons,1-549-487-0696,id@aol.ca,6/25/1979 9:53,6/25/1979,"8687 Non, Rd.",1577,Gangwon,Singapore,11,"at, libero. Morbi accumsan laoreet ipsum. Curabitur consequat, lectus sit",1102,$125.53 ,125.53,ELH25TTN3GB
Cathleen Banks,(316) 320-8985,nec.eleifend@icloud.edu,4/7/2006 9:20,4/7/2006,Ap #580-9630 Fames Ave,7886,Gangwon,"Korea, South",7,malesuada. Integer id magna et ipsum cursus vestibulum. Mauris magna.,1143.75,$149.88 ,149.88,TCB84WNR5XS
Sierra Orr,(353) 461-7507,nisi@google.net,4/25/2019 8:07,4/25/2019,Ap #819-2218 Fringilla Av.,6778,West Region,Singapore,13,"Fusce feugiat. Lorem ipsum dolor sit amet, consectetuer adipiscing elit.",509.5,$25.43 ,25.43,LSX08WYA5GU
Melvin Page,(264) 672-4035,iaculis.quis.pede@icloud.edu,11/17/2021 8:38,11/17/2021,"5914 Lorem, St.",1466,Jeju,"Korea, South",11,fermentum metus. Aenean sed pede nec ante blandit viverra. Donec,736.5,$48.51 ,48.51,KTV05LWN8JO
Tamekah Mclaughlin,(738) 271-5567,penatibus.et@yahoo.ca,12/13/2014 9:20,12/13/2014,Ap #234-6361 Interdum Avenue,6362,West Region,"Korea, South",11,id risus quis diam luctus lobortis. Class aptent taciti sociosqu,0,$289.86 ,289.86,JIX46YRL8SZ
Eugenia Young,1-736-485-3758,etiam.gravida@protonmail.edu,4/8/1975 8:28,4/8/1975,"P.O. Box 720, 4853 Lorem St.",828375,North Gyeongsang,Philippines,9,adipiscing lacus. Ut nec urna et arcu imperdiet ullamcorper. Duis,56.67,$397.14 ,397.14,DKT56QRQ5NB
Justine James,1-831-441-3274,tellus.lorem@google.ca,12/4/1974 8:15,12/4/1974,Ap #698-8427 Elementum St.,3429,South Jeolla,Singapore,17,"ut aliquam iaculis, lacus pede sagittis augue, eu tempor erat",2292.5,$303.87 ,303.87,DNM35FCQ2KF
Declan Rodriquez,1-214-429-5777,mattis.semper@outlook.org,11/23/2005 8:25,11/23/2005,Ap #846-1680 Donec Avenue,774498,North Region,Singapore,15,"vehicula et, rutrum eu, ultrices sit amet, risus. Donec nibh",1692.08,$117.84 ,117.84,LJB80ORC7FN
Daquan Wheeler,(886) 711-3174,vulputate.dui@google.org,12/30/2005 8:47,12/30/2005,Ap #982-7323 Ac Rd.,14981,North Gyeongsang,"Korea, South",11,"viverra. Maecenas iaculis aliquet diam. Sed diam lorem, auctor quis,",365.5,$285.55 ,285.55,UYB84WEF4GK
Alyssa Odom,(614) 772-9637,ut.mi@hotmail.ca,9/2/2019 9:36,9/2/2019,1194 Massa. Ave,12569,Western Visayas,"Korea, South",15,"nec, eleifend non, dapibus rutrum, justo. Praesent luctus. Curabitur egestas",0,$299.68 ,299.68,DRN79ILK2UF
