name,phone,email,birthdate,birthdate2,address,postalZip,region,country,list,text,numberrange,currency1,currency2,alphanumeric
Juliet Carpenter,(643) 661-3058,convallis.convallis.dolor@aol.com,5/4/2011 9:52,5/4/2011,Ap #360-6743 Malesuada. Street,9397,Davao Region,Philippines,11,"euismod in, dolor. Fusce feugiat. Lorem ipsum dolor sit amet,",991.67,$54.45 ,54.45,FDS16GVT8TE
Claudia Snider,1-976-991-2743,nam.consequat@icloud.org,7/3/2021 9:55,7/3/2021,428-5987 Sed St.,341448,Central Region,"Korea, South",3,"parturient montes, nascetur ridiculus mus. Proin vel nisl. Quisque fringilla",1942,$409.07 ,409.07,KMV55QAK4WY
Lara Townsend,1-708-485-1674,vestibulum.accumsan.neque@hotmail.couk,3/18/1988 8:58,3/18/1988,129-7951 A Rd.,29236,Gangwon,Philippines,7,"quam, elementum at, egestas a, scelerisque sed, sapien. Nunc pulvinar",0.42,$225.52 ,225.52,TCY63LNF1KE
Caleb Maxwell,1-534-140-3114,vehicula.pellentesque.tincidunt@google.ca,10/11/1973 9:23,10/11/1973,Ap #389-9324 Turpis Rd.,717748,North Region,Philippines,19,"risus. In mi pede, nonummy ut, molestie in, tempus eu,",2145,$98.53 ,98.53,QLR92LGO3XW
Xyla Tate,(677) 149-4843,nullam@google.org,4/17/1981 9:23,4/17/1981,"P.O. Box 213, 787 Laoreet Ave",8735,Zamboanga Peninsula,Singapore,17,vel quam dignissim pharetra. Nam ac nulla. In tincidunt congue,1508,$196.76 ,196.76,KTI55XRK8KU
Yvette O'connor,(311) 735-1455,eros.nam@outlook.com,3/7/1976 9:26,3/7/1976,925-2439 Penatibus Road,386371,Gyeonggi,"Korea, South",5,"magna sed dui. Fusce aliquam, enim nec tempus scelerisque, lorem",872.75,$112.91 ,112.91,WFN18XMX7PY
Meredith Gibbs,1-606-640-3250,porttitor.tellus@hotmail.net,7/20/1999 8:02,7/20/1999,8316 Nibh Avenue,452916,South Gyeongsang,"Korea, South",17,"sociis natoque penatibus et magnis dis parturient montes, nascetur ridiculus",1622.25,$1.65 ,1.65,BBO04WTQ0GD
Octavia Shannon,1-444-135-1123,nunc.nulla@hotmail.net,4/11/2015 9:25,4/11/2015,387-3100 In Rd.,16654,Jeju,Singapore,1,odio. Phasellus at augue id ante dictum cursus. Nunc mauris,520.83,$426.11 ,426.11,LZR52MFI7RC
Ferdinand Pennington,(635) 957-4825,quam.vel@protonmail.net,5/28/1983 9:01,5/28/1983,"625-5662 Mauris, St.",2322,West Region,"Korea, South",15,dolor. Nulla semper tellus id nunc interdum feugiat. Sed nec,261,$90.61 ,90.61,GRQ28RJG8IF
Merrill Simon,1-589-967-4737,sed.dolor.fusce@icloud.com,12/26/2022 9:51,12/26/2022,428-5013 Cras Rd.,3860,Jeju,Singapore,17,"mattis velit justo nec ante. Maecenas mi felis, adipiscing fringilla,",2213.5,$265.42 ,265.42,STN11LUU3HF
Jerome Berg,1-687-397-2571,hymenaeos.mauris@protonmail.ca,11/21/2001 8:38,11/21/2001,559-9177 Ut Rd.,363646,Davao Region,"Korea, South",15,non enim commodo hendrerit. Donec porttitor tellus non magna. Nam,1592,$375.64 ,375.64,UYJ76KBN9NA
Regan Young,1-668-458-8948,et@icloud.ca,10/12/1998 9:30,10/12/1998,"Ap #717-742 A, Rd.",14974,Northern Mindanao,"Korea, South",7,"cursus et, eros. Proin ultrices. Duis volutpat nunc sit amet",,$210.33 ,210.33,FJR86OPR3EM
Kitra Boyer,(538) 224-7481,felis.ullamcorper.viverra@hotmail.couk,2/14/1993 8:27,2/14/1993,229-3009 Fames Street,755434,Cordillera Administrative Region,Singapore,19,Quisque fringilla euismod enim. Etiam gravida molestie arcu. Sed eu,602.5,$134.07 ,134.07,LGS64UPC7SU
John Griffin,1-772-544-6805,est.ac@protonmail.org,12/22/1991 9:10,12/22/1991,738-8801 Ac Rd.,52,Gangwon,"Korea, South",1,"penatibus et magnis dis parturient montes, nascetur ridiculus mus. Proin",947,$184.99 ,184.99,QKT17JDY5TV
Nelle Raymond,1-933-880-3257,cras.convallis.convallis@icloud.edu,8/4/1987 9:24,8/4/1987,379-8964 Sagittis Street,824944,North Gyeongsang,Philippines,11,"eleifend non, dapibus rutrum, justo. Praesent luctus. Curabitur egestas nunc",1563.75,$394.07 ,394.07,QDA32HKS5HY
Chancellor Cain,1-371-544-0518,scelerisque.lorem@hotmail.com,4/24/2016 8:01,4/24/2016,Ap #921-7381 Hendrerit Av.,7843,Bangsamoro,Philippines,17,"mauris ut mi. Duis risus odio, auctor vitae, aliquet nec,",1528.92,$8.23 ,8.23,SSS32NLB8UY
Valentine Watts,1-435-588-5768,et.risus.quisque@icloud.couk,12/1/1994 9:37,12/1/1994,2798 Mauris Street,26524,Central Region,Singapore,1,risus quis diam luctus lobortis. Class aptent taciti sociosqu ad,642.5,$278.25 ,278.25,UKG25JXL5DJ
Linda Newton,1-383-580-3903,tellus@google.net,1/18/1996 9:54,1/18/1996,"P.O. Box 427, 2546 Luctus, St.",26702,Bicol Region,Singapore,7,"ornare, libero at auctor ullamcorper, nisl arcu iaculis enim, sit",0,$413.27 ,413.27,IAB87PWX1GC
Samuel Phillips,(855) 532-8925,viverra.maecenas@protonmail.org,4/30/2007 8:48,4/30/2007,613-445 A Ave,11991,Central Region,Philippines,5,"ipsum. Suspendisse non leo. Vivamus nibh dolor, nonummy ac, feugiat",2086.5,$18.38 ,18.38,CSF08OWA2WT
Elliott Holloway,1-521-148-3665,magna.ut@hotmail.edu,8/31/2000 9:17,8/31/2000,Ap #418-9762 Nonummy Rd.,135778,Bangsamoro,Philippines,1,Proin dolor. Nulla semper tellus id nunc interdum feugiat. Sed,480,$111.65 ,111.65,PFX76GEJ1MK
Shea Lynch,1-852-823-3734,amet@protonmail.com,12/12/1981 8:09,12/12/1981,859-1041 Ac Rd.,29402,South Gyeongsang,"Korea, South",7,eu sem. Pellentesque ut ipsum ac mi eleifend egestas. Sed,,$386.21 ,386.21,DGZ87IQB7XZ
Herrod Dalton,(655) 702-1061,nullam.scelerisque.neque@icloud.com,10/14/2016 9:00,10/14/2016,"P.O. Box 378, 6549 Nunc St.",1124,Zamboanga Peninsula,Singapore,11,"posuere, enim nisl elementum purus, accumsan interdum libero dui nec",2410.67,$89.70 ,89.7,ZCP85TMW5EK
Mikayla Boyle,1-568-811-2079,ridiculus.mus@google.couk,4/18/2023 8:37,4/18/2023,6811 Lorem Av.,4558,Bicol Region,Philippines,5,"vestibulum nec, euismod in, dolor. Fusce feugiat. Lorem ipsum dolor",1227,$160.79 ,160.79,BEU54CQR7VB
Colt Fuentes,1-664-678-1723,velit.aliquam@protonmail.com,11/30/2009 9:34,11/30/2009,4057 Ipsum. Street,3532,North-East Region,"Korea, South",9,"ipsum. Suspendisse non leo. Vivamus nibh dolor, nonummy ac, feugiat",330.67,$63.46 ,63.46,URI20CVP3NH
Elton Hudson,(758) 633-2735,egestas.sed.pharetra@yahoo.couk,5/20/1996 8:04,5/20/1996,716-3290 Pellentesque Road,5253,Jeju,Singapore,13,arcu. Sed et libero. Proin mi. Aliquam gravida mauris ut,2064.17,$236.92 ,236.92,OPU56TFQ8CZ
Tad Lawson,1-238-174-6264,a.magna@yahoo.ca,5/12/2015 8:42,5/12/2015,"Ap #135-8156 Eu, St.",5328,South Gyeongsang,Singapore,19,"eget tincidunt dui augue eu tellus. Phasellus elit pede, malesuada",361,$186.70 ,186.7,UDY25FJD9LK
Kibo Curtis,1-337-905-6131,natoque.penatibus@google.edu,7/10/2000 9:31,7/10/2000,"P.O. Box 582, 963 Lobortis St.",8468,Central Luzon,"Korea, South",19,"libero. Donec consectetuer mauris id sapien. Cras dolor dolor, tempus",411.5,$102.71 ,102.71,KUH24CVQ8SE
Palmer Camacho,(711) 157-1178,commodo.auctor@icloud.com,1/1/2002 9:57,1/1/2002,"P.O. Box 266, 2186 Donec Avenue",533476,Bicol Region,Philippines,3,Sed eget lacus. Mauris non dui nec urna suscipit nonummy.,515,$392.59 ,392.59,SZI56PYC7XZ
Zane Thornton,1-323-486-1868,scelerisque.neque@outlook.couk,5/9/1986 9:35,5/9/1986,Ap #947-4108 Pretium Avenue,613539,North Chungcheong,Singapore,3,Integer aliquam adipiscing lacus. Ut nec urna et arcu imperdiet,1060.5,$291.64 ,291.64,JHA39FTA5HS
Jordan Barr,1-278-158-3887,parturient.montes@google.org,5/25/2008 9:45,5/25/2008,248-7068 Amet Road,626631,South Gyeongsang,Philippines,15,Nullam feugiat placerat velit. Quisque varius. Nam porttitor scelerisque neque.,2346.67,$173.44 ,173.44,KNU52SGI3UQ
Harriet Rice,1-454-354-0692,ultrices.posuere@google.couk,1/4/2022 8:04,1/4/2022,"6342 Eu, St.",28361,Cagayan Valley,"Korea, South",1,"dolor, tempus non, lacinia at, iaculis quis, pede. Praesent eu",976.5,$432.39 ,432.39,WOM76SYO6AT
Alyssa Neal,(184) 465-4492,turpis@yahoo.org,4/29/1994 8:33,4/29/1994,329-5791 Sociis Av.,2006,Caraga,Singapore,17,"ac mattis semper, dui lectus rutrum urna, nec luctus felis",3412.5,$294.66 ,294.66,EQJ40MZR4XG
Ryan Gonzales,(936) 558-6950,non.dui@google.net,11/26/1999 8:05,11/26/1999,316-1598 Turpis St.,5070,Northern Mindanao,Philippines,11,lacus. Mauris non dui nec urna suscipit nonummy. Fusce fermentum,0,$56.64 ,56.64,DRI19FCH1DC
Jorden Clements,(697) 783-8652,euismod.urna@yahoo.couk,11/20/1977 8:05,11/20/1977,434-3922 Nullam Ave,225387,North Gyeongsang,Philippines,11,"semper rutrum. Fusce dolor quam, elementum at, egestas a, scelerisque",358.5,$374.97 ,374.97,FOW70OLF2IO
Nelle Hodge,1-968-650-9656,scelerisque@yahoo.ca,4/7/1993 8:07,4/7/1993,Ap #415-3211 Lorem Avenue,3566,East Region,Philippines,1,"cursus, diam at pretium aliquet, metus urna convallis erat, eget",1112.67,$305.23 ,305.23,LTR83XLC9DT
Xyla Craig,1-743-815-0268,consequat.enim@outlook.couk,12/10/2017 8:15,12/10/2017,"P.O. Box 569, 2652 Dis St.",12770,Southwestern Tagalog Region,"Korea, South",9,Nullam ut nisi a odio semper cursus. Integer mollis. Integer,0,$23.10 ,23.1,VXQ50QWP8GL
Herman Wilkinson,1-339-253-7945,molestie@outlook.net,11/29/2017 8:35,11/29/2017,1806 Consequat Rd.,1106,North Region,Philippines,5,eget ipsum. Suspendisse sagittis. Nullam vitae diam. Proin dolor. Nulla,1979.58,$344.97 ,344.97,JCT84OKR3IC
Adrian Livingston,(853) 628-6584,in.sodales@google.ca,9/16/1995 9:15,9/16/1995,857-7009 Gravida. Avenue,14786,East Region,Singapore,1,tristique senectus et netus et malesuada fames ac turpis egestas.,728.83,$362.86 ,362.86,QHX78FUV1EA
Hedy Manning,1-864-587-7706,aenean.eget@yahoo.org,10/30/1981 8:38,10/30/1981,Ap #647-6814 Et Ave,5115,East Region,"Korea, South",5,libero. Proin mi. Aliquam gravida mauris ut mi. Duis risus,2766.75,$216.69 ,216.69,JJP67IJO8KH
Anne Pollard,1-356-416-1388,odio.tristique.pharetra@hotmail.com,2/23/1971 8:26,2/23/1971,"P.O. Box 309, 1131 Vel Street",6419,West Region,Singapore,17,turpis. Nulla aliquet. Proin velit. Sed malesuada augue ut lacus.,384.75,$111.47 ,111.47,PYM74SYK4CK
Bert Mcclain,1-972-265-1928,id.libero@yahoo.edu,4/20/1984 8:51,4/20/1984,Ap #742-7671 Lorem Ave,18224,Southwestern Tagalog Region,Singapore,17,"ipsum dolor sit amet, consectetuer adipiscing elit. Etiam laoreet, libero",917.25,$271.91 ,271.91,EFU65WBI0JT
Ocean Vincent,(227) 772-8225,metus@icloud.net,1/2/1999 9:20,1/2/1999,"876-6422 Amet, Rd.",7514,South Jeolla,Philippines,3,posuere cubilia Curae Phasellus ornare. Fusce mollis. Duis sit amet,706.67,$19.53 ,19.53,JVM52DTT3VB
Wylie Rose,1-689-743-3624,placerat.orci.lacus@protonmail.ca,7/10/2007 9:28,7/10/2007,824-9524 Semper. Rd.,461645,West Region,Singapore,11,"consequat nec, mollis vitae, posuere at, velit. Cras lorem lorem,",723.5,$398.10 ,398.1,BAQ86KMI2XX
Linda Rivera,1-311-688-6831,purus.ac.tellus@icloud.ca,5/26/2000 9:54,5/26/2000,"P.O. Box 497, 2919 Arcu. Av.",883876,Central Luzon,"Korea, South",11,"mauris, rhoncus id, mollis nec, cursus a, enim. Suspendisse aliquet,",2182,$492.95 ,492.95,YUJ52HJT7RH
Cassandra Ward,(566) 868-5165,arcu.morbi@protonmail.org,2/6/1971 9:36,2/6/1971,"P.O. Box 334, 9100 At Rd.",14811,Zamboanga Peninsula,Philippines,7,"non, hendrerit id, ante. Nunc mauris sapien, cursus in, hendrerit",669,$467.86 ,467.86,USZ48EOW8KD
Venus Campos,1-422-497-6311,aliquam.adipiscing.lacus@protonmail.couk,9/30/1989 9:02,9/30/1989,"P.O. Box 271, 4346 Maecenas St.",12521,West Region,"Korea, South",17,"Nullam scelerisque neque sed sem egestas blandit. Nam nulla magna,",1371.75,$179.98 ,179.98,PRX55PDJ1GO
Cleo Morgan,1-853-214-1723,sem@yahoo.com,4/10/1977 8:17,4/10/1977,Ap #797-1388 Mattis Avenue,11254,South Jeolla,Singapore,1,Etiam bibendum fermentum metus. Aenean sed pede nec ante blandit,369,$208.17 ,208.17,YWD44WLC1VK
Athena Bolton,1-566-355-5331,donec@google.edu,8/27/2022 8:47,8/27/2022,8303 Cursus Road,541253,Gangwon,Singapore,7,"nec tempus scelerisque, lorem ipsum sodales purus, in molestie tortor",24,$89.13 ,89.13,QBM54SAX1QY
Kuame Hawkins,(706) 225-1671,vulputate@aol.net,11/13/1990 9:06,11/13/1990,Ap #637-8504 Ac Street,233539,North-East Region,Singapore,13,"ut aliquam iaculis, lacus pede sagittis augue, eu tempor erat",0,$116.05 ,116.05,SYZ69NVM3SY
Harper Boyd,(632) 517-4827,cursus@hotmail.com,2/16/1997 8:53,2/16/1997,"5127 Odio, St.",541879,Gyeonggi,Singapore,7,"vel, vulputate eu, odio. Phasellus at augue id ante dictum",1328.83,$285.37 ,285.37,POJ90DED7TO
Tate Nunez,1-112-924-4233,nec@hotmail.couk,6/23/1988 9:50,6/23/1988,549-3248 Proin Rd.,292561,Gyeonggi,Singapore,3,fringilla euismod enim. Etiam gravida molestie arcu. Sed eu nibh,644.67,$433.72 ,433.72,NSX71IWP6WD
Candace Craig,1-985-485-6517,gravida.sit.amet@yahoo.edu,2/12/2006 8:56,2/12/2006,"P.O. Box 720, 5713 Lacinia Ave",934566,East Region,"Korea, South",17,non nisi. Aenean eget metus. In nec orci. Donec nibh.,465.33,$198.48 ,198.48,KRG37CPB8RQ
Martha Hamilton,1-462-261-7424,non.sollicitudin.a@yahoo.net,3/16/2008 8:43,3/16/2008,"Ap #146-617 Quis, St.",1763,North Region,Philippines,19,nisi a odio semper cursus. Integer mollis. Integer tincidunt aliquam,1434,$35.91 ,35.91,ULX16KKU2DG
Brianna Spears,1-873-434-0858,adipiscing.mauris@google.couk,8/9/1988 9:48,8/9/1988,8132 Magna St.,18971,Central Visayas,Singapore,3,Donec vitae erat vel pede blandit congue. In scelerisque scelerisque,0,$217.89 ,217.89,RIU75SRO6RP
Teagan Mullins,(990) 428-0966,id.magna@hotmail.com,7/21/2020 9:26,7/21/2020,731-7487 Dis St.,5134,North Gyeongsang,"Korea, South",11,"amet massa. Quisque porttitor eros nec tellus. Nunc lectus pede,",175.5,$266.72 ,266.72,NMG89DXO2DV
Kasper Schultz,(223) 618-8621,cras@aol.com,9/9/2000 8:45,9/9/2000,"P.O. Box 104, 7522 Auctor. St.",6777,Soccsksargen,Philippines,3,"ante, iaculis nec, eleifend non, dapibus rutrum, justo. Praesent luctus.",1624,$449.80 ,449.8,CRB18BNK6CD
Uriel Oneil,1-813-655-4421,adipiscing.elit@yahoo.couk,8/24/1984 8:49,8/24/1984,"P.O. Box 420, 6290 Nonummy Rd.",253786,West Region,"Korea, South",13,"ut dolor dapibus gravida. Aliquam tincidunt, nunc ac mattis ornare,",386.17,$280.35 ,280.35,VQN33IXJ8EW
Vivien Sears,(144) 446-1966,luctus@outlook.com,11/16/2006 8:45,11/16/2006,"P.O. Box 929, 751 Auctor Ave",927453,North Gyeongsang,"Korea, South",9,"consequat auctor, nunc nulla vulputate dui, nec tempus mauris erat",655.5,$390.50 ,390.5,CJB15QCR1SV
Wynter Craft,1-455-562-0124,suscipit.nonummy.fusce@google.net,9/20/1979 9:49,9/20/1979,928-4715 Litora Av.,862483,Jeju,"Korea, South",9,"velit eget laoreet posuere, enim nisl elementum purus, accumsan interdum",3194,$332.66 ,332.66,XHW57DQW6CV
Burton Donovan,(823) 743-0427,magnis@google.com,3/11/2016 9:38,3/11/2016,Ap #650-5018 Duis Road,2117,Central Region,"Korea, South",11,"cursus luctus, ipsum leo elementum sem, vitae aliquam eros turpis",1962.5,$153.56 ,153.56,LRX59WXK3ZR
Ulysses Atkins,(368) 576-8733,nec.ante.blandit@outlook.ca,6/2/2015 9:17,6/2/2015,607 Massa. St.,18116,Bicol Region,Singapore,3,nec urna suscipit nonummy. Fusce fermentum fermentum arcu. Vestibulum ante,286.5,$420.05 ,420.05,QXN93DZM6VI
Megan Conway,(955) 212-2437,purus@icloud.ca,3/28/2000 8:16,3/28/2000,"P.O. Box 301, 5306 Justo Avenue",3910,South Chungcheong,Philippines,7,"dis parturient montes, nascetur ridiculus mus. Proin vel arcu eu",4020.83,$6.24 ,6.24,YCG36RRE3WQ
Aspen Whitfield,1-623-913-3676,donec.felis@google.org,6/12/1977 8:22,6/12/1977,"P.O. Box 677, 6083 Orci, Rd.",11167,North Chungcheong,Philippines,11,"rhoncus id, mollis nec, cursus a, enim. Suspendisse aliquet, sem",971.67,$330.40 ,330.4,TSH31UKX7UL
Jacqueline Chang,1-834-604-4195,sem.semper@protonmail.edu,4/23/1988 8:18,4/23/1988,Ap #405-5970 Ipsum Street,222875,South Chungcheong,Philippines,3,"ac mattis semper, dui lectus rutrum urna, nec luctus felis",1447.92,$492.58 ,492.58,XHO58HYN6VL
Darryl Morris,(311) 784-4561,morbi@icloud.edu,10/26/2001 9:25,10/26/2001,293-5872 Tellus. St.,6819,North Region,Singapore,11,"vestibulum nec, euismod in, dolor. Fusce feugiat. Lorem ipsum dolor",1449,$150.30 ,150.3,QIJ19III5BI
Erin Jimenez,(833) 720-2011,tellus@outlook.com,4/29/1995 9:42,4/29/1995,322-850 Dolor St.,2824,Western Visayas,Singapore,15,nisl. Nulla eu neque pellentesque massa lobortis ultrices. Vivamus rhoncus.,1272,$357.08 ,357.08,CZW78POK3JQ
Preston Garza,1-667-348-8790,pede.et.risus@aol.net,11/24/2013 9:01,11/24/2013,814-792 Malesuada Street,15484,East Region,"Korea, South",15,"sed, facilisis vitae, orci. Phasellus dapibus quam quis diam. Pellentesque",1858.33,$152.96 ,152.96,GGB22OQF6GD
Guy Reed,1-857-691-6458,faucibus@outlook.net,2/14/1999 8:47,2/14/1999,"P.O. Box 803, 3253 Est Ave",18989,Southwestern Tagalog Region,Singapore,1,"libero at auctor ullamcorper, nisl arcu iaculis enim, sit amet",192.83,$319.98 ,319.98,KPL56KKF4QM
Calista Dillon,1-686-383-3825,porta@aol.net,10/24/2014 9:44,10/24/2014,"P.O. Box 296, 5672 Mi St.",4675,Eastern Visayas,"Korea, South",3,"sit amet diam eu dolor egestas rhoncus. Proin nisl sem,",513.17,$489.15 ,489.15,OOQ20HQF8DF
Ulysses Gallegos,(245) 263-5089,at@outlook.net,6/2/1971 9:04,6/2/1971,883-3583 Arcu. St.,2312,Cordillera Administrative Region,Philippines,3,tincidunt pede ac urna. Ut tincidunt vehicula risus. Nulla eget,,$221.92 ,221.92,MJF11TPK4RY
Beverly Morales,(379) 653-6146,lacus.mauris.non@outlook.ca,8/16/2005 8:47,8/16/2005,Ap #657-9473 Nulla Avenue,765578,Ilocos Region,Singapore,17,"vulputate, posuere vulputate, lacus. Cras interdum. Nunc sollicitudin commodo ipsum.",319.33,$152.75 ,152.75,CRQ77BDZ0DN
Mason Vaughan,1-113-988-8435,ligula.nullam@aol.net,2/28/2012 8:11,2/28/2012,137-3814 Non Street,4433,North Gyeongsang,Philippines,7,"purus sapien, gravida non, sollicitudin a, malesuada id, erat. Etiam",517.5,$217.38 ,217.38,NUC76LWS8MR
Arden Golden,(345) 640-2062,ornare.tortor.at@protonmail.ca,10/1/1996 9:31,10/1/1996,2998 Penatibus Road,17337,Bangsamoro,Philippines,17,tempor erat neque non quam. Pellentesque habitant morbi tristique senectus,1740.67,$249.39 ,249.39,ZLT20DIL0YC
Blaze Noble,(652) 343-6586,lobortis.mauris.suspendisse@outlook.org,3/17/1993 8:16,3/17/1993,Ap #491-8544 Fusce St.,428559,North-East Region,"Korea, South",9,nascetur ridiculus mus. Proin vel nisl. Quisque fringilla euismod enim.,950,$135.29 ,135.29,NMV52PHN6DA
Nita Matthews,1-485-714-9435,quis@hotmail.couk,8/20/2020 9:48,8/20/2020,205-3720 Aliquam Avenue,7733,North Gyeongsang,Philippines,9,dolor. Nulla semper tellus id nunc interdum feugiat. Sed nec,835.67,$293.64 ,293.64,RYA60MNR6HL
Irene Mendoza,1-533-693-0364,eleifend.cras@hotmail.couk,6/9/1976 9:05,6/9/1976,3643 Nulla St.,7153,East Region,Philippines,13,semper. Nam tempor diam dictum sapien. Aenean massa. Integer vitae,80.67,$36.31 ,36.31,GHQ13JRA6HZ
Akeem French,(655) 332-9778,molestie.orci@google.net,10/29/1978 8:56,10/29/1978,982-4122 Placerat Street,518711,North Region,"Korea, South",17,Sed eu eros. Nam consequat dolor vitae dolor. Donec fringilla.,525.5,$126.54 ,126.54,EGR12FXB5IN
Shana Blevins,1-512-340-8547,semper@outlook.ca,8/5/2000 9:32,8/5/2000,446-9772 Mi Rd.,234879,North-East Region,"Korea, South",9,"id sapien. Cras dolor dolor, tempus non, lacinia at, iaculis",3076.67,$10.13 ,10.13,PXJ93USS3MA
Dalton Gomez,(848) 723-1488,neque@google.com,9/7/1983 9:25,9/7/1983,"P.O. Box 813, 7338 Volutpat. St.",24318,North Gyeongsang,"Korea, South",15,est arcu ac orci. Ut semper pretium neque. Morbi quis,1657.5,$213.32 ,213.32,WSC15PRA1LW
Eagan Garner,1-421-342-0056,pellentesque.a@hotmail.edu,12/27/1981 9:35,12/27/1981,"P.O. Box 581, 5841 Senectus St.",7354,South Jeolla,"Korea, South",7,Nam consequat dolor vitae dolor. Donec fringilla. Donec feugiat metus,375.33,$377.49 ,377.49,FUQ82ZNZ9RH
Flynn Padilla,1-564-114-7331,nulla.at.sem@outlook.org,8/16/1991 8:50,8/16/1991,Ap #869-6973 Ac Rd.,12178,North Region,Singapore,17,sed turpis nec mauris blandit mattis. Cras eget nisi dictum,757.5,$177.75 ,177.75,KIW63JQU5BW
Claire Mcdaniel,1-642-697-6393,praesent.interdum.ligula@icloud.org,12/20/2021 9:47,12/20/2021,6104 Nullam Avenue,29566,Caraga,"Korea, South",15,netus et malesuada fames ac turpis egestas. Fusce aliquet magna,3283.33,$236.10 ,236.1,GRN84BHK3CY
Carter Davis,1-847-387-9875,ac@aol.com,5/2/1989 9:16,5/2/1989,828-9756 Mauris St.,1814,Bangsamoro,Philippines,7,justo eu arcu. Morbi sit amet massa. Quisque porttitor eros,662,$315.26 ,315.26,GPF85NAL3BJ
Jasper Bryan,(866) 308-7621,interdum@icloud.net,3/11/1998 9:39,3/11/1998,8148 Luctus Road,4066,West Region,"Korea, South",3,eu tempor erat neque non quam. Pellentesque habitant morbi tristique,1627.33,$426.91 ,426.91,KTO05GGW3LZ
Anastasia Ayers,1-155-614-4213,libero.donec.consectetuer@icloud.net,6/20/1988 9:43,6/20/1988,105-7072 Tellus Av.,10669,North Gyeongsang,Singapore,7,euismod urna. Nullam lobortis quam a felis ullamcorper viverra. Maecenas,590.33,$249.51 ,249.51,KHB43QHB7MG
Lyle Benton,(275) 654-6366,egestas.fusce.aliquet@yahoo.com,8/19/1979 9:17,8/19/1979,277-8762 Eu Rd.,236751,Zamboanga Peninsula,Philippines,17,"non, sollicitudin a, malesuada id, erat. Etiam vestibulum massa rutrum",617,$461.21 ,461.21,UCQ66OIG0OP
Quamar Dudley,(489) 627-6334,dolor.nulla@hotmail.net,2/10/2003 9:18,2/10/2003,954-8323 Mus. Road,8595,Central Region,Philippines,1,"mi lacinia mattis. Integer eu lacus. Quisque imperdiet, erat nonummy",368,$305.66 ,305.66,NKE13JVH8CD
Shellie Frye,1-781-955-1677,suspendisse.commodo@outlook.com,2/9/2017 9:35,2/9/2017,Ap #625-4409 Praesent Rd.,12456,Central Region,"Korea, South",11,orci. Ut sagittis lobortis mauris. Suspendisse aliquet molestie tellus. Aenean,2252.25,$222.18 ,222.18,UPQ96FTV1NJ
Ulric Shepard,(686) 408-2665,nulla@hotmail.net,9/13/1988 9:08,9/13/1988,6983 Placerat Rd.,4577,East Region,Philippines,19,"augue id ante dictum cursus. Nunc mauris elit, dictum eu,",199.5,$56.42 ,56.42,QMX48KBN2MU
Kim Mccormick,1-826-864-4832,pellentesque.habitant@google.ca,5/25/2017 8:27,5/25/2017,Ap #801-5598 Sagittis. Rd.,5936,West Region,Philippines,13,et ipsum cursus vestibulum. Mauris magna. Duis dignissim tempor arcu.,0,$379.21 ,379.21,PGP43MGK0EY
Elton Wheeler,1-456-819-6191,fermentum.vel.mauris@yahoo.org,9/10/2020 9:58,9/10/2020,"P.O. Box 977, 2595 Nunc Road",5420,Jeju,Philippines,11,"molestie sodales. Mauris blandit enim consequat purus. Maecenas libero est,",2446.67,$382.71 ,382.71,ZWT40TQU8IT
Alexa Christian,1-832-987-2853,vitae.mauris.sit@hotmail.ca,6/14/2020 9:47,6/14/2020,9668 Molestie Ave,156834,North Jeolla,Philippines,17,"a, aliquet vel, vulputate eu, odio. Phasellus at augue id",2085.75,$203.00 ,203,IXY57KVQ5OU
Imani Roach,(744) 562-3583,nunc.mauris@hotmail.com,10/22/1976 8:25,10/22/1976,Ap #695-9227 Cras Avenue,655274,South Gyeongsang,Singapore,1,"vel turpis. Aliquam adipiscing lobortis risus. In mi pede, nonummy",2262.5,$496.32 ,496.32,QLN48QEB7OG
Halee Olsen,1-966-345-5926,dolor.donec@hotmail.net,3/10/1991 9:57,3/10/1991,"P.O. Box 523, 9442 Sed St.",1307,Northern Mindanao,"Korea, South",5,"lacinia vitae, sodales at, velit. Pellentesque ultricies dignissim lacus. Aliquam",1104.67,$141.57 ,141.57,JDH91BFV4II
Sasha Koch,(777) 722-0636,nonummy.ipsum.non@protonmail.edu,4/5/2000 9:53,4/5/2000,8801 Semper St.,19125,Zamboanga Peninsula,Philippines,7,"malesuada vel, venenatis vel, faucibus id, libero. Donec consectetuer mauris",3387.75,$323.82 ,323.82,FLV75WUV9SE
Stone Myers,(616) 896-5584,suspendisse.dui.fusce@outlook.org,12/18/1991 9:14,12/18/1991,1665 Iaculis Rd.,8632,Western Visayas,Singapore,17,"elit. Aliquam auctor, velit eget laoreet posuere, enim nisl elementum",789.75,$41.77 ,41.77,LEH24FOK0RR
Neville Mcdaniel,(633) 635-3568,lorem@yahoo.com,9/6/1975 8:17,9/6/1975,Ap #761-3248 Turpis Av.,8762,East Region,"Korea, South",17,et libero. Proin mi. Aliquam gravida mauris ut mi. Duis,367.17,$373.01 ,373.01,CEG68JDU0BO
Wendy Roth,1-161-740-7231,proin.vel@protonmail.edu,4/18/1997 9:47,4/18/1997,786-518 Tempor St.,741252,West Region,Philippines,7,"lorem ut aliquam iaculis, lacus pede sagittis augue, eu tempor",988.33,$353.56 ,353.56,TDS97QEW3DA
Whilemina Molina,1-471-625-5458,ut.pharetra@yahoo.net,11/21/1998 8:47,11/21/1998,"P.O. Box 289, 9056 Non, Rd.",7581,Caraga,Philippines,11,faucibus. Morbi vehicula. Pellentesque tincidunt tempus risus. Donec egestas. Duis,2264.25,$397.88 ,397.88,MRP09OTX7BI
Guinevere Stephens,(829) 237-6030,malesuada.fames@google.net,1/16/2002 8:35,1/16/2002,658-225 In Ave,477383,Cordillera Administrative Region,"Korea, South",3,"a ultricies adipiscing, enim mi tempor lorem, eget mollis lectus",1873.08,$101.40 ,101.4,QCY41KSO9YC
Liberty Avery,(644) 345-3724,bibendum.ullamcorper@hotmail.com,1/25/2023 9:42,1/25/2023,348-8189 Velit. Ave,461892,Gyeonggi,Singapore,15,"ante dictum mi, ac mattis velit justo nec ante. Maecenas",0,$152.78 ,152.78,ECC87XCR5HM
Aileen Burgess,(212) 722-7424,sed.eget@protonmail.org,8/7/2011 9:13,8/7/2011,3638 Nunc St.,3046,North-East Region,Philippines,17,sem molestie sodales. Mauris blandit enim consequat purus. Maecenas libero,1999.5,$189.47 ,189.47,OGY65CTO4ZY
Graham Wilcox,(461) 643-1741,eget.lacus@outlook.couk,7/26/2008 9:07,7/26/2008,Ap #924-2783 Eu Rd.,622675,South Gyeongsang,Philippines,9,"lorem ipsum sodales purus, in molestie tortor nibh sit amet",809.67,$10.86 ,10.86,BEI81QDH5XC
Xanthus Sloan,1-944-207-3076,aliquam.tincidunt.nunc@yahoo.net,11/29/2013 8:19,11/29/2013,1865 Venenatis St.,10565,Bicol Region,"Korea, South",11,Sed eu nibh vulputate mauris sagittis placerat. Cras dictum ultricies,2324.67,$18.46 ,18.46,VBV26XMQ2DG
Hillary Contreras,1-653-780-2735,pellentesque.habitant.morbi@protonmail.edu,1/21/1993 9:25,1/21/1993,"Ap #898-9020 Non, Ave",855536,West Region,Philippines,3,"libero at auctor ullamcorper, nisl arcu iaculis enim, sit amet",505.5,$327.56 ,327.56,EIP83XYZ6UV
Lane Morton,1-283-625-0297,feugiat.lorem@hotmail.ca,8/26/1998 9:00,8/26/1998,"P.O. Box 135, 1001 Bibendum Road",3766,Cordillera Administrative Region,Singapore,15,"neque sed sem egestas blandit. Nam nulla magna, malesuada vel,",1124,$168.70 ,168.7,LIG62EUF7XG
Chelsea Edwards,1-127-151-9688,lorem@google.org,1/31/1995 9:09,1/31/1995,3906 Urna. St.,13397,Gyeonggi,Philippines,19,"auctor odio a purus. Duis elementum, dui quis accumsan convallis,",,$379.03 ,379.03,GFV72ZBX0JM
Amy Carrillo,(514) 502-1326,habitant.morbi@google.couk,7/30/1981 9:33,7/30/1981,934-4909 Turpis Road,5418,Jeju,Philippines,5,"Phasellus at augue id ante dictum cursus. Nunc mauris elit,",697.67,$126.99 ,126.99,LNX06TFF3FJ
