name,phone,email,birthdate,address,postalZip,region,country,list,text,numberrange,currency,alphanumeric
Micah Lane,1-591-939-8313,vitae@google.org,12/29/1995 03:39:19,"P.O. Box 682, 6336 Orci Rd.",547387,Gangwon,Singapore,9,"in, dolor. Fusce feugiat. Lorem ipsum dolor sit amet, consectetuer",3839,$384.27 ,QKU66EHS3HJ
Zane Horn,1-352-746-1153,cursus.vestibulum@yahoo.org,11/2/1996 23:41:44,Ap #772-2990 Dictum Road,16684,Davao Region,"Korea, South",3,quis urna. Nunc quis arcu vel quam dignissim pharetra. Nam,1756,$186.87 ,VQO84YMT0WB
Ima Flores,1-472-527-2862,vitae.erat.vel@protonmail.com,12/29/2017 03:14:25,112-3551 Parturient Avenue,388637,Central Region,"Korea, South",11,vulputate velit eu sem. Pellentesque ut ipsum ac mi eleifend,1365,$441.69 ,CUS26BRY6OP
MacKenzie Hayes,(245) 103-2838,magna.suspendisse.tristique@icloud.org,08/22/2009 01:34:43,840-6132 Diam. Street,882647,West Region,"Korea, South",13,Vivamus molestie dapibus ligula. Aliquam erat volutpat. Nulla dignissim. Maecenas,4500,$276.44 ,MFC16UHY4CQ
Latifah Combs,1-459-214-1452,vestibulum.nec.euismod@hotmail.couk,10/10/2002 01:48:08,6937 Tempor Street,789927,Bicol Region,Philippines,13,"semper et, lacinia vitae, sodales at, velit. Pellentesque ultricies dignissim",1582,$454.98 ,VFX38LZY5NG
Ori Franco,(731) 200-6674,egestas@google.net,08/20/2000 02:39:37,Ap #179-5454 Orci. St.,495275,Calabarzon,Philippines,11,"egestas a, scelerisque sed, sapien. Nunc pulvinar arcu et pede.",3610,$413.84 ,GND83PDH6GO
Elmo Holt,(884) 231-9256,non.vestibulum.nec@outlook.com,10/2/2015 02:45:10,304-2639 Facilisis Ave,461254,South Chungcheong,Singapore,9,"auctor, nunc nulla vulputate dui, nec tempus mauris erat eget",2707,$311.98 ,GXK44BBI9KH
Serina Giles,(833) 724-7182,nulla.in@protonmail.com,10/12/1982 01:05:28,"8818 Amet, Rd.",2765,West Region,Singapore,17,"Sed diam lorem, auctor quis, tristique ac, eleifend vitae, erat.",2395,$288.22 ,KDT43NMD2VU
Zenia Park,(792) 736-3468,mauris.nulla.integer@yahoo.edu,02/6/2017 03:48:54,Ap #781-1396 Sed St.,2252,Gyeonggi,"Korea, South",13,tempus risus. Donec egestas. Duis ac arcu. Nunc mauris. Morbi,3812,$351.02 ,UGY95SEW0MM
Velma Morrow,1-921-515-1016,tempus.non.lacinia@google.net,03/11/2007 01:05:11,5105 Felis. Rd.,843588,Central Region,"Korea, South",15,"et, rutrum eu, ultrices sit amet, risus. Donec nibh enim,",974,$271.17 ,XWT79ITA0JK
Dexter Freeman,1-311-884-8520,feugiat@yahoo.com,09/30/2011 02:49:57,1113 In Rd.,13308,National Capital Region,Philippines,1,in sodales elit erat vitae risus. Duis a mi fringilla,1227,$43.81 ,KOG79SFU3YN
Caryn Sawyer,1-246-966-6448,leo.morbi@outlook.edu,01/7/2000 01:29:39,237-3097 Cursus Road,574784,Ilocos Region,Singapore,7,"Ut tincidunt orci quis lectus. Nullam suscipit, est ac facilisis",3091,$57.35 ,XLM57NTD3LQ
Aristotle Barry,(502) 861-6575,sed.dolor@google.ca,02/15/2002 01:21:13,369-5876 Suspendisse Road,8418,North Chungcheong,Philippines,13,sed tortor. Integer aliquam adipiscing lacus. Ut nec urna et,573,$42.08 ,GXN35NSY7MT
Britanni Faulkner,1-216-256-1745,tincidunt.vehicula@google.com,08/18/1991 23:06:22,Ap #132-1327 Arcu. Av.,535217,Central Region,Singapore,1,"amet massa. Quisque porttitor eros nec tellus. Nunc lectus pede,",2033,$32.00 ,WJT43CUQ9TI
Colorado Washington,1-724-571-1523,eros.nam.consequat@yahoo.edu,07/7/1997 05:35:42,9052 Nunc Rd.,26485,Cordillera Administrative Region,"Korea, South",13,"cursus a, enim. Suspendisse aliquet, sem ut cursus luctus, ipsum",2372,$47.99 ,WTM12NYT5GJ
Lars Fletcher,(612) 887-6617,hendrerit.consectetuer@hotmail.com,05/26/1994 03:21:44,562-5036 Diam. Ave,1525,Gyeonggi,Philippines,5,Duis dignissim tempor arcu. Vestibulum ut eros non enim commodo,3907,$27.50 ,LOH85YTE5WJ
Maya Spencer,1-804-315-5353,at.nisi.cum@protonmail.net,03/28/2021 05:40:26,7440 Mollis. St.,16981,North Gyeongsang,Singapore,9,eget lacus. Mauris non dui nec urna suscipit nonummy. Fusce,483,$155.18 ,XNM75WBN7MP
Raja Cash,1-706-877-1710,orci@icloud.org,10/22/1978 03:23:57,Ap #626-346 Sit Av.,5458,South Gyeongsang,Philippines,3,"ligula. Nullam enim. Sed nulla ante, iaculis nec, eleifend non,",1845,$31.21 ,CXA63VTR4QO
Brett Faulkner,(222) 438-7918,risus.quis.diam@protonmail.net,04/10/1980 23:39:47,"P.O. Box 607, 9704 Senectus St.",942754,North-East Region,Singapore,19,"sed, facilisis vitae, orci. Phasellus dapibus quam quis diam. Pellentesque",805,$435.02 ,OTG78VKS5ZC
Arthur Aguilar,1-969-225-4673,quis.lectus@protonmail.org,01/14/1984 01:20:27,Ap #285-3220 Gravida Road,3402,North-East Region,Singapore,19,"consectetuer adipiscing elit. Etiam laoreet, libero et tristique pellentesque, tellus",1151,$177.83 ,EOV07EMP6KR
Sean Pugh,(650) 864-8210,augue@google.edu,04/24/2020 03:04:33,"399-1046 Sapien, Street",15662,Jeju,Philippines,17,"justo. Proin non massa non ante bibendum ullamcorper. Duis cursus,",3307,$441.48 ,EPE22ZVZ2ZT
Harlan Cantrell,1-469-478-1163,dictum@hotmail.com,03/8/2007 05:12:58,Ap #501-8423 Magna Road,397227,Jeju,Singapore,5,condimentum. Donec at arcu. Vestibulum ante ipsum primis in faucibus,1983,$427.22 ,MVT35IBY7SL
Tatyana Leach,(523) 225-2756,etiam.vestibulum@outlook.ca,07/28/2014 05:18:36,Ap #674-5745 Facilisi. St.,4505,Ilocos Region,Philippines,7,"non magna. Nam ligula elit, pretium et, rutrum non, hendrerit",4775,$237.97 ,OSJ40FRR6CO
Colin Chaney,1-773-911-6325,ultricies.sem@protonmail.net,06/6/1987 04:22:51,"P.O. Box 416, 1336 Proin Rd.",4142,North Region,Philippines,11,"non, feugiat nec, diam. Duis mi enim, condimentum eget, volutpat",4150,$172.61 ,RXZ84ECM3QM
Aquila Davis,1-968-691-1163,venenatis@google.ca,05/5/1999 04:00:13,381-688 Nunc St.,921,North Region,Philippines,19,arcu. Vestibulum ut eros non enim commodo hendrerit. Donec porttitor,3162,$26.78 ,SDU16FJD0QJ
Whitney Saunders,1-800-364-8520,pharetra@icloud.ca,03/26/2003 05:40:40,944-4391 Scelerisque Street,3787,Gyeonggi,"Korea, South",7,"enim. Nunc ut erat. Sed nunc est, mollis non, cursus",1483,$244.81 ,ROV10WOB7OM
Channing Burris,1-253-469-5589,malesuada@protonmail.org,10/8/2018 01:30:15,879-1847 Nascetur Street,7620,Central Region,Philippines,1,"cursus. Nunc mauris elit, dictum eu, eleifend nec, malesuada ut,",3175,$109.05 ,JSK28OQB2SW
Dolan Duke,1-767-187-1080,adipiscing.lacus.ut@yahoo.net,01/7/2015 23:13:55,"P.O. Box 807, 4262 Orci St.",978862,South Jeolla,Singapore,15,mollis. Duis sit amet diam eu dolor egestas rhoncus. Proin,2656,$441.34 ,EOF48NDI2WA
Victor Salas,1-663-418-5321,urna.et@yahoo.couk,06/14/1981 23:14:09,Ap #237-3721 Leo. Avenue,383352,North Chungcheong,Singapore,17,"egestas rhoncus. Proin nisl sem, consequat nec, mollis vitae, posuere",2049,$436.97 ,LOM31KNQ5QQ
Emma Maldonado,(941) 532-3860,morbi@google.com,01/17/1996 23:01:29,Ap #570-3177 Diam. Road,3151,South Jeolla,"Korea, South",17,purus. Nullam scelerisque neque sed sem egestas blandit. Nam nulla,613,$59.20 ,EIV19LGW1SH
Vivian Ramos,1-678-422-8466,ut.nec@google.org,02/12/2019 02:00:37,"P.O. Box 190, 5910 Eget St.",725328,Davao Region,Singapore,11,"sit amet, consectetuer adipiscing elit. Aliquam auctor, velit eget laoreet",3547,$236.31 ,JOV51KWB5GH
Gloria Benson,(502) 593-4614,dictum@google.couk,12/24/1997 05:33:14,561-7571 Vulputate Avenue,488334,North Region,"Korea, South",7,"cursus, diam at pretium aliquet, metus urna convallis erat, eget",337,$197.48 ,PIY62YWH6LF
Galena Deleon,(648) 213-6398,convallis.erat@google.edu,02/10/2011 23:10:28,"P.O. Box 676, 4345 Ac St.",873,Soccsksargen,Philippines,9,"nec tellus. Nunc lectus pede, ultrices a, auctor non, feugiat",4180,$450.03 ,LFT90CQJ3RG
Vielka Gomez,1-824-176-4217,massa.mauris.vestibulum@protonmail.couk,02/14/1997 00:28:41,Ap #683-9777 Facilisis Ave,663241,North Region,"Korea, South",17,"rhoncus id, mollis nec, cursus a, enim. Suspendisse aliquet, sem",173,$372.27 ,IFN71YJK4DB
Kelsie Neal,1-929-268-4365,venenatis.lacus@yahoo.net,01/3/1984 04:39:23,599-2366 Turpis Road,12955,Zamboanga Peninsula,Singapore,13,eros. Proin ultrices. Duis volutpat nunc sit amet metus. Aliquam,2576,$437.92 ,JFB30ANF1CF
Summer Hartman,(843) 463-4187,elit.pretium@icloud.net,10/24/2016 04:00:31,5645 Convallis Rd.,6369,North-East Region,Singapore,1,"enim, gravida sit amet, dapibus id, blandit at, nisi. Cum",1999,$211.83 ,BWM72SJK6EE
Kermit Curry,1-564-884-5387,dignissim.magna@icloud.edu,11/20/2000 05:08:52,808-646 Phasellus Rd.,217873,North-East Region,Philippines,1,"egestas, urna justo faucibus lectus, a sollicitudin orci sem eget",731,$28.39 ,FXG45IGL6GG
Nora Cain,1-203-378-8926,cras@outlook.org,02/15/2003 04:40:11,1274 Amet St.,636366,Cordillera Administrative Region,"Korea, South",9,at arcu. Vestibulum ante ipsum primis in faucibus orci luctus,305,$3.54 ,QED31XOQ7TC
Bethany Burks,1-625-613-1596,lobortis.quam@icloud.org,02/7/2016 05:08:53,978-8557 Natoque St.,19284,South Jeolla,Singapore,19,"Integer eu lacus. Quisque imperdiet, erat nonummy ultricies ornare, elit",230,$475.00 ,MTQ71EUZ6PM
Dominique Larsen,(594) 483-8033,aenean.sed.pede@protonmail.net,03/20/2018 23:14:25,7964 Sem. Road,16217,Gyeonggi,Philippines,9,Duis ac arcu. Nunc mauris. Morbi non sapien molestie orci,3061,$351.50 ,AFW52KTK2CQ
Marny Mcfarland,(748) 426-5166,massa.vestibulum.accumsan@outlook.couk,05/26/1971 05:51:39,"406-9538 Rutrum, Road",7023,North Chungcheong,Singapore,15,Phasellus in felis. Nulla tempor augue ac ipsum. Phasellus vitae,1556,$390.10 ,SOB04GFS7BN
Jane Graham,(289) 571-4862,orci@yahoo.net,10/8/1997 02:04:31,844 Fames Rd.,435847,North Chungcheong,Singapore,1,nunc interdum feugiat. Sed nec metus facilisis lorem tristique aliquet.,2588,$391.01 ,CGE83ZBV8RQ
Stuart Tanner,1-345-582-6733,erat.eget@aol.ca,02/27/2023 01:24:15,420-1891 Phasellus St.,19129,Southwestern Tagalog Region,Singapore,5,pretium neque. Morbi quis urna. Nunc quis arcu vel quam,2884,$123.40 ,TMX23HNR7OU
Raja Mejia,1-574-778-4605,quis@hotmail.couk,03/14/2015 03:48:19,788-7447 Ultrices Rd.,20149,South Chungcheong,Singapore,11,"feugiat nec, diam. Duis mi enim, condimentum eget, volutpat ornare,",3239,$217.47 ,YOC57XMG3KN
Lewis Hayden,(357) 572-7437,eros.turpis@outlook.couk,11/2/2008 03:51:30,"P.O. Box 660, 1700 Neque Street",13775,Jeju,Singapore,1,"imperdiet dictum magna. Ut tincidunt orci quis lectus. Nullam suscipit,",3926,$174.01 ,OMB62PWC2WO
Levi Navarro,(537) 683-1926,elit.erat@protonmail.edu,11/11/1999 04:14:18,961-7100 Laoreet Street,12504,South Gyeongsang,Philippines,11,libero. Proin sed turpis nec mauris blandit mattis. Cras eget,373,$167.39 ,XHI24VRS1QV
Sopoline Ward,(876) 392-2136,et.magnis@outlook.net,10/22/2013 03:23:21,4101 Nibh. St.,287457,North Jeolla,Singapore,13,"metus vitae velit egestas lacinia. Sed congue, elit sed consequat",1044,$354.83 ,FQN87VJI8MJ
Murphy Anthony,(472) 488-1996,donec.porttitor.tellus@protonmail.org,09/4/1986 02:56:16,250-5013 A St.,2687,Ilocos Region,"Korea, South",5,"adipiscing elit. Etiam laoreet, libero et tristique pellentesque, tellus sem",2832,$344.74 ,EMO37WTQ2XS
Hakeem Fleming,(393) 875-4125,augue@hotmail.com,07/2/1980 01:09:51,5867 Semper Rd.,5264,North-East Region,Philippines,17,"vehicula et, rutrum eu, ultrices sit amet, risus. Donec nibh",2854,$400.11 ,LSF47FKQ2HO
Tyler Hoffman,(167) 886-7260,phasellus.dolor.elit@outlook.net,04/4/1976 05:08:26,534-359 Ultrices. Avenue,5786,North-East Region,Philippines,3,ac ipsum. Phasellus vitae mauris sit amet lorem semper auctor.,3821,$275.83 ,PSD63XKM2QH
Wyoming Hartman,1-566-195-2868,adipiscing.mauris@outlook.com,10/11/2004 05:14:19,"880-1670 Vel, Road",16328,East Region,Singapore,9,"ipsum sodales purus, in molestie tortor nibh sit amet orci.",1388,$277.82 ,FKD47GYH4AG
Maggie Bolton,(425) 783-3053,aliquam.vulputate.ullamcorper@google.org,01/5/1980 00:59:45,"P.O. Box 772, 1034 Nunc St.",4724,Cagayan Valley,Philippines,5,"commodo at, libero. Morbi accumsan laoreet ipsum. Curabitur consequat, lectus",3923,$275.10 ,WLD33YVS4WJ
Noble Finch,1-614-882-4977,nec.tempus@yahoo.edu,12/6/2018 02:25:10,Ap #519-2229 Metus. Av.,534128,Soccsksargen,"Korea, South",5,"Duis risus odio, auctor vitae, aliquet nec, imperdiet nec, leo.",92,$135.70 ,KFF14CHN1MF
Fletcher Branch,(847) 453-2468,pede.nunc.sed@google.org,03/26/1988 01:48:28,5099 Non St.,712883,Jeju,Philippines,7,sollicitudin orci sem eget massa. Suspendisse eleifend. Cras sed leo.,1248,$72.81 ,HLC58VHM2IP
Germane Cortez,(595) 697-7317,elit@yahoo.org,03/6/2021 04:28:37,Ap #515-8565 Aliquet Street,956,North Jeolla,Philippines,19,eget massa. Suspendisse eleifend. Cras sed leo. Cras vehicula aliquet,2052,$358.36 ,KII66YYL8IN
Jorden Galloway,1-751-228-3403,vitae@outlook.net,03/6/1982 05:32:19,"P.O. Box 846, 5007 Euismod Rd.",8478,Gyeonggi,Philippines,3,"amet luctus vulputate, nisi sem semper erat, in consectetuer ipsum",2363,$366.85 ,CEI47DNX3VR
Herrod Sims,(392) 433-3612,rutrum.eu@google.com,02/25/2021 02:03:04,993-7900 Fringilla Road,345655,East Region,Singapore,7,"commodo tincidunt nibh. Phasellus nulla. Integer vulputate, risus a ultricies",4608,$464.46 ,HSF56VJB3DM
Ralph Howe,1-336-820-8527,ultrices.posuere@aol.net,05/4/1984 23:11:42,483-5064 Faucibus. St.,4631,National Capital Region,Philippines,13,"Sed auctor odio a purus. Duis elementum, dui quis accumsan",4076,$299.37 ,GYV58SDV1XT
Kitra Moran,1-575-313-7534,turpis.aliquam@icloud.ca,02/2/1998 04:13:54,"P.O. Box 983, 7347 Vel Road",2042,Gyeonggi,Philippines,15,diam vel arcu. Curabitur ut odio vel est tempor bibendum.,4921,$194.52 ,QYP19TYR3TU
Madaline Thornton,(443) 540-3397,ac.turpis@protonmail.com,07/28/1974 01:55:25,795-5025 Ultrices Ave,458,Central Region,"Korea, South",17,"Integer eu lacus. Quisque imperdiet, erat nonummy ultricies ornare, elit",534,$94.31 ,GPY01LBM2SV
Dominique Brewer,1-263-733-7002,nunc.nulla@icloud.org,09/30/1998 03:57:39,"P.O. Box 540, 5293 Lobortis St.",2394,South Jeolla,Philippines,9,Donec fringilla. Donec feugiat metus sit amet ante. Vivamus non,1313,$273.48 ,GMW81PZV8NE
Lydia Dickson,1-880-468-4485,sed@outlook.net,09/11/2019 23:30:10,"P.O. Box 946, 8033 Proin Av.",16437,North-East Region,Singapore,3,morbi tristique senectus et netus et malesuada fames ac turpis,2378,$451.14 ,EHA51HZS3LK
Dexter Sherman,(626) 869-2406,fringilla.mi.lacinia@icloud.net,01/16/2017 05:09:38,5002 Libero. Road,9876,Western Visayas,Philippines,11,Praesent eu nulla at sem molestie sodales. Mauris blandit enim,2918,$280.58 ,JXY12BWE4RG
Chelsea Burton,(567) 866-7151,erat.neque.non@yahoo.com,10/20/2020 03:03:29,Ap #326-4622 Vestibulum Street,862265,National Capital Region,"Korea, South",19,"quis accumsan convallis, ante lectus convallis est, vitae sodales nisi",2008,$305.98 ,NHD21CHN4GW
Victoria Hood,1-565-858-4423,non.lorem@yahoo.couk,04/7/2007 00:43:45,Ap #303-562 Pretium Av.,28833,West Region,Philippines,3,Vestibulum accumsan neque et nunc. Quisque ornare tortor at risus.,3127,$407.22 ,VJA73UAX2BG
Conan Lamb,(422) 491-6288,curabitur.ut@hotmail.net,05/1/1992 00:08:30,Ap #700-8313 Aenean St.,944468,North Gyeongsang,Singapore,11,"ipsum dolor sit amet, consectetuer adipiscing elit. Aliquam auctor, velit",2870,$180.23 ,QFM29EVB8NM
Aurora Frazier,(636) 251-1567,praesent.eu.nulla@icloud.couk,11/6/1984 05:57:12,Ap #754-6381 Eu Ave,762115,South Chungcheong,Singapore,9,interdum. Curabitur dictum. Phasellus in felis. Nulla tempor augue ac,4055,$260.32 ,UFD22BCI7GG
Leonard Marks,1-761-230-5376,proin@google.couk,06/6/1975 02:03:15,132 Habitant Avenue,326379,Cordillera Administrative Region,Philippines,17,eget lacus. Mauris non dui nec urna suscipit nonummy. Fusce,1747,$158.36 ,RKF25UHT3MG
Haviva Cortez,(484) 591-8653,cursus.et.eros@aol.couk,02/17/2012 23:48:15,1256 In Avenue,27405,East Region,Philippines,13,"elit, pellentesque a, facilisis non, bibendum sed, est. Nunc laoreet",1507,$164.00 ,TMH43VOW8YG
Davis Weeks,(955) 477-6036,odio.auctor@protonmail.couk,08/13/1971 23:35:52,"P.O. Box 692, 3917 Gravida St.",4437,Davao Region,"Korea, South",9,"ut aliquam iaculis, lacus pede sagittis augue, eu tempor erat",2352,$195.45 ,OUT83SYH0SA
Kirk Dejesus,1-575-337-3683,pellentesque.sed@icloud.edu,08/16/1985 01:18:00,"Ap #433-468 Non, Avenue",3315,North Chungcheong,Philippines,13,diam. Pellentesque habitant morbi tristique senectus et netus et malesuada,4609,$242.01 ,JRE11KDR3DW
Penelope Rojas,(945) 567-2418,est.mollis.non@google.edu,04/9/1992 04:28:23,Ap #614-3206 Purus Rd.,11394,North Region,Philippines,13,"natoque penatibus et magnis dis parturient montes, nascetur ridiculus mus.",789,$423.21 ,CEC96ETC4BE
Patricia Bauer,(181) 328-0226,ipsum@icloud.ca,01/3/1998 23:13:13,"P.O. Box 684, 9310 Vivamus Ave",5768,North Gyeongsang,"Korea, South",15,Etiam vestibulum massa rutrum magna. Cras convallis convallis dolor. Quisque,686,$82.31 ,MZR77HCG8DF
Grant Klein,1-507-187-0761,felis.adipiscing@hotmail.edu,08/6/1983 01:42:29,1530 Proin Road,14765,Central Region,Singapore,11,in faucibus orci luctus et ultrices posuere cubilia Curae Phasellus,4251,$241.49 ,SCE63JKP6ZZ
Grace Daugherty,1-372-361-5325,id.libero@aol.ca,02/2/2010 03:23:14,699-1785 Nulla Avenue,5242,North Gyeongsang,Philippines,9,"auctor ullamcorper, nisl arcu iaculis enim, sit amet ornare lectus",667,$200.49 ,SAY55REI5ZW
Idola Schwartz,(362) 342-2383,nec@yahoo.couk,10/13/1972 23:53:45,428-6479 Parturient Road,1805,Davao Region,Philippines,5,Nullam lobortis quam a felis ullamcorper viverra. Maecenas iaculis aliquet,2803,$338.76 ,YYQ77TCA1GO
Pascale Goodman,(522) 919-3722,cras.eget.nisi@aol.com,01/29/2004 02:15:20,7394 Nisl Road,3752,Northern Mindanao,Philippines,17,"orci tincidunt adipiscing. Mauris molestie pharetra nibh. Aliquam ornare, libero",3898,$327.00 ,MRX72MLR9XJ
Melinda Walters,1-865-585-7254,faucibus.ut.nulla@aol.edu,12/3/1978 05:56:53,Ap #968-9688 Risus. Av.,3908,Gangwon,Philippines,5,blandit mattis. Cras eget nisi dictum augue malesuada malesuada. Integer,4906,$232.52 ,JVL08FMJ1RW
Aphrodite Nunez,1-172-936-5550,dui@outlook.net,03/19/1993 03:05:45,406-6763 Lectus Avenue,18317,South Chungcheong,Philippines,9,non nisi. Aenean eget metus. In nec orci. Donec nibh.,2485,$100.84 ,TUZ11FCF9YS
Rogan Contreras,(661) 235-9608,molestie@icloud.couk,08/16/1974 23:36:11,Ap #335-6756 Tellus. Av.,18434,Gyeonggi,"Korea, South",3,"nibh. Donec est mauris, rhoncus id, mollis nec, cursus a,",4739,$270.95 ,EBC29ADK0WE
Sebastian Mercado,1-785-763-6475,sapien.nunc@icloud.edu,09/10/2021 23:43:34,Ap #250-2939 Praesent Street,8521,South Gyeongsang,"Korea, South",13,"Aliquam adipiscing lobortis risus. In mi pede, nonummy ut, molestie",921,$190.80 ,MLU50PVV3PG
Matthew Stuart,1-873-378-2272,consequat.nec@google.net,10/13/1997 04:21:02,"P.O. Box 604, 7992 Laoreet Road",13462,Bicol Region,Philippines,17,"sociis natoque penatibus et magnis dis parturient montes, nascetur ridiculus",1656,$169.45 ,KYG82XPJ5PL
Ashton Hull,1-744-439-5257,dolor.quisque@icloud.com,07/28/1993 04:18:39,"225-8980 Non, Av.",782348,North-East Region,Philippines,17,eleifend. Cras sed leo. Cras vehicula aliquet libero. Integer in,133,$67.62 ,DTD70JFJ7KW
Vincent Crawford,1-898-353-8720,cras.lorem@protonmail.org,03/30/1991 00:42:50,825-4126 Tempor Rd.,387181,Northern Mindanao,Singapore,1,"bibendum sed, est. Nunc laoreet lectus quis massa. Mauris vestibulum,",2682,$420.76 ,ULM91SNV3NJ
Arsenio Morris,(656) 914-3701,euismod.urna.nullam@aol.couk,06/25/1974 23:44:14,9481 Erat Rd.,12862,Gangwon,Philippines,9,"egestas. Sed pharetra, felis eget varius ultrices, mauris ipsum porta",556,$281.98 ,ZQW31DPE1VB
Tarik Perry,(495) 258-9873,lobortis.nisi@icloud.net,12/25/1992 04:26:05,"P.O. Box 125, 9366 Dictum Street",7184,South Gyeongsang,"Korea, South",5,"et magnis dis parturient montes, nascetur ridiculus mus. Proin vel",2507,$186.75 ,GAQ01CNB9QA
Castor Ewing,1-365-443-6261,integer.aliquam.adipiscing@protonmail.ca,06/4/2019 05:28:34,Ap #832-1459 Dui St.,22194,North Region,Singapore,5,orci. Ut semper pretium neque. Morbi quis urna. Nunc quis,4822,$377.01 ,PUQ59TPQ6UY
Tyrone Baxter,1-846-349-3451,nec.mauris@outlook.edu,05/2/1993 01:03:03,"P.O. Box 449, 9506 Fringilla Rd.",496756,Northern Mindanao,Singapore,5,"sodales. Mauris blandit enim consequat purus. Maecenas libero est, congue",4184,$338.61 ,KKK37HPJ4TU
Basil Manning,1-593-260-3560,integer.id@protonmail.couk,07/4/1988 03:17:01,Ap #622-5301 Lacus Av.,17685,Cagayan Valley,Singapore,15,"eleifend egestas. Sed pharetra, felis eget varius ultrices, mauris ipsum",4362,$211.36 ,HJL36IRO2HY
Odette Sherman,1-784-731-1397,vestibulum.ante@aol.org,10/15/2014 05:28:07,8230 Nec Av.,28344,Gyeonggi,Philippines,19,"erat, eget tincidunt dui augue eu tellus. Phasellus elit pede,",3330,$66.53 ,EME51XPV9HR
Drew Underwood,1-101-866-9982,risus@icloud.couk,10/29/1989 00:16:42,Ap #112-2843 Quam. Rd.,275857,Gangwon,Philippines,11,vel arcu eu odio tristique pharetra. Quisque ac libero nec,3176,$53.30 ,BLP73RRY6XX
Sonia Nunez,(374) 917-7325,id.enim.curabitur@aol.org,12/11/1978 02:43:44,"P.O. Box 278, 2848 Dictum St.",977767,Northern Mindanao,Singapore,7,"ipsum sodales purus, in molestie tortor nibh sit amet orci.",4674,$231.57 ,LRB55WUV4VY
Christen Vincent,1-644-419-1755,lobortis.risus@hotmail.org,05/11/1982 01:31:13,Ap #639-7289 Imperdiet St.,231648,North Chungcheong,Singapore,1,"magnis dis parturient montes, nascetur ridiculus mus. Donec dignissim magna",2193,$97.95 ,CCI80AUR8RS
Sarah Lynn,(661) 223-5781,iaculis@aol.net,08/9/2013 05:27:30,396-5208 Sem St.,456562,Western Visayas,"Korea, South",9,"cursus non, egestas a, dui. Cras pellentesque. Sed dictum. Proin",3794,$325.49 ,UEJ74BRW8GF
Portia Spencer,1-864-384-7937,nunc.quis@protonmail.org,11/6/2006 23:24:51,343-298 Vehicula St.,845299,South Gyeongsang,Singapore,3,"est, mollis non, cursus non, egestas a, dui. Cras pellentesque.",1194,$473.61 ,WUE31RPD5JK
Alvin Logan,1-308-485-5423,ultrices@outlook.ca,03/21/2005 00:51:43,"8365 Elit, Street",1408,North Chungcheong,"Korea, South",11,massa rutrum magna. Cras convallis convallis dolor. Quisque tincidunt pede,4164,$324.76 ,ZGN40FWH4FN
Ferdinand Carey,(572) 515-4392,euismod.in@yahoo.ca,01/7/1990 00:47:49,766-2185 Pellentesque St.,785634,Davao Region,Philippines,9,eget massa. Suspendisse eleifend. Cras sed leo. Cras vehicula aliquet,4412,$180.58 ,PXS19RUS7YZ
Hamish Gonzalez,1-800-272-5113,mollis.nec@google.net,10/30/2008 03:52:16,"196-4848 Sed, Rd.",122561,East Region,Philippines,19,"lorem ipsum sodales purus, in molestie tortor nibh sit amet",1367,$259.39 ,XIA86CVJ7XJ
Adrian Mckinney,1-165-860-7732,non.hendrerit.id@outlook.couk,05/12/2014 23:17:15,1035 Enim. Ave,584554,Western Visayas,Singapore,19,"eu erat semper rutrum. Fusce dolor quam, elementum at, egestas",237,$53.07 ,JOX95GPG3XH
MacKensie Cummings,(646) 664-4848,vivamus.molestie.dapibus@outlook.org,08/30/2003 23:17:13,739-9787 Purus Avenue,13817,Northern Mindanao,Singapore,13,"magna. Nam ligula elit, pretium et, rutrum non, hendrerit id,",1696,$325.13 ,LQM46RFR2EL
Salvador Middleton,(901) 687-1467,nec.tellus@google.edu,10/16/1993 00:28:20,332-5734 Nulla St.,2015,West Region,Philippines,5,non dui nec urna suscipit nonummy. Fusce fermentum fermentum arcu.,264,$69.92 ,EHQ39RCL0QW
Ria Mcmillan,1-461-603-6598,pretium@outlook.ca,06/16/1991 05:26:50,398-8002 Molestie St.,6571,South Chungcheong,Singapore,19,metus. Aliquam erat volutpat. Nulla facilisis. Suspendisse commodo tincidunt nibh.,3748,$248.72 ,KSQ13QTA6RI
Joelle Hull,1-666-418-4261,in.magna.phasellus@hotmail.couk,10/10/2008 01:27:19,9096 Facilisis Rd.,6164,Western Visayas,"Korea, South",9,eros. Proin ultrices. Duis volutpat nunc sit amet metus. Aliquam,287,$60.49 ,XKJ77LFW8JS
Eaton Mccarthy,(964) 724-8264,morbi@protonmail.ca,03/6/1979 00:16:31,3693 Sed Av.,772,Jeju,"Korea, South",15,"ut ipsum ac mi eleifend egestas. Sed pharetra, felis eget",3554,$365.77 ,SRR64JGE5FL
Plato Abbott,(435) 741-6405,cum@hotmail.org,10/18/2002 23:50:27,"222-8027 Lectus, Avenue",12983,Davao Region,Singapore,5,enim. Etiam imperdiet dictum magna. Ut tincidunt orci quis lectus.,3324,$66.09 ,VKI72QZL8YC
Abdul Callahan,(461) 452-0534,dolor@google.edu,09/3/1993 05:04:20,632-8050 Nulla Road,767382,Central Region,Singapore,17,"dictum magna. Ut tincidunt orci quis lectus. Nullam suscipit, est",1280,$480.43 ,KWE93LJK1GQ
Donna Hatfield,(568) 661-1536,quis.pede@aol.couk,08/5/2022 23:24:37,Ap #379-3298 Nunc Rd.,985782,Central Region,"Korea, South",3,vitae erat vel pede blandit congue. In scelerisque scelerisque dui.,1336,$103.21 ,KJY40YUM5YD
Kato Oneal,1-340-279-4672,non.dui.nec@outlook.net,10/24/1987 03:25:57,Ap #602-3620 Rutrum Street,7423,East Region,"Korea, South",7,"vel, convallis in, cursus et, eros. Proin ultrices. Duis volutpat",1111,$208.51 ,QLF52NHO2JG
Gil Gilliam,(745) 249-3721,arcu@hotmail.net,02/11/1999 23:10:01,184-8643 Cras Ave,6837,Central Visayas,Singapore,13,"magnis dis parturient montes, nascetur ridiculus mus. Proin vel nisl.",532,$58.75 ,GFD83SBA5HT
Alice Baird,(158) 681-7212,donec@icloud.ca,06/1/2011 00:58:29,699-8581 Aliquam Av.,733445,Eastern Visayas,Singapore,5,"auctor odio a purus. Duis elementum, dui quis accumsan convallis,",2722,$422.16 ,CYY76XVX6HG
Damon Bass,1-415-404-3328,ligula.tortor@icloud.ca,06/18/2012 00:52:48,"P.O. Box 519, 340 Amet, Av.",5384,South Jeolla,"Korea, South",13,Nulla semper tellus id nunc interdum feugiat. Sed nec metus,4057,$302.51 ,OSQ22KSU0GO
McKenzie Mccormick,1-213-178-5121,dolor.dolor.tempus@outlook.edu,05/2/1981 00:04:17,"629-6752 Nunc, Avenue",5283,West Region,Philippines,9,varius. Nam porttitor scelerisque neque. Nullam nisl. Maecenas malesuada fringilla,1945,$212.21 ,OUB94KCS4DD
Lacy Cameron,(338) 653-9383,magnis.dis@yahoo.edu,01/25/1978 04:42:58,Ap #873-4185 Sit Rd.,4715,North-East Region,Singapore,13,Praesent interdum ligula eu enim. Etiam imperdiet dictum magna. Ut,1057,$154.40 ,YUR21JEO1HJ
Conan Bates,1-589-896-9445,neque.sed@aol.edu,06/8/1986 03:44:51,"633-1426 Amet, Street",945522,Gangwon,"Korea, South",9,malesuada malesuada. Integer id magna et ipsum cursus vestibulum. Mauris,1370,$344.05 ,YTN23UEP0VE
Macey Larsen,1-115-213-6156,sed@protonmail.couk,05/31/1998 02:32:44,793-1664 Volutpat. Avenue,568728,Ilocos Region,Singapore,11,Sed eget lacus. Mauris non dui nec urna suscipit nonummy.,2547,$151.96 ,QXN71EQW5FW
