name,phone,email,birthdate,address,postalZip,region,country,list,text,numberrange,currency,alphanumeric
Rogan Roberson,(452) 280-2356,ligula.nullam.feugiat@aol.net,11/6/1977 23:02:21,Ap #219-6032 Justo Rd.,6368,East Region,Philippines,9,Vivamus nisi. Mauris nulla. Integer urna. Vivamus molestie dapibus ligula.,2043,$336.62 ,VYT67CDX2MQ
Branden Buckner,1-226-354-6820,nam.porttitor@protonmail.couk,03/21/1978 23:53:51,"P.O. Box 250, 1593 Velit Av.",525479,Northern Mindanao,"Korea, South",11,"Donec tempus, lorem fringilla ornare placerat, orci lacus vestibulum lorem,",1328,$384.50 ,HEN76CLY5VX
Robert Hull,1-443-867-9662,adipiscing@google.net,12/22/1989 05:30:40,676 Ornare St.,28189,Western Visayas,"Korea, South",3,"id, erat. Etiam vestibulum massa rutrum magna. Cras convallis convallis",2333,$445.52 ,KXY28BBA6CC
Laith Nicholson,1-246-829-6553,auctor.ullamcorper@protonmail.couk,02/22/1991 23:31:59,974-273 Sem Rd.,12804,North Gyeongsang,Singapore,13,Curae Donec tincidunt. Donec vitae erat vel pede blandit congue.,486,$8.43 ,BLB55CLJ9KH
Ross Stark,1-984-161-0341,fermentum.risus.at@icloud.couk,01/31/2021 04:08:32,519 Nascetur St.,636646,North-East Region,"Korea, South",3,Nulla semper tellus id nunc interdum feugiat. Sed nec metus,4014,$139.16 ,QJG43FHQ0VJ
Ann Huff,1-240-821-4296,vehicula@yahoo.couk,12/11/2017 05:49:10,677-2989 Vivamus Rd.,2749,North Jeolla,Singapore,5,"at, velit. Cras lorem lorem, luctus ut, pellentesque eget, dictum",1366,$494.11 ,KOQ38QLI1MJ
Dexter Nicholson,(430) 832-5807,urna@yahoo.edu,08/14/2012 02:26:39,794-5555 Risus Avenue,874455,North Region,"Korea, South",19,"orci, adipiscing non, luctus sit amet, faucibus ut, nulla. Cras",2497,$457.47 ,XNN65NJP3MT
Briar Knight,(418) 851-7727,leo@icloud.org,02/4/1977 23:47:43,9360 At Av.,17238,National Capital Region,Philippines,19,"aliquet. Proin velit. Sed malesuada augue ut lacus. Nulla tincidunt,",4794,$292.21 ,DNF36MRW4IN
Hadley Hanson,(284) 511-4828,elit.pellentesque@google.net,04/7/2007 00:46:22,"287-1310 Adipiscing, St.",8255,Caraga,Philippines,13,magna. Praesent interdum ligula eu enim. Etiam imperdiet dictum magna.,171,$360.36 ,ROY23UCC1JN
Wanda Holden,1-291-134-1282,ipsum.primis.in@yahoo.couk,08/4/2009 02:45:18,"P.O. Box 378, 4015 Rutrum. Rd.",668215,North Region,"Korea, South",3,euismod est arcu ac orci. Ut semper pretium neque. Morbi,2508,$243.02 ,TRS63UPT0FJ
Lee Cardenas,(325) 408-2367,facilisis.eget.ipsum@protonmail.couk,04/1/1999 04:54:42,"Ap #805-3138 In, St.",9758,South Chungcheong,Philippines,1,"Suspendisse non leo. Vivamus nibh dolor, nonummy ac, feugiat non,",982,$449.07 ,ZEL33GLX6HA
Madison Donovan,(816) 152-5145,montes@outlook.org,04/18/2020 04:35:30,586-5677 Nullam St.,14258,Gyeonggi,Singapore,17,"dui, semper et, lacinia vitae, sodales at, velit. Pellentesque ultricies",4843,$227.76 ,GJB61VVF8OS
Coby Spencer,(832) 786-8568,sed@aol.edu,07/29/1970 23:54:57,"P.O. Box 545, 9121 Praesent Rd.",5337,East Region,Philippines,3,"parturient montes, nascetur ridiculus mus. Proin vel arcu eu odio",3150,$186.90 ,EVZ53ENP5OH
Kaye Alford,1-432-301-2314,duis.cursus.diam@outlook.net,04/17/2011 05:48:38,Ap #204-7986 Aliquet St.,852228,Cordillera Administrative Region,Philippines,3,Nunc quis arcu vel quam dignissim pharetra. Nam ac nulla.,2861,$226.20 ,LLC90CPL8PL
Tarik Quinn,(632) 446-9813,lacus.etiam@aol.com,08/17/1988 23:23:50,528-8487 Sit St.,18683,Cagayan Valley,Philippines,13,Pellentesque habitant morbi tristique senectus et netus et malesuada fames,516,$214.26 ,KUC14OSC0YM
Chadwick Meyers,(762) 725-9333,in@hotmail.com,03/8/1994 03:26:23,"P.O. Box 462, 5268 Egestas Street",17535,Calabarzon,Philippines,13,luctus lobortis. Class aptent taciti sociosqu ad litora torquent per,3075,$450.37 ,QZB39EVC3HN
Zachary Johns,(865) 861-6815,consectetuer@aol.couk,01/24/1983 03:53:46,283-6977 Nisl. Avenue,536936,North Jeolla,Philippines,5,"tellus. Suspendisse sed dolor. Fusce mi lorem, vehicula et, rutrum",4367,$34.61 ,GPD45QDA5GY
Alma Ellis,1-575-254-8977,vitae.aliquet.nec@aol.edu,10/14/1980 03:28:11,Ap #309-9203 Mauris Ave,7243,Western Visayas,Singapore,13,"dis parturient montes, nascetur ridiculus mus. Proin vel nisl. Quisque",4202,$288.93 ,DGQ45JNO4BP
Byron Huffman,1-818-863-2374,elit.nulla.facilisi@google.org,06/19/2022 02:05:53,"P.O. Box 678, 4351 Dui. Rd.",16168,North Region,Philippines,19,"et magnis dis parturient montes, nascetur ridiculus mus. Proin vel",3745,$366.93 ,SHW33QDF6UP
Kuame Dillard,(177) 262-5981,lorem.donec.elementum@icloud.ca,09/8/2007 00:36:44,572-2603 Et Rd.,14264,Zamboanga Peninsula,"Korea, South",7,"venenatis vel, faucibus id, libero. Donec consectetuer mauris id sapien.",4537,$422.12 ,UMK07GLL1BT
Matthew Austin,(888) 296-3306,nibh.enim@aol.ca,12/6/2010 01:20:52,2778 Lacus. Road,13561,Gyeonggi,Singapore,7,"non, hendrerit id, ante. Nunc mauris sapien, cursus in, hendrerit",3644,$494.91 ,DIR33BKU0IV
India Roth,(583) 603-1268,sollicitudin.commodo@protonmail.ca,09/13/1996 02:19:13,355-830 Blandit Rd.,15308,Gyeonggi,"Korea, South",17,Praesent interdum ligula eu enim. Etiam imperdiet dictum magna. Ut,2257,$161.86 ,CJQ73RSE3BP
Hiram Hinton,1-216-383-7298,nec.malesuada@google.com,04/1/1991 00:51:39,564-6931 Amet Rd.,9658,National Capital Region,Singapore,13,"parturient montes, nascetur ridiculus mus. Aenean eget magna. Suspendisse tristique",3565,$32.45 ,XDL76HQL5JR
Maggy Hogan,1-141-824-7261,proin.vel@aol.edu,12/11/1998 05:18:21,Ap #943-4169 Luctus Rd.,22782,Central Region,Singapore,9,molestie arcu. Sed eu nibh vulputate mauris sagittis placerat. Cras,2313,$456.07 ,KNF78BGK3SY
Tana Gilbert,(477) 358-4073,egestas@protonmail.couk,12/3/2003 00:35:52,Ap #694-9157 Pharetra Road,23658,South Jeolla,Singapore,5,"ipsum ac mi eleifend egestas. Sed pharetra, felis eget varius",4589,$485.16 ,XNL94PER8CD
Ora Lara,(816) 175-7570,mollis@google.couk,01/13/2021 04:52:06,683-8590 Est. Avenue,861,Jeju,Singapore,5,ligula. Aliquam erat volutpat. Nulla dignissim. Maecenas ornare egestas ligula.,4942,$13.44 ,RDO07QTF9OV
Kaye Morrow,1-742-647-3415,convallis.est@google.org,02/28/2021 00:43:17,832-259 Fringilla St.,28880,North Jeolla,Philippines,5,"iaculis aliquet diam. Sed diam lorem, auctor quis, tristique ac,",9,$102.50 ,MBA11LUC8OG
George Cotton,1-710-247-4102,erat.neque.non@aol.org,05/21/1985 00:47:17,720-8543 In St.,884,Jeju,Philippines,13,neque venenatis lacus. Etiam bibendum fermentum metus. Aenean sed pede,1850,$252.17 ,LCF27VML6BF
Castor Gomez,(314) 932-1135,non.sollicitudin@icloud.net,12/8/1973 05:07:41,"P.O. Box 368, 1810 Parturient Avenue",13285,Zamboanga Peninsula,"Korea, South",17,augue ac ipsum. Phasellus vitae mauris sit amet lorem semper,2089,$68.79 ,OTP61SWE4SP
Ferdinand Britt,1-796-862-1117,massa.lobortis.ultrices@protonmail.com,12/15/2014 01:36:07,750-415 Turpis Avenue,29724,East Region,Philippines,1,"enim, gravida sit amet, dapibus id, blandit at, nisi. Cum",2735,$387.29 ,XOK37WTT8IK
Rachel Pittman,1-252-382-3718,nibh.phasellus.nulla@aol.ca,05/29/1972 05:17:03,1389 Urna. Road,12487,Central Region,Philippines,19,metus. In nec orci. Donec nibh. Quisque nonummy ipsum non,2503,$287.02 ,DGZ28PDD4OO
Emerson Mason,(585) 411-8264,proin@protonmail.edu,09/12/1991 02:35:17,"P.O. Box 359, 8151 Suspendisse Rd.",187312,South Gyeongsang,"Korea, South",13,"magna. Ut tincidunt orci quis lectus. Nullam suscipit, est ac",3297,$295.28 ,NHC88VMJ5OD
Wallace Watson,1-603-123-2833,mollis.phasellus@icloud.net,09/18/1990 05:44:12,739-4998 Et St.,202,West Region,Singapore,13,pede. Praesent eu dui. Cum sociis natoque penatibus et magnis,799,$128.78 ,GJQ47ODK5LJ
Palmer Guerrero,(906) 674-4874,egestas.fusce@protonmail.couk,10/22/2007 03:05:47,950-7275 Nunc Rd.,534922,South Gyeongsang,"Korea, South",19,Cras vulputate velit eu sem. Pellentesque ut ipsum ac mi,4353,$149.65 ,GRR32BBQ9ZE
Audra Delgado,(864) 647-8512,vehicula.et.rutrum@hotmail.net,04/26/1973 23:11:01,"Ap #299-7913 Nostra, Street",4748,Northern Mindanao,Singapore,19,"ullamcorper eu, euismod ac, fermentum vel, mauris. Integer sem elit,",2665,$213.42 ,QVR77HXL2YL
Teagan George,(463) 285-6877,cursus.nunc@aol.org,05/11/1976 00:03:01,178-6456 Fringilla St.,9534,Central Region,Singapore,19,"libero nec ligula consectetuer rhoncus. Nullam velit dui, semper et,",1902,$385.59 ,KSE45JNU8XH
Meghan Ayers,(817) 907-7409,malesuada.ut@outlook.com,02/21/2001 02:13:03,"136-7246 At, Rd.",2542,Jeju,Philippines,5,"sed dictum eleifend, nunc risus varius orci, in consequat enim",2504,$300.40 ,WUJ05CCU8LW
Jolie Barry,(285) 342-4530,sed@icloud.org,01/26/2023 03:07:38,"P.O. Box 612, 3824 Urna Avenue",918749,Calabarzon,Singapore,1,"a, magna. Lorem ipsum dolor sit amet, consectetuer adipiscing elit.",4449,$204.70 ,QCR18SAN5PX
Thane Whitaker,(934) 455-2028,elit.elit.fermentum@outlook.couk,03/8/2015 02:48:47,241-7511 Est. St.,335384,Northern Mindanao,"Korea, South",5,"dui augue eu tellus. Phasellus elit pede, malesuada vel, venenatis",3103,$0.90 ,LVE21BLB9OT
Jolie Simon,1-341-792-9436,fringilla@protonmail.ca,06/27/2003 05:29:45,299-6575 Nisi Street,4334,Bicol Region,Philippines,11,"euismod in, dolor. Fusce feugiat. Lorem ipsum dolor sit amet,",3818,$53.23 ,BHC39RXD9UE
Noble Simon,1-384-313-3590,rutrum.urna@google.couk,09/30/1991 03:12:55,501-9091 Donec Av.,8026,Caraga,Philippines,17,"facilisis, magna tellus faucibus leo, in lobortis tellus justo sit",3417,$336.98 ,RPY77KMW5SG
Hayden Stevenson,(348) 857-3324,neque.sed@hotmail.edu,09/29/2000 23:36:38,"979-3204 Magna, St.",25232,Eastern Visayas,"Korea, South",9,"tincidunt dui augue eu tellus. Phasellus elit pede, malesuada vel,",4927,$357.00 ,TPJ51NNW3QR
Driscoll Benjamin,(346) 976-0027,auctor.ullamcorper.nisl@yahoo.edu,03/7/1974 03:30:29,117-1020 Quam Rd.,334882,Central Luzon,Singapore,15,ligula. Aliquam erat volutpat. Nulla dignissim. Maecenas ornare egestas ligula.,356,$146.57 ,CXL38PFF5AB
James Barker,(496) 512-8611,pede.praesent@protonmail.net,07/3/1984 23:18:49,3835 Ut St.,3345,East Region,Singapore,15,"semper rutrum. Fusce dolor quam, elementum at, egestas a, scelerisque",2560,$404.49 ,YCS77POE5AR
Hammett Mccarthy,1-587-687-0584,augue.sed@yahoo.ca,07/10/1999 00:32:18,453-6976 Nunc Road,763758,Central Luzon,Singapore,3,"convallis, ante lectus convallis est, vitae sodales nisi magna sed",3008,$443.35 ,FQC13JQY4TF
Cruz Hodge,(388) 271-1374,mauris.blandit@yahoo.couk,02/25/1971 04:33:19,263-7091 Aenean Rd.,2853,Caraga,"Korea, South",15,Morbi quis urna. Nunc quis arcu vel quam dignissim pharetra.,1140,$447.14 ,GYD71IAM4ET
Sebastian Rowland,(283) 411-1072,donec.est@icloud.com,11/24/2000 01:58:50,729-5057 Magna. St.,748962,Southwestern Tagalog Region,Philippines,17,"egestas. Aliquam nec enim. Nunc ut erat. Sed nunc est,",1880,$72.83 ,LRE20DMW7RI
Chaney Sykes,1-251-931-3906,aliquet.libero.integer@hotmail.edu,06/7/1979 01:43:06,Ap #986-1939 Maecenas Street,271372,South Chungcheong,"Korea, South",11,In faucibus. Morbi vehicula. Pellentesque tincidunt tempus risus. Donec egestas.,1671,$55.56 ,QRY63BYC9WF
Marshall Henson,(812) 688-5256,vitae.sodales.at@icloud.com,07/1/1984 01:50:51,"P.O. Box 308, 3125 Ante. St.",2889,South Jeolla,Singapore,7,vitae aliquam eros turpis non enim. Mauris quis turpis vitae,137,$436.41 ,NST41FHO2LC
Berk Ford,1-744-883-5021,posuere.vulputate.lacus@outlook.org,05/3/1972 23:16:56,Ap #874-6683 Per Road,14275,Eastern Visayas,"Korea, South",15,"est ac facilisis facilisis, magna tellus faucibus leo, in lobortis",4835,$393.49 ,OYB67HSQ7ON
Barclay Jacobs,1-663-635-9063,ac@protonmail.org,08/6/1989 00:46:46,Ap #478-8707 Pede. St.,3386,Bangsamoro,Philippines,15,nibh sit amet orci. Ut sagittis lobortis mauris. Suspendisse aliquet,1933,$403.91 ,LOV03JDO9BM
Ivana Santos,(784) 465-4786,sem@aol.org,04/19/2010 04:25:51,"P.O. Box 361, 2248 Aliquam Avenue",322528,West Region,Singapore,7,"sagittis felis. Donec tempor, est ac mattis semper, dui lectus",2528,$304.62 ,SMG96TSF8NC
Indigo Moody,1-917-483-2435,diam.proin.dolor@aol.net,10/13/2012 04:19:53,"P.O. Box 953, 880 Augue, Av.",11045,Central Luzon,"Korea, South",17,"bibendum ullamcorper. Duis cursus, diam at pretium aliquet, metus urna",414,$119.24 ,NCW94ELP7YN
Baxter Alston,1-772-939-5482,rutrum.non@aol.edu,03/8/2006 02:01:58,619-3515 Eu Rd.,543182,North Jeolla,Singapore,11,"sit amet, faucibus ut, nulla. Cras eu tellus eu augue",65,$459.44 ,XBL18CRI1CI
Felix Morris,(449) 824-3197,blandit.viverra@aol.ca,01/11/2009 05:08:19,Ap #147-1683 Neque Av.,7605,North-East Region,Philippines,19,"ullamcorper. Duis cursus, diam at pretium aliquet, metus urna convallis",4768,$143.01 ,HRE53VTP0HT
Stacy Mays,1-272-883-8288,ac.nulla@protonmail.couk,03/5/2001 00:52:20,812-2076 Sagittis. Road,18266,Bangsamoro,Singapore,13,"Aliquam gravida mauris ut mi. Duis risus odio, auctor vitae,",2695,$130.99 ,CED27TYQ5UT
Yvonne Richmond,(625) 385-3548,ut.ipsum@icloud.couk,01/7/2015 03:39:50,379-3525 Nec Ave,813462,Bangsamoro,Singapore,13,"mattis semper, dui lectus rutrum urna, nec luctus felis purus",988,$167.30 ,FSN27DMO8LO
Sylvia Spence,1-691-562-2003,primis.in.faucibus@hotmail.net,03/24/1998 04:15:23,762-7161 Pellentesque St.,7210,Central Region,Singapore,9,"arcu iaculis enim, sit amet ornare lectus justo eu arcu.",1921,$490.92 ,WTW34LLO3ZN
Malcolm Odom,(845) 481-8605,sed@protonmail.edu,03/31/1975 00:28:54,3609 Fermentum Rd.,257568,North Gyeongsang,Singapore,19,"Nunc sed orci lobortis augue scelerisque mollis. Phasellus libero mauris,",425,$339.07 ,QQF07IIZ0LS
Harding Rhodes,1-936-578-7785,faucibus.morbi@hotmail.ca,10/31/1977 23:09:40,268-4544 Nunc Street,1480,East Region,Singapore,11,a tortor. Nunc commodo auctor velit. Aliquam nisl. Nulla eu,1698,$365.32 ,KUU38VFT1PD
Kermit Campbell,(126) 769-7178,ac.orci@outlook.ca,09/14/2010 04:19:54,2653 Sed Street,8556,North Region,Singapore,15,nunc sed pede. Cum sociis natoque penatibus et magnis dis,1360,$444.21 ,MJG21QWR8QI
Armand Anthony,1-395-803-1754,imperdiet.ullamcorper@hotmail.org,09/25/1981 00:19:43,297-1026 Sodales Road,355652,Zamboanga Peninsula,Philippines,5,aliquam arcu. Aliquam ultrices iaculis odio. Nam interdum enim non,4643,$1.14 ,ODV51HRF7ZV
Dorothy Walton,1-355-560-4592,non@outlook.com,06/11/2004 04:11:21,Ap #569-3181 Nec Av.,743659,South Gyeongsang,Singapore,3,"natoque penatibus et magnis dis parturient montes, nascetur ridiculus mus.",1150,$294.89 ,VPI67DXN5PT
Matthew Ware,1-257-889-9511,scelerisque.lorem@icloud.edu,09/16/2018 00:40:17,Ap #150-8893 Et Avenue,882848,West Region,Singapore,1,"Nunc ullamcorper, velit in aliquet lobortis, nisi nibh lacinia orci,",3278,$362.86 ,YNV43FPO2JS
Wynter Albert,1-566-884-6451,consequat.lectus@outlook.edu,02/13/1974 04:57:34,Ap #159-6975 Tellus St.,10676,Cagayan Valley,"Korea, South",11,"vestibulum nec, euismod in, dolor. Fusce feugiat. Lorem ipsum dolor",3772,$421.33 ,FEV46FNU8YP
Aphrodite Osborne,(110) 815-5754,vitae@google.ca,11/24/2015 03:35:39,"602-6256 Augue, Ave",14204,Gyeonggi,Singapore,17,molestie arcu. Sed eu nibh vulputate mauris sagittis placerat. Cras,1697,$405.08 ,XGE67BUJ1UF
Stephanie Taylor,1-288-567-4711,cursus.luctus@icloud.edu,06/20/1976 00:48:29,"P.O. Box 541, 1214 Luctus Rd.",8684,South Gyeongsang,"Korea, South",1,odio sagittis semper. Nam tempor diam dictum sapien. Aenean massa.,116,$426.19 ,NFT21VFP8HW
Camilla Chan,(671) 267-6456,nulla.facilisi@hotmail.couk,02/23/1988 03:17:35,"9101 Et, St.",4405,Central Region,"Korea, South",9,"sit amet, consectetuer adipiscing elit. Aliquam auctor, velit eget laoreet",3278,$211.25 ,CUU06QNG5SL
Lionel Blake,(187) 333-2453,consequat.dolor@icloud.org,07/1/1994 02:02:22,"594-8738 Nostra, Ave",435333,North Jeolla,Singapore,11,odio sagittis semper. Nam tempor diam dictum sapien. Aenean massa.,2304,$40.14 ,OJY54DAN5DR
Chester Bennett,1-411-754-7646,a@outlook.edu,03/7/2004 00:42:33,"Ap #429-2028 Sem, Ave",4005,North Gyeongsang,Singapore,19,blandit congue. In scelerisque scelerisque dui. Suspendisse ac metus vitae,176,$462.89 ,WEQ71EED5VP
Hedda Bell,(938) 522-5890,id.sapien@outlook.com,02/27/2004 05:33:20,853-4948 Sollicitudin Street,783783,East Region,Singapore,7,"ullamcorper eu, euismod ac, fermentum vel, mauris. Integer sem elit,",4339,$275.01 ,MLD48LJH1ER
Honorato Avila,1-658-838-4977,nulla@protonmail.couk,12/31/1977 01:15:13,110-7519 Nec Street,4771,Soccsksargen,Philippines,1,"Maecenas mi felis, adipiscing fringilla, porttitor vulputate, posuere vulputate, lacus.",4683,$107.32 ,CLK90LVR1JP
Kenneth Sullivan,1-982-544-4330,congue.in@yahoo.couk,05/16/1993 04:09:41,Ap #781-3785 Risus Street,6057,Zamboanga Peninsula,"Korea, South",13,"auctor non, feugiat nec, diam. Duis mi enim, condimentum eget,",4243,$18.63 ,GXK85AAC2SY
Noelle Hooper,1-861-564-5129,fringilla.est.mauris@aol.com,03/26/2019 02:21:12,4620 Adipiscing. Road,3316,South Gyeongsang,Philippines,15,turpis vitae purus gravida sagittis. Duis gravida. Praesent eu nulla,4513,$209.14 ,TEX77QYF3AG
Kennan George,1-643-621-4872,donec@hotmail.com,05/9/1971 01:25:12,356-3994 Risus Av.,7339,West Region,"Korea, South",19,"ante bibendum ullamcorper. Duis cursus, diam at pretium aliquet, metus",789,$361.01 ,OQJ11MZU4DS
Garth Phillips,1-547-417-6135,in.mi@aol.org,01/9/2011 23:03:45,208-8355 Ante Rd.,5663,North Region,"Korea, South",11,"pellentesque, tellus sem mollis dui, in sodales elit erat vitae",2868,$124.84 ,HWL54FJH5DK
Abigail Olson,1-547-826-5270,velit.aliquam@google.couk,05/17/1994 03:02:04,506-3125 In Road,885368,Zamboanga Peninsula,Singapore,3,"ipsum sodales purus, in molestie tortor nibh sit amet orci.",91,$162.60 ,WOM56GBM6JC
Griffith Robinson,1-880-135-8888,ante@outlook.couk,12/6/2016 02:35:46,"P.O. Box 545, 136 Non, Rd.",19671,Calabarzon,Singapore,13,vitae erat vel pede blandit congue. In scelerisque scelerisque dui.,1543,$410.65 ,LXF62ULQ3PB
Amber Villarreal,(336) 527-4307,sem.vitae@google.edu,08/11/1988 23:58:25,590 Dignissim Av.,3688,North Jeolla,Philippines,19,"aliquet nec, imperdiet nec, leo. Morbi neque tellus, imperdiet non,",3926,$198.02 ,OIF23GDQ3HU
Chandler Cummings,1-541-167-0226,non@protonmail.edu,10/28/2020 00:03:32,866-2922 Euismod Street,253885,North-East Region,Singapore,5,"auctor, nunc nulla vulputate dui, nec tempus mauris erat eget",3116,$378.03 ,BKP64FNS2EO
Ashely Kirby,(662) 861-7851,lacus.quisque@protonmail.org,05/15/2009 04:05:01,"2474 Elit, St.",2681,East Region,Philippines,19,primis in faucibus orci luctus et ultrices posuere cubilia Curae,3637,$426.21 ,MFP85JBM4LS
Magee Sanchez,(854) 527-1011,integer@icloud.org,02/5/1994 02:08:51,Ap #174-590 Arcu St.,174424,Zamboanga Peninsula,Philippines,1,eros. Nam consequat dolor vitae dolor. Donec fringilla. Donec feugiat,2044,$101.08 ,YOR71MSO9YL
Jermaine Brown,1-172-617-8515,molestie.orci@aol.ca,08/16/2004 01:31:58,Ap #632-5213 Nunc Rd.,2622,West Region,Philippines,9,Donec nibh. Quisque nonummy ipsum non arcu. Vivamus sit amet,324,$135.01 ,EFM83UVU7TN
Georgia Curtis,1-728-845-4765,convallis@outlook.com,05/14/1975 00:55:02,Ap #683-3824 Vulputate Street,863,Caraga,"Korea, South",19,dui nec urna suscipit nonummy. Fusce fermentum fermentum arcu. Vestibulum,1653,$415.26 ,PSB78CON4XV
Drake Cleveland,(574) 813-9067,semper.nam@icloud.com,05/29/2010 05:47:59,Ap #473-9127 Sed Avenue,611727,Zamboanga Peninsula,Philippines,9,"quam, elementum at, egestas a, scelerisque sed, sapien. Nunc pulvinar",2858,$342.84 ,KQR04YJH8YN
Dolan Stafford,(892) 128-4941,egestas.blandit.nam@yahoo.edu,10/9/2012 00:43:29,920-4192 Curabitur Rd.,1561,Central Region,Philippines,9,Praesent interdum ligula eu enim. Etiam imperdiet dictum magna. Ut,4577,$410.38 ,TWI39CQD1JA
Brennan Alford,1-230-831-9884,vitae.dolor.donec@protonmail.ca,08/2/2013 02:12:09,"P.O. Box 105, 1808 Donec Road",975258,South Jeolla,Singapore,9,"libero nec ligula consectetuer rhoncus. Nullam velit dui, semper et,",536,$300.40 ,KJY75CFC8BU
Cruz Blackburn,(946) 693-8847,eu.ultrices@hotmail.edu,07/9/1982 04:41:07,"P.O. Box 249, 8354 Dictum Avenue",228,North Gyeongsang,Singapore,13,"metus. In lorem. Donec elementum, lorem ut aliquam iaculis, lacus",2707,$163.68 ,WVV62ZUE7VX
Bo Bean,1-355-672-6141,libero.nec@hotmail.edu,12/14/2015 00:36:05,Ap #420-8738 Eros. Avenue,1966,National Capital Region,"Korea, South",9,"convallis in, cursus et, eros. Proin ultrices. Duis volutpat nunc",4205,$317.46 ,TNV17WOD4JH
Audra Wynn,(157) 713-3728,pellentesque.tincidunt@hotmail.org,10/31/2017 01:19:33,"480 Tempor, Av.",4165,South Chungcheong,"Korea, South",19,"molestie in, tempus eu, ligula. Aenean euismod mauris eu elit.",4397,$457.82 ,RKT19SOR3VR
Lance Atkins,1-891-394-1502,pede.suspendisse.dui@protonmail.com,11/19/1984 03:03:16,"P.O. Box 572, 3453 Mus. St.",24953,Gangwon,Philippines,19,"nibh enim, gravida sit amet, dapibus id, blandit at, nisi.",258,$303.50 ,VXF15BDH1HD
Armand Frederick,1-874-133-1116,in@icloud.org,07/6/2022 23:52:54,Ap #322-6248 Suscipit St.,18930,South Jeolla,Philippines,17,"convallis ligula. Donec luctus aliquet odio. Etiam ligula tortor, dictum",379,$82.15 ,FIE48XDM3IP
Porter Atkinson,1-241-173-3134,praesent.interdum@outlook.org,12/29/1994 23:30:29,"Ap #275-5226 Imperdiet, St.",655654,West Region,Singapore,5,Aliquam vulputate ullamcorper magna. Sed eu eros. Nam consequat dolor,4397,$423.33 ,YPM88KIV4WW
Zane Lawson,(563) 577-2526,venenatis.a@icloud.org,08/28/2018 02:00:39,Ap #299-6587 Vitae Road,23775,North Region,"Korea, South",9,"amet diam eu dolor egestas rhoncus. Proin nisl sem, consequat",2325,$14.11 ,XEJ11MXU4WT
Maryam Reyes,1-204-866-9885,donec.consectetuer@yahoo.org,10/26/1993 23:35:51,899-6391 Donec Rd.,456689,North-East Region,"Korea, South",1,"ultricies ornare, elit elit fermentum risus, at fringilla purus mauris",4740,$384.57 ,EKP42LTR2PD
Kessie Mckay,1-630-415-6261,a@protonmail.ca,09/6/1998 02:40:53,Ap #212-9763 Tincidunt Rd.,2167,Southwestern Tagalog Region,Singapore,5,"nibh dolor, nonummy ac, feugiat non, lobortis quis, pede. Suspendisse",3604,$492.69 ,VKG26BMA8KD
Abraham Combs,1-531-324-1856,interdum.ligula.eu@outlook.org,03/3/1970 04:25:42,"P.O. Box 291, 8945 Tincidunt, Rd.",12255,North-East Region,Singapore,1,"congue, elit sed consequat auctor, nunc nulla vulputate dui, nec",4803,$387.57 ,FLO33OEH7NV
Nigel White,1-616-788-8089,nunc@google.couk,08/20/2002 02:12:09,1712 Quis St.,421,North Region,"Korea, South",17,"sed sem egestas blandit. Nam nulla magna, malesuada vel, convallis",241,$376.57 ,YLE56SKC8MR
Selma Benjamin,(275) 471-6221,non.magna.nam@icloud.net,11/21/1978 23:57:41,"P.O. Box 960, 2574 Erat. Rd.",941834,Central Region,"Korea, South",19,"sem, vitae aliquam eros turpis non enim. Mauris quis turpis",4214,$106.30 ,HGB08JSV2NB
Kirestin Bowers,(732) 362-0348,fermentum.risus@yahoo.edu,03/16/2010 02:12:42,263-7484 Tempor Rd.,328418,North Chungcheong,Singapore,9,mauris eu elit. Nulla facilisi. Sed neque. Sed eget lacus.,4253,$448.35 ,ERI96NUU1EF
Alexandra Beach,(420) 362-7211,nulla.at.sem@outlook.net,02/8/2012 03:54:43,Ap #363-9884 At Av.,17424,National Capital Region,Philippines,1,"Sed malesuada augue ut lacus. Nulla tincidunt, neque vitae semper",93,$463.93 ,UYC28KCM8MM
Damon Payne,1-813-705-9273,convallis.in@hotmail.net,09/15/1971 01:35:17,Ap #961-5381 Imperdiet Ave,265233,South Chungcheong,"Korea, South",17,"iaculis enim, sit amet ornare lectus justo eu arcu. Morbi",4179,$414.18 ,KOA89XXB8KT
Brandon Patel,1-421-795-4288,cursus.luctus.ipsum@yahoo.org,07/16/2018 23:16:32,Ap #269-9630 Laoreet Av.,737,Cordillera Administrative Region,"Korea, South",5,tellus id nunc interdum feugiat. Sed nec metus facilisis lorem,126,$343.33 ,XHU95NOR5IV
Thor Perry,1-637-735-5261,morbi.tristique.senectus@icloud.ca,12/9/1979 02:01:36,558-9908 Diam. Road,11025,South Chungcheong,"Korea, South",15,faucibus orci luctus et ultrices posuere cubilia Curae Donec tincidunt.,4808,$316.79 ,IMR50PTN0VB
Nolan Parsons,(765) 282-8424,dui.semper@hotmail.couk,06/11/1996 00:15:04,282-9184 Netus Rd.,1856,East Region,"Korea, South",11,"iaculis nec, eleifend non, dapibus rutrum, justo. Praesent luctus. Curabitur",1136,$137.54 ,COB81GIZ1ZL
Craig Hines,(880) 552-8440,amet.faucibus@aol.ca,02/8/1979 03:49:32,"P.O. Box 434, 5152 Nibh. Av.",339562,Cagayan Valley,"Korea, South",19,"semper erat, in consectetuer ipsum nunc id enim. Curabitur massa.",2428,$338.78 ,EHI66MAF5IR
Nolan Chambers,1-551-275-4082,quis@hotmail.net,02/5/2019 02:08:40,982-5243 Sed St.,24161,South Chungcheong,"Korea, South",7,"Duis at lacus. Quisque purus sapien, gravida non, sollicitudin a,",3081,$463.89 ,QGL29QHO6EB
Lillian Estrada,1-104-858-2545,penatibus.et@google.ca,04/13/1995 05:00:46,"Ap #349-8472 Pede, Road",1391,North-East Region,Singapore,5,"leo. Vivamus nibh dolor, nonummy ac, feugiat non, lobortis quis,",1273,$440.07 ,GHX56OZI5WI
Cameron Hall,(584) 680-8762,nec.leo@aol.org,08/17/1979 23:27:21,Ap #901-5028 Convallis Street,782343,East Region,"Korea, South",11,"diam eu dolor egestas rhoncus. Proin nisl sem, consequat nec,",4090,$403.62 ,AVH06TXQ0FT
Bernard Pena,1-451-645-5071,faucibus.leo@aol.couk,08/16/2002 01:28:42,302-8162 Elit. Street,23206,West Region,"Korea, South",17,volutpat. Nulla dignissim. Maecenas ornare egestas ligula. Nullam feugiat placerat,4637,$148.67 ,YPH53TPQ2VY
Guy Crane,1-474-816-3244,commodo@icloud.couk,05/2/1990 23:32:29,"P.O. Box 900, 7634 Vivamus Road",8353,Gangwon,"Korea, South",11,Nulla semper tellus id nunc interdum feugiat. Sed nec metus,1339,$259.92 ,IGV43KVJ3ZH
Alexander Holcomb,(311) 433-2798,dis.parturient.montes@protonmail.couk,10/16/1992 03:26:18,728-2541 Aenean Rd.,555229,South Gyeongsang,Singapore,13,"a, auctor non, feugiat nec, diam. Duis mi enim, condimentum",2716,$21.68 ,TTA05CSG6LK
Fatima Church,1-244-774-3879,curabitur.vel@protonmail.couk,03/16/1990 05:04:43,393-5548 Nulla. Rd.,8665,Western Visayas,"Korea, South",5,"dictum placerat, augue. Sed molestie. Sed id risus quis diam",2100,$21.74 ,QHO71JOI4HF
Aiko Houston,(829) 348-9775,ligula.aliquam@aol.com,09/30/1978 05:22:38,Ap #743-7209 Magna Rd.,1270,West Region,Philippines,9,amet metus. Aliquam erat volutpat. Nulla facilisis. Suspendisse commodo tincidunt,2714,$94.26 ,OAL22BNX0LL
