name,phone,email,birthdate,address,postalZip,region,country,list,text,numberrange,currency,alphanumeric
Madison Downs,(323) 760-1454,vivamus@google.org,12/27/1997 02:29:05,7286 Phasellus St.,27715,North-East Region,Philippines,17,sed turpis nec mauris blandit mattis. Cras eget nisi dictum,1407,$136.26 ,RYT22BGS1YK
Zelenia Mosley,1-447-812-3501,cursus@protonmail.com,03/25/1982 00:35:27,"P.O. Box 178, 6595 Gravida. Road",256666,South Gyeongsang,"Korea, South",3,morbi tristique senectus et netus et malesuada fames ac turpis,1508,$341.03 ,RAY97IGT3BK
Amal Mckenzie,(828) 823-2666,at.pede@yahoo.org,06/28/2003 05:35:53,718-7102 Quam Ave,16894,North Region,Philippines,5,neque pellentesque massa lobortis ultrices. Vivamus rhoncus. Donec est. Nunc,73,$364.04 ,RKM42HPM1IP
Hu Barrett,(471) 562-8114,sit.amet@hotmail.ca,07/25/2004 03:38:36,293-3807 Integer Av.,22640,North Region,"Korea, South",9,"consectetuer, cursus et, magna. Praesent interdum ligula eu enim. Etiam",213,$252.98 ,NOJ09JHD3PA
Jin Gardner,1-518-955-3471,dolor.egestas@outlook.net,07/8/2009 23:44:06,"P.O. Box 956, 9956 Morbi Ave",925314,Cagayan Valley,Philippines,3,malesuada. Integer id magna et ipsum cursus vestibulum. Mauris magna.,55,$175.80 ,EMU40PXE7PJ
Davis Pratt,(199) 241-2539,pellentesque.ultricies.dignissim@google.couk,05/14/1971 03:00:15,270-1839 Sem Av.,834538,Davao Region,Philippines,9,lobortis. Class aptent taciti sociosqu ad litora torquent per conubia,1300,$340.96 ,LXV12JRJ6LB
Fay Farrell,1-672-113-1551,mus.proin@outlook.ca,05/23/2000 03:02:48,"P.O. Box 828, 7954 Ante. St.",29682,Gangwon,"Korea, South",19,"neque tellus, imperdiet non, vestibulum nec, euismod in, dolor. Fusce",3532,$444.61 ,PHV45PJH7SG
Kuame Sanford,(787) 565-5432,neque.non@outlook.com,09/28/2013 02:26:20,1048 Sem Avenue,4663,Calabarzon,Philippines,15,amet metus. Aliquam erat volutpat. Nulla facilisis. Suspendisse commodo tincidunt,4884,$336.54 ,VIC47HHS2LY
Raphael Alvarez,(662) 324-4411,laoreet.posuere.enim@hotmail.net,02/13/1988 01:37:24,"Ap #378-1885 Convallis, St.",7770,Calabarzon,Singapore,17,vitae risus. Duis a mi fringilla mi lacinia mattis. Integer,216,$254.19 ,ZNJ38OTI0SQ
Aimee Perez,(673) 138-9869,lectus.rutrum@icloud.ca,01/2/2009 03:19:06,707-9244 Risus. Street,752913,Caraga,Singapore,7,"imperdiet ullamcorper. Duis at lacus. Quisque purus sapien, gravida non,",3508,$31.94 ,YTN73BNP5OZ
Dustin Chase,1-586-253-3860,neque@yahoo.net,04/14/1976 02:11:24,Ap #824-8673 Integer Ave,3171,Central Visayas,Singapore,19,rutrum lorem ac risus. Morbi metus. Vivamus euismod urna. Nullam,4202,$291.86 ,NCE13LGV4CM
Cody Moon,1-556-803-4511,nulla.integer@google.couk,09/11/2018 00:00:58,3346 Eget Ave,565877,South Gyeongsang,"Korea, South",9,"Aliquam ornare, libero at auctor ullamcorper, nisl arcu iaculis enim,",3042,$333.25 ,YIE71PGU0VN
Hiroko Romero,(566) 677-5832,cursus.et@hotmail.edu,05/16/2006 04:02:46,Ap #830-4346 Auctor. St.,779751,Eastern Visayas,"Korea, South",9,"adipiscing lobortis risus. In mi pede, nonummy ut, molestie in,",468,$455.90 ,YMW65ADV8XU
Destiny Barry,1-136-455-0225,augue.eu@aol.org,04/2/1998 03:02:39,"P.O. Box 941, 5979 Ac Rd.",6566,Jeju,Philippines,3,"id, libero. Donec consectetuer mauris id sapien. Cras dolor dolor,",377,$121.30 ,CHO45GRO9US
Edward Lester,1-897-453-8267,ante.nunc@google.com,08/31/2018 01:38:28,"P.O. Box 635, 3862 Nisi Street",1919,East Region,Singapore,15,"lorem, eget mollis lectus pede et risus. Quisque libero lacus,",729,$270.73 ,KFQ32KMK8BN
Kellie Andrews,1-353-983-1711,aliquet.sem@aol.com,08/16/2010 01:06:52,"P.O. Box 547, 5939 Nisi St.",2879,North Jeolla,"Korea, South",3,nibh vulputate mauris sagittis placerat. Cras dictum ultricies ligula. Nullam,455,$335.16 ,JYY15NOU3NV
Sawyer Lane,1-502-858-6224,aliquet.magna.a@hotmail.org,02/9/2004 02:36:11,"Ap #677-1158 Non, St.",16284,Central Region,Philippines,5,sem. Nulla interdum. Curabitur dictum. Phasellus in felis. Nulla tempor,1847,$211.23 ,MGT37UCT1HG
Amy Valencia,1-813-285-5114,in.consequat.enim@google.ca,09/2/1991 00:34:16,Ap #382-1658 Malesuada St.,4976,South Gyeongsang,Philippines,3,"amet massa. Quisque porttitor eros nec tellus. Nunc lectus pede,",2960,$271.90 ,KJL17ILD5DL
Adele Goodwin,(648) 604-1048,luctus.sit@yahoo.couk,06/22/2022 01:01:32,Ap #468-9250 Dictum St.,26112,Western Visayas,"Korea, South",7,"bibendum. Donec felis orci, adipiscing non, luctus sit amet, faucibus",1832,$55.35 ,APV88BVW4ME
Karina Carey,(557) 837-4443,pede.nunc@aol.edu,04/20/1997 02:34:26,228 Ipsum Av.,642286,Bangsamoro,Singapore,7,"metus urna convallis erat, eget tincidunt dui augue eu tellus.",2905,$469.97 ,VPS60RCR8JA
Vernon Wilkinson,1-385-136-6417,et.malesuada.fames@aol.org,12/8/2002 02:44:09,Ap #613-2230 Malesuada Av.,544779,Central Region,Philippines,1,at sem molestie sodales. Mauris blandit enim consequat purus. Maecenas,4524,$3.15 ,YZT28RHF1NQ
Kessie Hughes,(279) 706-7241,cras.dictum@aol.org,04/7/2009 00:50:44,980-7344 Etiam Road,838238,West Region,Philippines,13,"lectus, a sollicitudin orci sem eget massa. Suspendisse eleifend. Cras",1225,$44.37 ,CJW68JWA7PW
Wayne Rojas,(579) 264-3259,aliquam.eu.accumsan@aol.edu,03/17/1971 23:53:22,Ap #659-9933 A Ave,457463,Central Region,"Korea, South",9,risus. Donec egestas. Duis ac arcu. Nunc mauris. Morbi non,710,$75.07 ,HWB32PKH2VS
Courtney French,1-551-600-3079,interdum.ligula@outlook.com,12/9/1999 01:46:11,"P.O. Box 707, 8638 Posuere Rd.",286733,Central Region,"Korea, South",1,amet nulla. Donec non justo. Proin non massa non ante,4916,$487.73 ,GKV78DDR1WE
Kirk Bailey,(846) 586-2512,mauris@aol.couk,07/14/1979 23:07:33,"P.O. Box 673, 1636 Dui Street",9817,Soccsksargen,Philippines,17,"pharetra, felis eget varius ultrices, mauris ipsum porta elit, a",4452,$216.07 ,SQH11QDW2MU
Connor Morse,1-643-183-3358,augue.ac@protonmail.ca,10/28/1976 00:02:17,237-5987 Elit. Av.,28513,Zamboanga Peninsula,Philippines,13,"faucibus ut, nulla. Cras eu tellus eu augue porttitor interdum.",1648,$480.54 ,ENU36UNI4MC
Cody Herman,(843) 702-9447,id.ante@aol.ca,11/12/2010 01:35:52,845-1145 Lacinia Rd.,6587,Central Region,"Korea, South",17,metus. In nec orci. Donec nibh. Quisque nonummy ipsum non,4219,$357.13 ,NOU45BTG0LX
Tallulah Barker,1-316-361-6080,molestie.tellus.aenean@yahoo.edu,10/30/2016 02:40:26,"P.O. Box 628, 4084 Magna. Av.",6763,Gangwon,Singapore,11,ipsum nunc id enim. Curabitur massa. Vestibulum accumsan neque et,2436,$416.77 ,JHM61ITP6AC
Levi Cohen,(584) 254-5112,eleifend.nunc@outlook.couk,03/8/1996 03:28:58,909-7795 In St.,2748,North Gyeongsang,Philippines,19,"tempus scelerisque, lorem ipsum sodales purus, in molestie tortor nibh",1625,$11.29 ,PUE47YER7MD
Plato Rojas,(210) 449-1637,diam.lorem@yahoo.edu,09/29/1981 23:24:56,866-613 Nec Road,413,Gyeonggi,Philippines,13,Nunc pulvinar arcu et pede. Nunc sed orci lobortis augue,3367,$170.56 ,LQN55WKZ6TC
Keane Patton,(117) 157-4636,ac@aol.ca,10/23/2014 00:48:04,Ap #556-5491 Ornare Ave,17586,East Region,"Korea, South",11,"vel turpis. Aliquam adipiscing lobortis risus. In mi pede, nonummy",1800,$360.58 ,BIX34VYZ0XU
Aaron Acevedo,(492) 554-8156,laoreet.posuere.enim@protonmail.edu,09/13/1979 01:32:11,"P.O. Box 318, 482 Curae Rd.",532572,Bangsamoro,Philippines,11,"sodales. Mauris blandit enim consequat purus. Maecenas libero est, congue",2912,$22.56 ,GFS43UZY7AG
Florence Mendez,1-783-275-8439,in.tempus@icloud.org,09/12/1981 03:16:42,Ap #663-1743 Nibh. Av.,195825,North Jeolla,Singapore,15,"diam eu dolor egestas rhoncus. Proin nisl sem, consequat nec,",414,$197.56 ,IQD85CPF6DM
Nita Lester,(765) 752-5416,ridiculus.mus.aenean@aol.couk,01/19/1981 03:02:56,"Ap #770-688 Tortor, Ave",8134,Bicol Region,Philippines,7,"accumsan convallis, ante lectus convallis est, vitae sodales nisi magna",3486,$250.68 ,FPI28GXM4MX
Asher Whitney,(861) 443-6855,dictum.placerat@hotmail.net,06/6/1972 00:46:08,"P.O. Box 302, 7015 Quam, Rd.",376821,North Region,"Korea, South",15,tristique senectus et netus et malesuada fames ac turpis egestas.,140,$185.28 ,UDC87HCW9NS
Kirsten Daniel,1-786-467-3716,a@aol.couk,04/6/1972 00:12:00,958-3465 Metus Avenue,9461,National Capital Region,Singapore,9,"mauris sapien, cursus in, hendrerit consectetuer, cursus et, magna. Praesent",1187,$261.22 ,NSC16DKV9VT
Randall Perkins,(222) 350-8584,ligula.aenean@hotmail.net,01/22/1995 23:38:38,Ap #564-2275 Curabitur Street,2426,North-East Region,"Korea, South",5,orci. Phasellus dapibus quam quis diam. Pellentesque habitant morbi tristique,997,$310.68 ,TRE41QDC1NI
Chandler Acevedo,1-513-456-5453,nec.tempus@aol.edu,08/14/1992 23:57:11,587-7194 Donec Road,18332,South Chungcheong,Singapore,11,"Sed malesuada augue ut lacus. Nulla tincidunt, neque vitae semper",1258,$169.86 ,BVK24GFT4DW
Karen Lyons,(480) 615-3642,ac.sem.ut@hotmail.edu,11/3/2004 01:18:34,"P.O. Box 196, 4765 Laoreet Ave",2227,South Gyeongsang,"Korea, South",5,molestie tortor nibh sit amet orci. Ut sagittis lobortis mauris.,3363,$470.07 ,VFQ68NOM0BP
Yen Clements,(321) 726-2395,pellentesque@protonmail.couk,11/21/1972 04:39:46,903-2932 Et Av.,25205,West Region,Philippines,19,"risus. Nunc ac sem ut dolor dapibus gravida. Aliquam tincidunt,",4945,$190.62 ,GYP27KCD6YE
Jasper Ferguson,1-172-898-7743,enim.gravida@aol.couk,02/2/1981 02:29:57,"P.O. Box 319, 3901 Vestibulum, Rd.",15695,North Jeolla,Singapore,19,tristique neque venenatis lacus. Etiam bibendum fermentum metus. Aenean sed,3771,$320.90 ,RGR56TJT6EX
Alisa Hewitt,1-263-415-7119,nec.urna.suscipit@google.org,08/8/1998 23:14:25,671 Integer Av.,7424,South Chungcheong,Philippines,15,"ultrices a, auctor non, feugiat nec, diam. Duis mi enim,",3617,$166.75 ,LOW46IOL1BG
Judah Mueller,1-565-684-4310,donec.dignissim@protonmail.couk,11/29/1977 02:58:45,"P.O. Box 194, 8071 Dolor Rd.",754,North Chungcheong,Singapore,15,"Cras vehicula aliquet libero. Integer in magna. Phasellus dolor elit,",2628,$32.16 ,UJM97IFQ7KH
Brent Morgan,1-359-505-8881,proin.non@icloud.couk,03/4/2004 03:45:38,372-3479 Egestas. Av.,13580,South Chungcheong,Philippines,9,"lectus quis massa. Mauris vestibulum, neque sed dictum eleifend, nunc",4816,$393.26 ,HAN84ZMA5LR
Zorita Barnes,1-685-551-6642,cras.convallis.convallis@protonmail.net,01/10/2022 03:50:41,134-5281 Donec Road,694558,South Jeolla,Singapore,11,enim. Mauris quis turpis vitae purus gravida sagittis. Duis gravida.,3841,$61.70 ,OFW41FYH3NE
Jena West,(266) 106-0749,non.enim@yahoo.edu,04/22/1998 04:42:43,Ap #162-6751 Nunc Rd.,2624,Cagayan Valley,"Korea, South",7,Cras interdum. Nunc sollicitudin commodo ipsum. Suspendisse non leo. Vivamus,3556,$387.79 ,SUI73XLX6DI
Craig Cooke,(888) 668-4816,sem@protonmail.edu,04/24/2019 04:22:13,"P.O. Box 830, 6246 Proin Av.",2266,South Chungcheong,Philippines,17,"magna. Phasellus dolor elit, pellentesque a, facilisis non, bibendum sed,",1111,$427.65 ,DHE94BFC8WT
Brenden Rodriquez,1-747-710-3613,natoque.penatibus@google.ca,10/1/1977 23:31:25,Ap #947-7887 Phasellus St.,141445,Jeju,"Korea, South",9,"non massa non ante bibendum ullamcorper. Duis cursus, diam at",4605,$395.73 ,IMG02FEP7SY
Devin Ray,1-215-478-5174,libero.nec@outlook.ca,03/16/2007 00:21:35,Ap #545-7896 Tempor Street,8563,South Gyeongsang,"Korea, South",5,"Nullam scelerisque neque sed sem egestas blandit. Nam nulla magna,",4890,$140.71 ,JXL82WFG1AT
Cora Velez,(280) 843-6628,magna.lorem.ipsum@icloud.ca,01/23/1976 03:39:46,746 Pede Road,344781,Western Visayas,Philippines,9,Cras eget nisi dictum augue malesuada malesuada. Integer id magna,4526,$90.81 ,BIA62LJH6XB
Duncan Bauer,1-146-314-2128,augue.eu@yahoo.org,01/8/1979 04:50:13,976-4076 Nunc St.,691815,West Region,"Korea, South",9,vitae aliquam eros turpis non enim. Mauris quis turpis vitae,4265,$20.27 ,BDZ53FWP4KK
Griffin Haney,1-142-916-3802,ullamcorper@aol.com,07/10/2000 23:07:07,"P.O. Box 267, 172 Non Ave",9555,Cagayan Valley,Philippines,13,pede. Nunc sed orci lobortis augue scelerisque mollis. Phasellus libero,2431,$21.04 ,DJL34HOY7FQ
Illiana Goff,(677) 865-7648,nam.tempor@google.net,04/5/1985 03:21:24,"P.O. Box 607, 8200 Tempor Avenue",10736,South Jeolla,Philippines,13,malesuada malesuada. Integer id magna et ipsum cursus vestibulum. Mauris,871,$446.95 ,TFM82HYW1ZV
Vera Carey,1-486-675-1133,morbi.vehicula.pellentesque@aol.edu,03/31/2015 05:39:31,786 Fusce St.,138341,Western Visayas,Philippines,5,"mi. Aliquam gravida mauris ut mi. Duis risus odio, auctor",1852,$493.46 ,YHD75PDK2DK
Gail Sosa,(768) 230-3546,eu.odio.tristique@icloud.com,08/12/2001 04:49:16,574-6141 Vitae St.,523468,Gyeonggi,Singapore,5,"penatibus et magnis dis parturient montes, nascetur ridiculus mus. Proin",3895,$68.74 ,NDP25URE5QF
Harding Rollins,1-458-538-5828,lobortis@icloud.org,01/1/2021 23:43:20,1010 Nulla. Ave,14679,Central Region,Philippines,15,"augue eu tellus. Phasellus elit pede, malesuada vel, venenatis vel,",2020,$221.13 ,HOY79JJH0YH
Merritt Olson,1-381-786-8388,enim.nisl@yahoo.edu,05/2/2009 02:33:15,193 Nascetur St.,7372,West Region,"Korea, South",19,nascetur ridiculus mus. Donec dignissim magna a tortor. Nunc commodo,3924,$375.50 ,BRL32DKX6LS
Joseph Jefferson,1-431-222-2680,pede.nec@yahoo.org,06/16/2018 00:45:04,"P.O. Box 193, 265 Tempor, Ave",7452,North Jeolla,Singapore,7,"Cum sociis natoque penatibus et magnis dis parturient montes, nascetur",3494,$354.81 ,HBV58UVF3JM
Leilani Woodward,1-505-731-7414,molestie.pharetra@hotmail.edu,10/29/2001 01:33:25,5962 Mauris Avenue,7712,North-East Region,Philippines,13,"dictum mi, ac mattis velit justo nec ante. Maecenas mi",572,$21.87 ,SUV28EPC7PJ
Suki Patterson,(515) 662-0172,commodo.at.libero@yahoo.ca,10/20/2018 05:14:01,Ap #412-5216 Ultricies St.,12131,North Jeolla,Philippines,13,"blandit enim consequat purus. Maecenas libero est, congue a, aliquet",2907,$343.95 ,FIJ90PYY4DR
Dorothy Henderson,(214) 371-6325,amet.lorem.semper@google.ca,10/9/2011 01:19:38,150-1503 Amet Street,7148,Central Region,Philippines,3,"rutrum urna, nec luctus felis purus ac tellus. Suspendisse sed",1456,$102.58 ,NFJ61QXA4DR
Martin Simmons,(546) 516-3527,convallis.erat.eget@icloud.org,03/12/2009 02:22:42,Ap #220-9741 Sed Ave,875224,Gangwon,"Korea, South",5,Phasellus fermentum convallis ligula. Donec luctus aliquet odio. Etiam ligula,1312,$191.42 ,MSE01WXL2RU
Slade Mendoza,1-632-908-1362,et@aol.edu,10/20/1993 23:56:00,8742 Sem St.,6578,Central Region,Philippines,17,"egestas hendrerit neque. In ornare sagittis felis. Donec tempor, est",3724,$47.26 ,TEF48VFM2UG
Iliana Coffey,1-831-761-6642,habitant.morbi@hotmail.couk,10/7/1991 05:11:51,856-8498 Massa. Avenue,15232,Gyeonggi,Philippines,7,"sed dictum eleifend, nunc risus varius orci, in consequat enim",3145,$50.67 ,VTO38DBH6SA
Brooke Ochoa,1-831-673-5931,posuere.vulputate.lacus@yahoo.edu,08/18/1974 03:47:40,"Ap #469-5306 Odio, Avenue",3427,Cagayan Valley,Singapore,9,"lacus. Quisque purus sapien, gravida non, sollicitudin a, malesuada id,",1396,$52.85 ,SOU76SCC3YO
Alden Dorsey,(420) 853-4789,nec.urna.suscipit@icloud.couk,11/15/2021 03:50:45,1299 Semper Rd.,6222,Gyeonggi,Singapore,19,"risus. Nunc ac sem ut dolor dapibus gravida. Aliquam tincidunt,",1081,$136.96 ,IRC23RDG0JS
Kelly Marshall,1-677-695-2662,donec@outlook.com,10/17/2022 03:38:46,755-5562 Lacus Avenue,952866,North-East Region,"Korea, South",5,"et, rutrum eu, ultrices sit amet, risus. Donec nibh enim,",425,$238.63 ,ONW12JPN3LW
Branden Spears,1-390-151-1465,ligula.eu.enim@icloud.edu,03/15/2007 02:35:15,Ap #228-9351 Vestibulum Avenue,851676,Central Region,Philippines,7,orci. Ut sagittis lobortis mauris. Suspendisse aliquet molestie tellus. Aenean,4350,$265.05 ,QAJ63JPH8NL
Alana Mcconnell,1-726-174-2804,cubilia@aol.com,05/24/1982 01:47:33,391-5293 Neque. Avenue,3383,North-East Region,Singapore,3,"sed dui. Fusce aliquam, enim nec tempus scelerisque, lorem ipsum",2302,$489.33 ,YVD13ISQ7DB
Donna Saunders,(519) 457-3134,per.conubia@google.edu,03/17/1994 03:18:57,263-9345 Sapien Street,3721,North Chungcheong,Philippines,17,orci. Phasellus dapibus quam quis diam. Pellentesque habitant morbi tristique,2518,$53.20 ,JOI81WMO2DW
Alexis Payne,1-551-133-5660,vel.faucibus.id@hotmail.org,09/28/2000 03:41:31,429-374 Donec Rd.,581298,Central Luzon,Singapore,17,faucibus orci luctus et ultrices posuere cubilia Curae Donec tincidunt.,82,$41.36 ,PMX73OIW7BD
Nyssa Jacobs,1-434-372-9117,a.odio@icloud.org,12/31/1974 00:23:30,862-9207 Enim. Road,16112,South Jeolla,"Korea, South",11,"et risus. Quisque libero lacus, varius et, euismod et, commodo",1004,$442.02 ,QVX25TGM2MD
Willow Doyle,1-262-467-2150,donec@yahoo.ca,01/29/2001 01:14:23,7095 Aenean Avenue,14809,Central Region,Singapore,19,"nec, mollis vitae, posuere at, velit. Cras lorem lorem, luctus",2438,$102.96 ,HBH66IHG8OS
Alana Harvey,(588) 884-7982,arcu.morbi@yahoo.org,03/27/1989 04:55:07,"Ap #945-9161 Nec, Avenue",1443,South Chungcheong,Singapore,15,"at, velit. Cras lorem lorem, luctus ut, pellentesque eget, dictum",579,$262.37 ,NOA08VLW8BW
Adele Spence,1-163-380-5464,sagittis@protonmail.net,04/11/2009 03:06:18,Ap #826-4036 Ipsum Avenue,3282,South Gyeongsang,Philippines,17,"magna, malesuada vel, convallis in, cursus et, eros. Proin ultrices.",1287,$205.86 ,WWQ14TYZ1YS
Julie Boyle,(902) 355-6522,augue@protonmail.org,08/18/1985 04:52:43,917-3458 Egestas. Avenue,2735,South Chungcheong,Philippines,3,"velit egestas lacinia. Sed congue, elit sed consequat auctor, nunc",2431,$112.07 ,PGA32QVH2QO
Eaton Cervantes,1-539-272-4648,augue.id@outlook.ca,09/1/2007 05:57:10,8317 Amet St.,5553,East Region,Singapore,11,"parturient montes, nascetur ridiculus mus. Donec dignissim magna a tortor.",1192,$446.82 ,TLN81GQN5YB
Forrest Carver,(254) 957-4479,donec.egestas.aliquam@hotmail.com,10/21/1980 23:04:37,"472 Nec, Avenue",21364,Bangsamoro,Singapore,7,"fermentum risus, at fringilla purus mauris a nunc. In at",4710,$339.98 ,DVJ58NHK1CN
Savannah Estrada,(823) 676-3247,ante.dictum.cursus@protonmail.ca,09/11/2011 02:20:31,766-2948 Eu Ave,643748,North Jeolla,Philippines,5,neque. Nullam ut nisi a odio semper cursus. Integer mollis.,822,$157.42 ,UBY04VSY8IA
Matthew Pugh,1-718-444-5843,arcu.iaculis@yahoo.ca,02/14/1998 01:04:01,"P.O. Box 369, 7582 Eros Street",828843,South Jeolla,Singapore,19,"tempor, est ac mattis semper, dui lectus rutrum urna, nec",2782,$80.93 ,YXQ75KEJ7SL
Chandler Mckinney,1-241-312-1446,ligula.eu.enim@google.org,03/15/2017 23:20:12,Ap #859-7676 Eleifend Road,21119,Bicol Region,"Korea, South",7,molestie arcu. Sed eu nibh vulputate mauris sagittis placerat. Cras,1567,$84.94 ,UAU15POL6CN
Keith Estrada,(752) 634-7837,erat.etiam@icloud.ca,08/27/1993 04:25:41,100-4641 Luctus Road,2759,Zamboanga Peninsula,Singapore,9,"auctor odio a purus. Duis elementum, dui quis accumsan convallis,",3246,$330.13 ,JRQ02QDR6FK
Eugenia Carpenter,1-884-878-1512,sit.amet.ornare@hotmail.org,10/21/2007 01:47:14,455-4628 Cubilia Avenue,854557,South Jeolla,"Korea, South",3,ultrices iaculis odio. Nam interdum enim non nisi. Aenean eget,1804,$188.90 ,MMS83GOP7KT
Fay Carr,1-729-337-6646,et@google.couk,06/27/2017 01:05:23,706-4611 Fringilla Av.,648217,Northern Mindanao,"Korea, South",5,"Donec consectetuer mauris id sapien. Cras dolor dolor, tempus non,",576,$468.07 ,BGR92DNM1ZS
Lunea Gross,1-986-291-7025,morbi.sit.amet@icloud.edu,05/14/1996 23:50:43,"P.O. Box 846, 7442 Tellus, St.",3436,South Jeolla,"Korea, South",3,"enim consequat purus. Maecenas libero est, congue a, aliquet vel,",4798,$470.63 ,UDV27VHB5GK
Diana Davis,1-212-547-1151,sodales.mauris@outlook.edu,11/23/2003 01:00:49,720-8403 Morbi St.,4515,North-East Region,"Korea, South",5,non quam. Pellentesque habitant morbi tristique senectus et netus et,1906,$38.48 ,HMV89YEC2CN
Shoshana Wyatt,(778) 168-0545,rutrum@google.couk,01/19/2008 00:37:25,189-4681 Orci. Rd.,225236,North Chungcheong,"Korea, South",7,aliquam arcu. Aliquam ultrices iaculis odio. Nam interdum enim non,62,$102.54 ,REU06LGJ5SH
Jackson Lane,(896) 761-8548,nullam@yahoo.edu,05/20/2010 05:14:07,7623 Aenean Rd.,8278,North Chungcheong,Philippines,17,"elit elit fermentum risus, at fringilla purus mauris a nunc.",560,$254.94 ,BHN66UMF5II
Amy Walsh,(865) 212-0156,habitant.morbi.tristique@protonmail.com,04/14/1990 05:16:16,"P.O. Box 530, 307 Pede. Rd.",823562,Gangwon,"Korea, South",13,"sodales at, velit. Pellentesque ultricies dignissim lacus. Aliquam rutrum lorem",3971,$260.40 ,XJP41IBQ3DY
Colette Clay,(721) 384-6015,risus@outlook.org,04/6/2006 02:47:20,3873 Natoque St.,454255,Caraga,Singapore,5,"Nunc laoreet lectus quis massa. Mauris vestibulum, neque sed dictum",595,$251.06 ,MWF34YQW7EH
Danielle Mccarty,1-832-308-6842,quisque.porttitor@hotmail.ca,06/6/1983 03:45:53,580-9518 Malesuada Ave,2678,North Region,Singapore,3,"Proin nisl sem, consequat nec, mollis vitae, posuere at, velit.",949,$260.83 ,XFG19PJG2BA
Phyllis Dickerson,1-476-653-1582,nulla.vulputate@aol.couk,02/8/1979 23:55:55,264-1902 Velit. St.,5360,North Region,"Korea, South",3,"mauris, rhoncus id, mollis nec, cursus a, enim. Suspendisse aliquet,",937,$418.52 ,OMQ57OMU2CA
Hakeem Mccormick,1-727-874-9176,cursus.vestibulum@google.couk,08/7/1976 03:34:05,Ap #447-7527 Dis St.,2675,Central Region,Singapore,9,"Suspendisse dui. Fusce diam nunc, ullamcorper eu, euismod ac, fermentum",645,$477.81 ,BKP80UKC7JC
Ariel Walter,(484) 415-6333,vulputate@hotmail.couk,12/10/2013 03:08:51,537-1363 Ipsum. Rd.,718134,West Region,Singapore,1,"dui, semper et, lacinia vitae, sodales at, velit. Pellentesque ultricies",4424,$388.40 ,QCJ63MLK6WR
Knox Stevenson,(715) 225-0151,eget@outlook.org,08/26/1973 02:41:17,"613-5355 Vel, St.",11243,North Region,Singapore,1,"tristique pellentesque, tellus sem mollis dui, in sodales elit erat",3691,$223.06 ,DBO06KKJ2ST
Carter Valencia,(359) 472-5721,nunc.laoreet.lectus@hotmail.edu,10/9/1980 04:26:57,656-1088 Ut Avenue,196,North Region,Philippines,17,"luctus sit amet, faucibus ut, nulla. Cras eu tellus eu",1190,$89.06 ,PCE62SIW1PM
Patience Britt,1-753-363-7488,risus.quisque.libero@icloud.couk,03/12/2004 05:59:53,794-8609 Fringilla. Street,25523,East Region,"Korea, South",13,id enim. Curabitur massa. Vestibulum accumsan neque et nunc. Quisque,114,$101.82 ,XGA64LKI1KC
Jarrod Lynn,1-312-768-6912,convallis@outlook.org,12/4/1992 23:27:54,159-9198 Etiam St.,147737,Soccsksargen,Singapore,3,Vivamus non lorem vitae odio sagittis semper. Nam tempor diam,4982,$385.78 ,TJN44BID0EC
Maya Nieves,1-453-171-0866,arcu.iaculis.enim@google.org,10/15/2010 02:02:19,799-7247 Nunc Street,25544,Gyeonggi,Philippines,13,ultricies dignissim lacus. Aliquam rutrum lorem ac risus. Morbi metus.,4674,$280.04 ,LGQ86GYF2BZ
Aspen O'donnell,(566) 244-6164,dolor.sit.amet@yahoo.couk,05/15/1974 01:29:46,"895-6566 A, Av.",13511,North Chungcheong,"Korea, South",7,malesuada malesuada. Integer id magna et ipsum cursus vestibulum. Mauris,1926,$350.14 ,OWV25UNU4JQ
Callie Ballard,(895) 274-8156,dolor@aol.couk,08/15/1971 03:57:29,117-8739 Integer St.,893367,Cordillera Administrative Region,"Korea, South",17,Duis volutpat nunc sit amet metus. Aliquam erat volutpat. Nulla,1382,$56.48 ,DGM48XEX3CY
Christopher Reese,(736) 482-8536,nunc.quisque.ornare@google.org,03/15/2002 23:11:14,"P.O. Box 784, 8509 Magna. Rd.",826711,Southwestern Tagalog Region,Singapore,5,"rhoncus id, mollis nec, cursus a, enim. Suspendisse aliquet, sem",2835,$49.76 ,LIC68KZJ4QE
Colby Hicks,(635) 363-7827,pulvinar.arcu@yahoo.ca,08/1/1972 00:54:02,Ap #195-3994 Quisque St.,2836,North Region,"Korea, South",19,"imperdiet nec, leo. Morbi neque tellus, imperdiet non, vestibulum nec,",859,$236.40 ,LSJ82TJE3MR
Winifred Alston,(942) 461-1701,id.ante.nunc@yahoo.net,04/15/2016 02:39:11,463-6624 Ut Av.,25814,West Region,Singapore,17,ullamcorper magna. Sed eu eros. Nam consequat dolor vitae dolor.,4308,$316.15 ,BJY38DJG8SL
Flynn Schultz,1-210-168-1981,malesuada.fringilla@aol.net,01/27/1985 04:34:00,"P.O. Box 115, 6704 Vel St.",26690,Zamboanga Peninsula,Singapore,15,feugiat placerat velit. Quisque varius. Nam porttitor scelerisque neque. Nullam,375,$290.24 ,DHJ80EBG0YM
Mufutau Mueller,(186) 142-8351,lacus@icloud.ca,07/31/1980 05:06:08,"P.O. Box 140, 8073 Mi Avenue",2616,Central Visayas,Singapore,15,vestibulum massa rutrum magna. Cras convallis convallis dolor. Quisque tincidunt,4449,$322.66 ,MCC52FXB2PK
Ignatius Blankenship,(663) 470-8080,vehicula.pellentesque.tincidunt@outlook.ca,11/23/2010 03:00:22,"P.O. Box 658, 3300 Mauris Rd.",644559,North Region,Singapore,13,ipsum. Suspendisse sagittis. Nullam vitae diam. Proin dolor. Nulla semper,4714,$373.94 ,PFO17SPK6TY
Carissa Mack,(742) 623-2421,taciti.sociosqu@yahoo.ca,01/6/1971 04:32:00,615 Donec Ave,6269,South Chungcheong,Singapore,13,"libero mauris, aliquam eu, accumsan sed, facilisis vitae, orci. Phasellus",2651,$8.16 ,KMJ92LLC5ER
Kelly Soto,(342) 344-1188,et@yahoo.couk,07/25/2023 23:34:36,"P.O. Box 393, 968 Sem St.",545226,North Gyeongsang,Singapore,3,Ut tincidunt vehicula risus. Nulla eget metus eu erat semper,2332,$199.41 ,VHI25ZRW4DI
Ulysses Sweeney,(264) 139-2389,orci.in@google.ca,05/24/1984 23:46:51,510 Curabitur Rd.,856754,West Region,Philippines,17,"Nullam enim. Sed nulla ante, iaculis nec, eleifend non, dapibus",4599,$204.42 ,XTA46IYV3RG
Amena Sloan,(283) 908-5668,rutrum.eu.ultrices@google.ca,03/12/2014 03:09:13,381-853 Non St.,3601,Cordillera Administrative Region,Singapore,1,"nec, malesuada ut, sem. Nulla interdum. Curabitur dictum. Phasellus in",117,$377.29 ,TYP80ECI4NH
Teegan Carey,(336) 882-0414,ornare.tortor@aol.edu,01/4/1991 00:54:57,4223 Elit St.,12969,Bangsamoro,"Korea, South",15,Proin ultrices. Duis volutpat nunc sit amet metus. Aliquam erat,576,$485.93 ,XLL03YLH3FO
Chastity Hendricks,1-543-622-3233,vel.nisl@protonmail.org,09/25/2006 00:47:15,806-4166 Bibendum Avenue,286316,South Jeolla,"Korea, South",7,"pede, nonummy ut, molestie in, tempus eu, ligula. Aenean euismod",4372,$72.47 ,HEX73LGC5ES
Dennis Wilder,1-941-856-3628,elit.erat.vitae@outlook.net,03/7/1988 23:49:47,Ap #712-9503 Velit Road,863989,Central Region,Singapore,7,"ut odio vel est tempor bibendum. Donec felis orci, adipiscing",4074,$162.21 ,JWR65RAB7BG
