name,phone,email,birthdate,birthdate2,address,postalZip,region,country,list,text,numberrange,currency1,currency2,alphanumeric
Dominic Wynn,(486) 324-6464,curae@google.ca,12/27/1978 9:55,12/27/1978,614-4611 At Avenue,7616,North-East Region,Singapore,1,"Nullam suscipit, est ac facilisis facilisis, magna tellus faucibus leo,",1530,$235.59 ,235.59,NJD26MPR4DL
Dana Barron,1-573-746-2816,libero@yahoo.com,4/3/2007 8:39,4/3/2007,"P.O. Box 902, 4207 Feugiat Av.",,Southwestern Tagalog Region,"Korea, South",7,neque et nunc. Quisque ornare tortor at risus. Nunc ac,632.5,$426.62 ,426.62,EFN23SGK2WI
Dante Ortiz,(771) 277-2533,mauris@aol.com,3/21/2012 9:26,3/21/2012,Ap #236-4098 Enim. Avenue,791487,Davao Region,Singapore,17,"Aenean massa. Integer vitae nibh. Donec est mauris, rhoncus id,",0,$382.78 ,382.78,XVD24SKL6JD
Aimee Hopper,1-122-614-6281,congue.turpis.in@hotmail.couk,2/4/2005 9:58,2/4/2005,"P.O. Box 501, 3157 Lectus. Av.",439243,East Region,Singapore,9,"auctor, velit eget laoreet posuere, enim nisl elementum purus, accumsan",1843.92,$371.31 ,371.31,DTD73IXO1NT
Ivana Whitney,(424) 467-6663,mollis.dui.in@aol.org,2/18/2000 9:17,2/18/2000,2516 Eu St.,857493,Gangwon,Singapore,9,"blandit. Nam nulla magna, malesuada vel, convallis in, cursus et,",59.17,$384.65 ,384.65,QKT50PEE9KE
Evan Cross,(884) 434-9953,interdum.nunc.sollicitudin@google.net,7/24/2012 9:21,7/24/2012,343-9550 Vitae St.,6426,Soccsksargen,Philippines,19,"nibh. Aliquam ornare, libero at auctor ullamcorper, nisl arcu iaculis",2979.17,$177.33 ,177.33,YYZ37BJQ2LR
Ashton Snyder,1-431-365-7342,faucibus.leo@outlook.com,12/29/1970 9:24,12/29/1970,956-4551 Consectetuer St.,539464,West Region,"Korea, South",9,lectus justo eu arcu. Morbi sit amet massa. Quisque porttitor,2617.42,$289.91 ,289.91,FLR25LNX2VF
Orla Sharp,(432) 893-6659,faucibus.morbi.vehicula@aol.org,11/28/1974 9:46,11/28/1974,"P.O. Box 563, 1443 Sem St.",5137,Gyeonggi,Philippines,5,"a purus. Duis elementum, dui quis accumsan convallis, ante lectus",3276.67,$151.07 ,151.07,RYG88XFM2RL
Cedric Clements,(461) 525-6708,lacus@yahoo.org,12/25/1980 8:56,12/25/1980,Ap #267-1852 Orci St.,765431,West Region,"Korea, South",19,"Nulla tincidunt, neque vitae semper egestas, urna justo faucibus lectus,",1188.67,$217.97 ,217.97,LRC55WTZ9RH
Owen Curtis,(381) 656-3478,luctus.ipsum@yahoo.ca,10/1/2002 9:35,10/1/2002,"Ap #685-3485 Imperdiet, Avenue",623426,National Capital Region,Singapore,5,"nec, euismod in, dolor. Fusce feugiat. Lorem ipsum dolor sit",306.67,$76.64 ,76.64,IBP39ITB5ND
Adrienne Parker,1-618-911-6723,ipsum.curabitur@protonmail.org,9/20/1975 9:13,9/20/1975,Ap #176-3359 Eu Rd.,433327,West Region,"Korea, South",3,"sapien. Cras dolor dolor, tempus non, lacinia at, iaculis quis,",0,$473.22 ,473.22,TGS57XOY0US
Camille Callahan,(375) 812-8750,ipsum.primis@google.net,9/14/2010 8:36,9/14/2010,102-2814 Ornare Ave,14837,Central Visayas,"Korea, South",9,"fermentum convallis ligula. Donec luctus aliquet odio. Etiam ligula tortor,",1192.5,$238.29 ,238.29,PHP82EGO7YM
Baxter Holmes,1-421-347-9283,cursus.luctus@yahoo.org,12/21/1982 9:15,12/21/1982,"P.O. Box 174, 5536 Cursus, Avenue",6437,North-East Region,Singapore,11,"imperdiet, erat nonummy ultricies ornare, elit elit fermentum risus, at",97.5,$321.90 ,321.9,UZH36WEO4XC
Anthony Boyle,1-136-822-0096,vulputate.lacus.cras@google.couk,12/7/1970 8:37,12/7/1970,284-8913 Semper Street,1857,Soccsksargen,Philippines,19,"ultrices, mauris ipsum porta elit, a feugiat tellus lorem eu",799.17,$4.20 ,4.2,JUP36QYE4SD
Bevis Woodward,(987) 855-8179,tempor.erat@aol.couk,11/11/1986 8:17,11/11/1986,144-2931 Tempor Rd.,11722,Central Region,Singapore,7,"non massa non ante bibendum ullamcorper. Duis cursus, diam at",723.67,$43.98 ,43.98,WIP07JKE6SQ
Mufutau Cameron,(864) 572-5123,in.sodales.elit@outlook.org,10/30/2013 8:39,10/30/2013,Ap #155-6789 Lorem Avenue,13202,South Gyeongsang,Singapore,9,"nisi nibh lacinia orci, consectetuer euismod est arcu ac orci.",,$278.44 ,278.44,NWZ59AIF7DR
Hayfa Drake,1-529-762-4712,id.mollis@aol.org,11/6/1974 9:38,11/6/1974,Ap #918-3336 Elit Road,325968,East Region,"Korea, South",3,eros turpis non enim. Mauris quis turpis vitae purus gravida,92.67,$73.80 ,73.8,UQR47LEQ4SA
Warren Pacheco,(815) 524-9619,aliquam@google.org,1/6/1999 9:17,1/6/1999,761-9843 Vel Street,28346,Central Luzon,Philippines,15,erat vel pede blandit congue. In scelerisque scelerisque dui. Suspendisse,60,$254.60 ,254.6,GEL36GKX1YI
Erich Browning,1-767-402-5401,magna.sed.eu@yahoo.ca,5/31/2016 8:46,5/31/2016,558-9846 Eros Avenue,736995,North Gyeongsang,"Korea, South",17,"Phasellus elit pede, malesuada vel, venenatis vel, faucibus id, libero.",1558.5,$290.80 ,290.8,SKN57XJG2TU
Gloria Powers,1-947-819-8736,sem.elit@yahoo.couk,3/22/2006 8:05,3/22/2006,"P.O. Box 220, 9391 Leo. Road",669336,North-East Region,Philippines,9,"taciti sociosqu ad litora torquent per conubia nostra, per inceptos",766,$156.02 ,156.02,JWS01FDV8WR
Geoffrey Reynolds,(364) 633-7843,ornare@aol.net,7/13/2022 9:56,7/13/2022,Ap #123-5746 Ornare Rd.,549331,Gangwon,"Korea, South",11,Donec nibh. Quisque nonummy ipsum non arcu. Vivamus sit amet,1536,$271.87 ,271.87,DAQ87BUX7LI
Yael Perez,1-348-467-4378,sed@protonmail.com,5/16/2001 9:08,5/16/2001,"P.O. Box 383, 3918 Risus. St.",8892,North Region,Philippines,3,mattis. Cras eget nisi dictum augue malesuada malesuada. Integer id,339.67,$2.83 ,2.83,PKB06KTW1HM
Gillian Norman,1-626-629-2672,eu.arcu.morbi@protonmail.net,9/28/1992 9:46,9/28/1992,"Ap #541-5278 Eget, Ave",115612,South Gyeongsang,Philippines,5,Quisque varius. Nam porttitor scelerisque neque. Nullam nisl. Maecenas malesuada,904.5,$192.47 ,192.47,MUV36FXT2ML
Jolie Porter,1-618-507-4010,aliquam.ultrices.iaculis@google.couk,4/13/2006 8:05,4/13/2006,166-4312 In St.,429478,Gangwon,Philippines,15,ridiculus mus. Aenean eget magna. Suspendisse tristique neque venenatis lacus.,794.67,$154.17 ,154.17,KTG93MXV4IR
Raja Dalton,1-276-341-1773,dolor.quam@hotmail.ca,12/29/2015 9:07,12/29/2015,870-8070 Ipsum Rd.,9716,South Chungcheong,Philippines,19,"Maecenas mi felis, adipiscing fringilla, porttitor vulputate, posuere vulputate, lacus.",2433.08,$176.43 ,176.43,RLA38KNY0AD
Xander Battle,(419) 934-4487,magna.phasellus@yahoo.couk,2/10/1971 8:41,2/10/1971,252-7850 Vivamus Rd.,11531,Cordillera Administrative Region,"Korea, South",1,metus sit amet ante. Vivamus non lorem vitae odio sagittis,3693.33,$286.94 ,286.94,AQF74NRY8IP
Edward Riggs,(723) 943-5002,a.auctor@google.com,12/20/1973 9:40,12/20/1973,"P.O. Box 152, 2823 Nec Rd.",23585,East Region,Philippines,13,consectetuer ipsum nunc id enim. Curabitur massa. Vestibulum accumsan neque,508.33,$292.90 ,292.9,BTS45QAF8HP
Mikayla Merritt,1-583-757-4797,mattis.velit@yahoo.couk,8/22/2017 9:17,8/22/2017,Ap #988-8702 Id Ave,1080,North Chungcheong,"Korea, South",3,"lorem, auctor quis, tristique ac, eleifend vitae, erat. Vivamus nisi.",2798.25,$334.08 ,334.08,PWO54RJR5ON
Demetria Bass,1-408-415-5446,mauris.elit@aol.couk,7/31/1995 9:26,7/31/1995,193-1620 Pede. Road,9314,National Capital Region,Philippines,11,"non, lobortis quis, pede. Suspendisse dui. Fusce diam nunc, ullamcorper",0,$320.66 ,320.66,QWQ36WKN8LC
Winter Watkins,1-615-697-9322,donec@outlook.ca,2/17/1977 8:12,2/17/1977,"P.O. Box 998, 6956 Non Road",132752,Cagayan Valley,Philippines,5,Aliquam fringilla cursus purus. Nullam scelerisque neque sed sem egestas,3585.83,$309.96 ,309.96,DFM62JJZ6WT
Kelly Langley,1-592-149-9357,commodo.auctor@protonmail.net,9/9/2020 9:57,9/9/2020,"P.O. Box 880, 8783 Magna, Road",11440,North-East Region,"Korea, South",3,"magna sed dui. Fusce aliquam, enim nec tempus scelerisque, lorem",163.5,$29.64 ,29.64,RIE82BEL7OV
Stella Trujillo,(307) 838-7819,augue.malesuada.malesuada@yahoo.com,7/20/1994 8:04,7/20/1994,Ap #787-4456 Nam Rd.,1307,South Jeolla,Singapore,13,eu tempor erat neque non quam. Pellentesque habitant morbi tristique,450.33,$133.68 ,133.68,EKO50NGK1ID
Savannah Faulkner,1-855-506-5274,nunc.ac@aol.edu,12/19/2022 8:34,12/19/2022,731-3679 Dolor. Road,23222,North-East Region,Philippines,17,"sit amet, consectetuer adipiscing elit. Aliquam auctor, velit eget laoreet",1639,$38.29 ,38.29,DXY46ENL3XC
Declan Vance,(482) 467-5324,donec.est.nunc@google.com,1/22/2003 9:50,1/22/2003,Ap #538-1483 Pharetra Road,14373,National Capital Region,Philippines,17,"Nulla facilisis. Suspendisse commodo tincidunt nibh. Phasellus nulla. Integer vulputate,",696.33,$198.57 ,198.57,LAR80NBE4ZK
Kirsten Noble,(309) 255-3352,elit.dictum@aol.edu,8/17/1998 8:52,8/17/1998,6727 Urna. Avenue,518963,North Gyeongsang,Philippines,5,"enim, condimentum eget, volutpat ornare, facilisis eget, ipsum. Donec sollicitudin",547,$159.27 ,159.27,TDQ73PHI8RH
Aphrodite Cohen,1-533-411-1371,ac.mattis@protonmail.ca,12/13/1988 8:39,12/13/1988,Ap #537-8606 Semper Avenue,523657,North Region,Singapore,3,"elit, pretium et, rutrum non, hendrerit id, ante. Nunc mauris",3387,$392.18 ,392.18,FSZ16DSU3ZB
Amal Rowe,1-853-936-7678,luctus@hotmail.org,5/30/1985 8:37,5/30/1985,994-6776 Id St.,21466,North Region,"Korea, South",17,"felis purus ac tellus. Suspendisse sed dolor. Fusce mi lorem,",1377.5,$383.02 ,383.02,GGJ73YSX3TB
Morgan Barr,1-275-558-6979,vulputate.lacus@icloud.couk,5/5/1973 9:07,5/5/1973,2899 Tellus Rd.,18824,Gangwon,Singapore,7,"feugiat. Lorem ipsum dolor sit amet, consectetuer adipiscing elit. Aliquam",2412.5,$223.31 ,223.31,ILD12ATP2WZ
Melanie Robertson,(763) 337-7496,mauris.ut@hotmail.edu,1/3/1988 8:33,1/3/1988,Ap #937-5952 Id Rd.,124336,Ilocos Region,"Korea, South",13,ornare. Fusce mollis. Duis sit amet diam eu dolor egestas,1695.33,$418.26 ,418.26,RYT97HTY7OF
Mona Blackwell,(781) 827-1114,nec@protonmail.com,2/18/1978 9:52,2/18/1978,Ap #835-5820 Enim. Road,14859,North Region,Singapore,7,"tellus non magna. Nam ligula elit, pretium et, rutrum non,",,$461.40 ,461.4,PAQ92DXL3VI
Cynthia Ingram,(581) 748-4210,id.sapien@google.edu,11/2/1971 9:00,11/2/1971,7077 Et Av.,674564,South Jeolla,Philippines,13,"ac mattis semper, dui lectus rutrum urna, nec luctus felis",1326,$259.95 ,259.95,MUP81DKG1OE
Isaac Hickman,1-803-895-3745,aliquam.auctor.velit@yahoo.org,2/13/1987 8:51,2/13/1987,373-7622 Sollicitudin St.,27718,Calabarzon,"Korea, South",13,quis turpis vitae purus gravida sagittis. Duis gravida. Praesent eu,751.33,$223.53 ,223.53,TLK35STW2AX
Tallulah Dunn,1-714-431-3519,erat@yahoo.edu,1/11/2002 8:01,1/11/2002,747-8091 Purus. Rd.,5222,Eastern Visayas,Philippines,9,blandit mattis. Cras eget nisi dictum augue malesuada malesuada. Integer,2733,$57.40 ,57.4,XOD17LTI3YQ
Lawrence Newton,(871) 748-9431,diam@outlook.org,10/10/2011 9:45,10/10/2011,Ap #764-1356 Cum Road,16314,Central Region,Philippines,9,"gravida sit amet, dapibus id, blandit at, nisi. Cum sociis",566.42,$320.50 ,320.5,RNK92HFL8VF
Mollie Sparks,(713) 660-6872,a.felis@outlook.net,2/15/2016 9:00,2/15/2016,159-1489 A Ave,16636,Central Region,Philippines,1,dapibus ligula. Aliquam erat volutpat. Nulla dignissim. Maecenas ornare egestas,1195.33,$415.40 ,415.4,WOZ28XEL5MW
Sydney Martin,(963) 621-4316,arcu@icloud.couk,10/17/1978 9:57,10/17/1978,"895-2938 Ac, Street",484437,Southwestern Tagalog Region,"Korea, South",13,Sed eget lacus. Mauris non dui nec urna suscipit nonummy.,173.83,$241.57 ,241.57,SDK83SJT9EI
Wing Armstrong,1-707-602-3879,quam.vel.sapien@yahoo.org,6/10/2022 9:45,6/10/2022,Ap #797-5225 Cursus Road,777653,North-East Region,"Korea, South",7,ipsum primis in faucibus orci luctus et ultrices posuere cubilia,3505.83,$93.80 ,93.8,CND72EFG2KD
Callum Kaufman,(358) 896-3301,sit@protonmail.net,4/13/2020 9:11,4/13/2020,Ap #745-720 Sit Avenue,2266,Central Region,Singapore,19,accumsan neque et nunc. Quisque ornare tortor at risus. Nunc,2940,$187.12 ,187.12,RTH83DHI3CL
Yen Rowland,(646) 377-5306,lectus@hotmail.net,4/6/1989 8:26,4/6/1989,1915 Pellentesque Street,,Bangsamoro,Philippines,13,"in, dolor. Fusce feugiat. Lorem ipsum dolor sit amet, consectetuer",4030,$450.76 ,450.76,GOL04HFB7LC
Hammett Gibbs,(544) 285-7765,nibh.lacinia@outlook.couk,2/18/1984 9:25,2/18/1984,"P.O. Box 943, 2330 Vestibulum, St.",17114,Central Region,"Korea, South",11,eget massa. Suspendisse eleifend. Cras sed leo. Cras vehicula aliquet,995.33,$43.26 ,43.26,UXL67MQV4XC
Aurelia Allen,(314) 585-3332,interdum.ligula@google.org,7/9/2012 9:53,7/9/2012,"868-3312 A, Street",556414,Caraga,Singapore,9,justo. Praesent luctus. Curabitur egestas nunc sed libero. Proin sed,127.5,$44.96 ,44.96,KLN34EOV6BA
Coby Mcfarland,1-235-853-2505,dolor@icloud.couk,5/20/1997 8:30,5/20/1997,"Ap #505-7348 Iaculis, Avenue",9421,Northern Mindanao,Philippines,11,"egestas. Aliquam nec enim. Nunc ut erat. Sed nunc est,",453,$336.44 ,336.44,RSL76GBO3BU
Gavin Stark,1-848-644-4314,nisl@google.net,2/14/1981 8:09,2/14/1981,"P.O. Box 322, 181 Non Av.",937192,North Region,Philippines,19,"tincidunt, neque vitae semper egestas, urna justo faucibus lectus, a",2472.17,$323.52 ,323.52,OPQ64HPO8XW
Chloe Cooke,1-645-475-3243,sed.leo.cras@google.edu,3/9/2010 8:34,3/9/2010,Ap #175-9448 Natoque Av.,655648,Davao Region,Singapore,9,"aliquam, enim nec tempus scelerisque, lorem ipsum sodales purus, in",2457,$221.87 ,221.87,SCY66BHJ8TB
Hedley Sandoval,(322) 222-0115,et.lacinia.vitae@google.couk,7/2/1991 9:39,7/2/1991,284-6528 Etiam Street,153866,Jeju,"Korea, South",19,dolor. Nulla semper tellus id nunc interdum feugiat. Sed nec,588.75,$125.78 ,125.78,MZI74FJY4MU
Dexter Larson,1-388-750-2627,lacus.ut@google.com,3/1/2023 8:41,3/1/2023,746-7796 Rhoncus. Street,338164,South Chungcheong,Philippines,15,tristique senectus et netus et malesuada fames ac turpis egestas.,2486.17,$438.50 ,438.5,CRX11RSI2MJ
Hoyt Leonard,(759) 746-8199,faucibus.ut@google.com,12/22/2005 8:40,12/22/2005,"P.O. Box 131, 8113 Ut Av.",518516,Ilocos Region,Philippines,15,Ut tincidunt vehicula risus. Nulla eget metus eu erat semper,2187.5,$32.94 ,32.94,GFC03LLC3VL
Isabelle Coleman,1-333-675-2750,maecenas.malesuada@yahoo.com,2/27/1993 8:57,2/27/1993,269-4083 Augue Avenue,894478,North Region,Singapore,3,quis diam luctus lobortis. Class aptent taciti sociosqu ad litora,350.25,$94.25 ,94.25,IIH58QXA8UB
Britanni Trevino,1-958-289-7676,et.malesuada@aol.com,2/10/2022 8:49,2/10/2022,Ap #590-189 Luctus Road,26256,North Region,"Korea, South",7,"mauris elit, dictum eu, eleifend nec, malesuada ut, sem. Nulla",348.25,$195.05 ,195.05,HPB07RHI0KR
Janna Pearson,1-939-605-4799,pellentesque@aol.edu,10/12/1977 9:20,10/12/1977,434-903 Imperdiet Rd.,162,Zamboanga Peninsula,"Korea, South",1,vestibulum. Mauris magna. Duis dignissim tempor arcu. Vestibulum ut eros,5.67,$253.97 ,253.97,EFI12QLG5PH
Bruce Hodges,1-576-633-9078,diam.vel@yahoo.net,2/22/1992 8:10,2/22/1992,927-9265 Libero. St.,3858,Central Region,Singapore,3,"Quisque porttitor eros nec tellus. Nunc lectus pede, ultrices a,",1593.67,$458.31 ,458.31,UWK60ESA1YN
Timon Mayo,1-471-858-0636,metus.sit@hotmail.net,2/8/1998 9:33,2/8/1998,4296 Ac Avenue,26517,East Region,"Korea, South",15,"lobortis risus. In mi pede, nonummy ut, molestie in, tempus",2061.67,$323.65 ,323.65,DWF59SGF9UN
Sandra Garrison,(530) 342-7742,integer@yahoo.net,12/9/1992 8:02,12/9/1992,Ap #305-3600 Eleifend Avenue,12741,Bangsamoro,Singapore,7,"metus. In lorem. Donec elementum, lorem ut aliquam iaculis, lacus",1198.67,$358.50 ,358.5,KTB02PDE0PY
Noble Mclaughlin,1-375-146-1534,ipsum.ac@protonmail.couk,2/10/1977 8:57,2/10/1977,287-6136 Nec Avenue,17411,Bangsamoro,Singapore,15,lectus justo eu arcu. Morbi sit amet massa. Quisque porttitor,277.5,$198.85 ,198.85,JLM35RFJ5VS
Lacey Peterson,(544) 811-1557,enim.etiam@protonmail.couk,12/21/1981 8:26,12/21/1981,7834 Ridiculus Rd.,2608,Central Luzon,Philippines,9,Ut nec urna et arcu imperdiet ullamcorper. Duis at lacus.,,$140.18 ,140.18,ZGW34NVY8NU
Michael Adams,1-347-302-9184,sapien.gravida@google.edu,1/22/1994 8:15,1/22/1994,Ap #919-5855 Nonummy Av.,7080,Central Region,"Korea, South",19,"sed, sapien. Nunc pulvinar arcu et pede. Nunc sed orci",363.75,$331.10 ,331.1,VBY64CJY3OE
Georgia Cline,(457) 340-2671,et@outlook.org,2/13/1995 9:49,2/13/1995,"367-1140 Consequat, Street",352932,North Region,Philippines,9,"in, cursus et, eros. Proin ultrices. Duis volutpat nunc sit",827.67,$16.58 ,16.58,CNF40XTP4UR
Christopher Wall,1-895-685-4352,phasellus@yahoo.couk,9/3/2002 9:36,9/3/2002,280-7900 Laoreet Rd.,562879,Gangwon,Philippines,9,"enim, gravida sit amet, dapibus id, blandit at, nisi. Cum",888,$248.78 ,248.78,VXT38WLC2IN
Sage Waller,1-683-417-8642,sed.pharetra@hotmail.net,2/27/1970 8:02,2/27/1970,298-6756 Nulla. Rd.,1694,South Jeolla,Philippines,3,"Quisque porttitor eros nec tellus. Nunc lectus pede, ultrices a,",328.5,$165.44 ,165.44,QGY53CGE4XW
Sonya Hampton,(728) 910-7430,metus.vitae@outlook.edu,12/27/2003 8:32,12/27/2003,Ap #556-6409 Lectus Street,332955,West Region,"Korea, South",1,Sed eget lacus. Mauris non dui nec urna suscipit nonummy.,5.75,$212.17 ,212.17,IVH85ELX4YJ
MacKensie Sandoval,1-697-966-2558,ac.metus@hotmail.org,12/16/1994 9:51,12/16/1994,677-5575 Egestas. Avenue,686891,North Gyeongsang,Philippines,9,erat vel pede blandit congue. In scelerisque scelerisque dui. Suspendisse,845,$326.40 ,326.4,MPI26QHM0IA
Richard Avery,(237) 405-1143,mus.proin.vel@aol.net,12/1/1977 8:16,12/1/1977,249-6609 Proin Road,633689,North Jeolla,"Korea, South",17,"pede sagittis augue, eu tempor erat neque non quam. Pellentesque",500.67,$191.91 ,191.91,ESK08NFM8DB
Erasmus Mcpherson,1-331-993-5512,adipiscing.non@google.edu,1/5/2018 8:29,1/5/2018,389-8124 Eget Road,826342,Eastern Visayas,Philippines,9,"urna, nec luctus felis purus ac tellus. Suspendisse sed dolor.",1217.08,$48.10 ,48.1,LVL57TFJ7FC
Nathan Riley,(974) 571-4445,dis.parturient@protonmail.couk,12/4/1978 8:53,12/4/1978,Ap #629-4864 Eros. Street,6233,Southwestern Tagalog Region,"Korea, South",11,"et tristique pellentesque, tellus sem mollis dui, in sodales elit",,$236.34 ,236.34,VJJ11KIY2UH
Noelle Pugh,(585) 252-8884,venenatis.vel@icloud.com,3/3/1970 8:04,3/3/1970,579-2599 Luctus Rd.,249275,West Region,Philippines,17,"risus a ultricies adipiscing, enim mi tempor lorem, eget mollis",144.67,$353.54 ,353.54,TYL57FFA4NH
Bevis Turner,(443) 736-3013,tincidunt@protonmail.edu,1/23/2011 8:47,1/23/2011,"P.O. Box 200, 8005 Rutrum St.",17538,Gangwon,Philippines,15,nunc interdum feugiat. Sed nec metus facilisis lorem tristique aliquet.,786.75,$421.94 ,421.94,QCN46LZG7TG
Daniel Vaughn,1-943-727-7664,nec@protonmail.ca,1/17/1990 8:53,1/17/1990,800-2787 Ornare St.,847242,Bangsamoro,Philippines,13,euismod est arcu ac orci. Ut semper pretium neque. Morbi,1721.67,$318.22 ,318.22,MGJ53XRP2MH
Gray Burt,1-252-491-7043,ornare.tortor.at@protonmail.ca,1/18/2007 8:07,1/18/2007,Ap #188-4979 Libero. Street,23027,Jeju,"Korea, South",19,Duis sit amet diam eu dolor egestas rhoncus. Proin nisl,1698,$313.52 ,313.52,GWP21QUJ5HZ
Barbara Mitchell,(581) 752-6653,sed.sem.egestas@hotmail.com,11/10/2014 9:46,11/10/2014,Ap #199-4717 Nascetur Road,4400,Bangsamoro,Philippines,7,"eu erat semper rutrum. Fusce dolor quam, elementum at, egestas",2010.17,$158.82 ,158.82,NQB06TXY8ZQ
Stacey Anderson,(798) 678-9415,luctus@outlook.com,1/23/2001 8:58,1/23/2001,"P.O. Box 741, 7402 Non, Av.",8897,Central Region,Philippines,19,erat. Vivamus nisi. Mauris nulla. Integer urna. Vivamus molestie dapibus,2253,$444.29 ,444.29,ADO59RXW5CH
Herman Carrillo,1-847-933-1431,per@google.ca,1/26/2013 8:03,1/26/2013,831-7421 In Av.,557572,East Region,Philippines,3,"magnis dis parturient montes, nascetur ridiculus mus. Proin vel nisl.",107.92,$384.46 ,384.46,JJE68LXD6OJ
Daniel Bonner,(706) 849-7002,accumsan@protonmail.com,10/5/2013 8:04,10/5/2013,"P.O. Box 754, 6903 Rutrum Street",685573,North Chungcheong,Singapore,11,amet risus. Donec egestas. Aliquam nec enim. Nunc ut erat.,0,$198.85 ,198.85,UCK49CEN4GS
Katelyn Norris,1-541-340-3566,luctus@outlook.couk,1/11/1984 9:38,1/11/1984,Ap #665-9531 Cras Rd.,8126,South Jeolla,"Korea, South",13,imperdiet ornare. In faucibus. Morbi vehicula. Pellentesque tincidunt tempus risus.,,$400.63 ,400.63,TXT91XZT0LN
Jeremy Moran,1-261-229-1761,egestas.blandit@icloud.net,9/10/2011 9:49,9/10/2011,9382 Dictum Avenue,8934,South Gyeongsang,Philippines,15,"adipiscing lobortis risus. In mi pede, nonummy ut, molestie in,",1416.25,$48.50 ,48.5,FYO52KRB2NC
Laith Ortega,(876) 154-7450,a.odio@google.com,7/6/1983 9:09,7/6/1983,"P.O. Box 313, 9549 Quam Ave",8414,Central Region,"Korea, South",17,"est ac mattis semper, dui lectus rutrum urna, nec luctus",0,$225.58 ,225.58,SHV43WJT8RV
Erasmus Morrow,(631) 363-8299,arcu.morbi@icloud.couk,5/4/1984 8:10,5/4/1984,Ap #608-5673 Quis Road,6539,North Region,Philippines,15,Nunc commodo auctor velit. Aliquam nisl. Nulla eu neque pellentesque,711.83,$172.39 ,172.39,LGX23ZEQ3DY
Ethan Koch,1-274-982-3999,pede.sagittis.augue@hotmail.org,1/30/2017 8:06,1/30/2017,Ap #308-6101 Tempor Rd.,299325,Gyeonggi,Philippines,13,velit eu sem. Pellentesque ut ipsum ac mi eleifend egestas.,,$202.61 ,202.61,JQK58EAX4QW
Erica Green,1-346-261-5751,mollis.phasellus@outlook.ca,10/20/1978 9:21,10/20/1978,Ap #539-5427 Suspendisse Avenue,744373,Caraga,"Korea, South",13,quis turpis vitae purus gravida sagittis. Duis gravida. Praesent eu,1218.33,$58.41 ,58.41,SOA84MMI0NI
Ryder Manning,1-549-753-8134,amet.metus@outlook.couk,7/2/2003 8:06,7/2/2003,Ap #364-175 Sed Street,833,South Jeolla,Singapore,15,mauris sagittis placerat. Cras dictum ultricies ligula. Nullam enim. Sed,265,$280.56 ,280.56,VMN78BBE8OS
Marny Kaufman,1-755-832-9145,magna.a@yahoo.org,1/12/2007 9:00,1/12/2007,3692 Nec Rd.,7077,West Region,Singapore,15,Sed eget lacus. Mauris non dui nec urna suscipit nonummy.,,$6.93 ,6.93,ZZT21DUF8VN
Channing Swanson,1-757-936-8456,lobortis.class@icloud.org,9/7/2016 8:17,9/7/2016,Ap #245-4751 Malesuada Rd.,,North Region,Singapore,15,adipiscing lacus. Ut nec urna et arcu imperdiet ullamcorper. Duis,2805.83,$329.21 ,329.21,MSF26RRO8IF
Emi Marquez,(508) 600-9241,lacinia.at.iaculis@yahoo.com,8/31/1997 8:17,8/31/1997,"P.O. Box 458, 2986 Risus St.",17175,North-East Region,Philippines,1,"fermentum vel, mauris. Integer sem elit, pharetra ut, pharetra sed,",798.33,$471.66 ,471.66,OIQ26NYC6TA
Signe Everett,1-623-400-4577,venenatis.lacus.etiam@hotmail.couk,7/18/2006 8:50,7/18/2006,583-4286 Cursus. St.,,East Region,"Korea, South",17,"consectetuer rhoncus. Nullam velit dui, semper et, lacinia vitae, sodales",2174.5,$360.47 ,360.47,FHJ84YKW7WB
Colby Bridges,1-414-879-7052,nam.porttitor@icloud.edu,7/31/1998 9:33,7/31/1998,8956 Sem Ave,459646,West Region,"Korea, South",7,Vestibulum accumsan neque et nunc. Quisque ornare tortor at risus.,1083.75,$202.98 ,202.98,UZQ78RKJ0GI
Gary Buck,(347) 751-3567,vestibulum@yahoo.couk,7/4/1977 9:43,7/4/1977,Ap #813-3258 Quisque Rd.,,East Region,"Korea, South",13,"condimentum eget, volutpat ornare, facilisis eget, ipsum. Donec sollicitudin adipiscing",2384.08,$444.92 ,444.92,XMM58GWX2HI
Harlan Bird,(924) 586-3470,tincidunt.donec@google.com,11/7/2017 8:39,11/7/2017,"P.O. Box 301, 747 Nisi St.",143667,South Chungcheong,"Korea, South",17,"auctor ullamcorper, nisl arcu iaculis enim, sit amet ornare lectus",,$470.59 ,470.59,RFV18HMZ9OM
Yoko Sharpe,(689) 353-2174,mauris.quis@protonmail.net,7/1/1985 8:24,7/1/1985,"Ap #251-8363 Dolor, Av.",861226,Gyeonggi,"Korea, South",13,vitae purus gravida sagittis. Duis gravida. Praesent eu nulla at,561,$72.94 ,72.94,XXT88NPG5OU
Dante Simmons,(983) 455-6568,facilisis.vitae.orci@icloud.com,4/23/1986 9:58,4/23/1986,728-8990 Sit Rd.,774,North Region,Philippines,5,"lacinia. Sed congue, elit sed consequat auctor, nunc nulla vulputate",212.58,$152.05 ,152.05,FJY32GTW4LU
Jenette Bates,1-711-218-6066,facilisis.lorem@protonmail.couk,6/28/2013 8:57,6/28/2013,"P.O. Box 180, 1738 Blandit St.",,North Jeolla,"Korea, South",5,"vulputate eu, odio. Phasellus at augue id ante dictum cursus.",1610,$46.34 ,46.34,UKZ36YII6UE
Brianna Ballard,1-174-764-5483,dolor.fusce@aol.net,6/21/2006 8:18,6/21/2006,"P.O. Box 101, 6069 Semper, Road",683672,North Gyeongsang,Singapore,1,sit amet massa. Quisque porttitor eros nec tellus. Nunc lectus,900,$103.19 ,103.19,HJQ21DSB1WT
Griffith Riddle,1-630-369-5668,nisi@hotmail.org,11/17/2011 9:02,11/17/2011,131-4915 Pede. Street,372349,North Jeolla,Singapore,15,"eleifend egestas. Sed pharetra, felis eget varius ultrices, mauris ipsum",,$428.50 ,428.5,XMS08UFQ1MS
Beverly Guerrero,1-175-226-5642,sagittis.nullam.vitae@protonmail.couk,10/22/2015 8:09,10/22/2015,458-9028 Enim. St.,361716,Caraga,"Korea, South",11,mollis. Duis sit amet diam eu dolor egestas rhoncus. Proin,976.67,$50.79 ,50.79,YQT66SFY1FC
Ahmed Sullivan,(476) 946-2476,dolor.dolor.tempus@protonmail.ca,8/6/1983 8:19,8/6/1983,"6642 Congue, Av.",7846,West Region,Singapore,19,risus. Donec egestas. Duis ac arcu. Nunc mauris. Morbi non,426.75,$78.96 ,78.96,POB18RGG1OL
May Dudley,1-456-984-8506,vulputate.mauris.sagittis@hotmail.ca,12/20/1997 9:55,12/20/1997,"P.O. Box 911, 3815 Velit Avenue",642657,Zamboanga Peninsula,"Korea, South",15,dolor vitae dolor. Donec fringilla. Donec feugiat metus sit amet,,$265.26 ,265.26,SVM16YFN4QG
Deirdre Jacobson,1-648-251-1340,posuere.cubilia.curae@protonmail.net,9/25/1992 8:36,9/25/1992,"P.O. Box 808, 2481 Tincidunt Ave",6984,Soccsksargen,Philippines,9,"vitae semper egestas, urna justo faucibus lectus, a sollicitudin orci",1099.17,$305.18 ,305.18,QNU58HJJ5WW
Kiona Vazquez,1-207-271-8384,elit.fermentum@yahoo.edu,7/5/2017 8:32,7/5/2017,396-1530 Cursus. Ave,8584,North Gyeongsang,"Korea, South",9,Aenean eget metus. In nec orci. Donec nibh. Quisque nonummy,2556.67,$385.88 ,385.88,XRY51MQN2PZ
Robert Rivera,1-262-452-0136,non.lacinia@google.org,4/3/2005 8:49,4/3/2005,131-2615 Nec Av.,14568,Zamboanga Peninsula,Singapore,19,"laoreet, libero et tristique pellentesque, tellus sem mollis dui, in",165.75,$491.05 ,491.05,RXR62DCS5VM
Imelda Wilkins,1-833-743-6908,vestibulum.nec@outlook.ca,7/17/1975 8:06,7/17/1975,Ap #229-2605 Odio. Road,4125,Gangwon,"Korea, South",11,"vel est tempor bibendum. Donec felis orci, adipiscing non, luctus",2967.33,$294.16 ,294.16,YEX32FYU9VT
